country,search_region_code,search_language,channel_country,default_language,default_audio_language,video_id,url,title,upload_date,published_at,channel,channel_id,view_count,like_count,comment_count,description
Denmark,DK,da,US,en,,gpC2J9EdMVk,https://www.youtube.com/watch?v=gpC2J9EdMVk,In 2015 The World Health Organization Said Glyphosate Was A Probable Human Carcinogen,2019-12-17,2019-12-17T14:00:10Z,The Real Truth About Health,UCp_ShZAUGtFLpYkgcTrayRQ,1102,70,8,"In 2015 The World Health Organization Said Glyphosate Was A Probable Human Carcinogen Decades of Deceit - A Critical Eye on Pesticides, Science and Industry by Carey Gillam Carey Gillam is a veteran investigative journalist, researcher and writer with more than 25 years of experience covering corporate news, including 17 years as a senior correspondent for Reuters international news service. She has specialty knowledge regarding the rise of biotech crop technology and associated rise in pervasive pesticide use in our food production system. Gillam works now as research director for the nonprofit consumer group U.S. Right to Know. Gillam has won several industry awards for her work and been recognized as one of the top journalists in the country covering food and agriculture. She is a frequent commentator on broadcast programs and appears as a public speaker at conferences and universities to share her knowledge of hotly debated issues involving food and agriculture. Her new book “Whitewash-The Story of a Weed Killer, Cancer and the Corruption of Science” was released in October 2017. Connect with The Real Truth About Health http://www.therealtruthabouthealth.com/ https://www.facebook.com/The-Real-Truth-About-Health-467500836655781/ https://www.instagram.com/therealtruthabouthealth/ https://twitter.com/RTAHealth Passionate believers in whole food plant based diets, no chemicals, minimal pharmaceutical drugs, no GMO's. Fighting to stop climate change and extinction. Please support the sponsors of our conference http://www.therealtruthabouthealthconference.com/sponsors/"
Denmark,DK,da,DK,en,,cw0AmyDfmMw,https://www.youtube.com/watch?v=cw0AmyDfmMw,Customer Story: Beau Clugston from Iluka in Copenhagen | Superb,2020-09-21,2020-09-21T10:19:40Z,Superb,UCOqBlMtptmi5gryABN52juw,868,4,0,"At Iluka, there are no rules. We had a chat with Beau Clugston to learn more about the story behind the opening of his bistro and understand why he decided to work with Superb’s all-in-one platform. ─────────────────────────── Ready to take your restaurant to the next level? Web: https://www.superbexperience.com/ Facebook: https://www.facebook.com/superbexperience/ Instagram: https://www.instagram.com/superbexperience/ Iluka: http://restaurantiluka.dk/"
Denmark,DK,da,CN,en,,WAQ4fIFBH3M,https://www.youtube.com/watch?v=WAQ4fIFBH3M,Three-minute tours with global diplomats at #CIIE: Ray Smith at British Embassy in Beijing,2020-11-09,2020-11-09T12:20:34Z,New China TV,UCHBDXQDmqnaqIEPdEapEFVQ,1605,79,5,"Watch this three-minute tour with Ray Smith, the Agriculture Food and Drink Counsellor at the British Embassy in Beijing, and take a quick peek at some of the UK's delicious goods and innovative products available at the third China International #ImportExpo in Shanghai! #CIIE"
Denmark,DK,da,,en,en-US,JbgfF0_jU9o,https://www.youtube.com/watch?v=JbgfF0_jU9o,Auto fill and seal machine,2020-09-28,2020-09-28T03:51:30Z,Melody Lee,UC80xk5d-eSLD-G15JwOPHgA,3882,11,1,"This machine can fill various cream hand sanitizer,facial cream,hand cream ,ointment and so on. ,PLC+touch screen system. Guangzhou Change Machinery Co.,Ltd. https://gzchange.en.made-in-china.com/ Phone/whats app:+86 13570531802 Skype: melody04531 Melody Lee Email: sales@changemachinery.com"
Denmark,DK,da,DK,en,en-GB,3yCArOqYlVY,https://www.youtube.com/watch?v=3yCArOqYlVY,Vegan Triple Bean burger recipe,2020-03-05,2020-03-05T09:51:39Z,Lantmännen Unibake,UCauMqglinDUA4oXrL0fyoSQ,266,4,0,Full vegan recipe here: https://www.lantmannen-unibake.com/Schulstad-Bakery-Solutions/Inspiration/Recipes/
Denmark,DK,da,DE,en,en,B5Q1J5c8oNc,https://www.youtube.com/watch?v=B5Q1J5c8oNc,3D Printed Desk Art - Coffee Floating Cup,2020-11-20,2020-11-20T22:37:10Z,marsgizmo,UCMgE5ns0gsEvbYiiCwnyaDA,98632852,1247380,3630,"And thank you very much to all my Subscribers! ❤️ What shall I print next? Leave a comment 😉 If you enjoy the videos, please support me with a Like and Subscribe, it helps me create more videos.. and I'll be forever grateful 😊❤️ _ _ _ _ _ _ _ _ _ _ _ _ _ _ _ _ _ _ _ _ _ Good entry level 3D Printer which I recommend 👉: https://amzn.to/34mREtA _ _ _ _ _ _ _ _ _ _ _ _ _ _ _ _ _ _ _ _ _ My Instagram Channel: https://www.instagram.com/marsgizmo/ _ _ _ _ _ _ _ _ _ _ _ _ _ _ _ _ _ _ _ _ _ 3D model used in this video: https://www.thingiverse.com/thing:3689716 #marsgizmo #shorts"
Denmark,DK,da,DK,da,,ynR41U54XEU,https://www.youtube.com/watch?v=ynR41U54XEU,Unboxing SAS' new vegan menu,2018-11-14,2018-11-14T17:16:24Z,Veganer.nu,UCx1NiwyHgUyGorY8sjbOBgw,562,6,2,"Danish: Scandinavian Airline System (SAS) tester en ny, lækker vegansk menu til deres plus-kunder på ture længere end 80 minutter. Den smukke indpakning minder os om en dyr og eksklusiv gadget :-D Retten er også rigtig lækker! Heldige rejsende! English: Scandinavian Airline System (SAS) is testing a new, delicious all-vegan menu for their ""plus"" customers on flights longer than 80 minutes. The beautiful packaging reminds us of an expensive and exclusive tech gadget 😃 The dish is delicious too! Lucky travelers ❤ #vegan #veganer #vegansk #veganskmad #kærligmad #sas #flymad #planefood #veganfood #veganlife #veganlifestyle #plantbased #veganernu"
Denmark,DK,da,SE,en,,axIWij0a1-w,https://www.youtube.com/watch?v=axIWij0a1-w,Exploring Copenhagen - Vegan food and zero waste groceries,2019-07-10,2019-07-10T19:56:35Z,Tess Waltenburg,UCjDjWuf9CRWizyjo679opig,1313,198,5,"It's time for a day trip! Today me and @earthwanderess have been exploring lovely Copenhagen. Want more eco friendly, slow living inspiration? Check out my instagram account and (Swedish) blog: http://tesswaltenburg.com/ https://www.instagram.com/tess.waltenburg"
Denmark,DK,da,US,en,en,MJCiBuRymPM,https://www.youtube.com/watch?v=MJCiBuRymPM,Why Massive Food Companies Are Going Plant-Based | Opinions | NowThis,2019-10-22,2019-10-22T14:00:04Z,NowThis Impact,UCn4sPeUomNGIr26bElVdDYg,13337,243,46,"The massive food companies that provide meals for schools, hospitals, and arenas are adopting more plant-based recipes. » Subscribe to NowThis: http://go.nowth.is/News_Subscribe » Sign up for our newsletter KnowThis to get the biggest stories of the day delivered straight to your inbox: https://go.nowth.is/KnowThis In US news and current events today, Josh Balk, VP of Farm Animal Protection for the Humane Society, spoke to NowThis News about efforts being made at major food providers to include more plant based recipes. With companies like Impossible Foods teaming up with Burger King, and other fast food restaurants like Carl's Jr. including plant based diet options, the interest in healthy lifestyle whole food options that can fight heart disease and more has reached peak interest in America. Now food companies like Sodexo, Compass Group, and Aramark are jumping on the plant based wagon. #PlantBased #Food #Vegan #Vegetarian #News #NowThis #NowThisNews Connect with NowThis » Like us on Facebook: http://go.nowth.is/News_Facebook » Tweet us on Twitter: http://go.nowth.is/News_Twitter » Follow us on Instagram: http://go.nowth.is/News_Instagram » Find us on Snapchat Discover: http://go.nowth.is/News_Snapchat NowThis is your premier news outlet providing you with all the videos you need to stay up to date on all the latest in trending news. From entertainment to politics, to viral videos and breaking news stories, we’re delivering all you need to know straight to your social feeds. We live where you live. http://www.youtube.com/nowthisnews @nowthisnews"
Denmark,DK,da,,en,en,1skKbWZe3WE,https://www.youtube.com/watch?v=1skKbWZe3WE,A Meat Tax to Make Fruits and Vegetables Cheaper?,2019-04-11,2019-04-11T00:34:21Z,Mic the Vegan,UCGJq0eQZoFSwgcqgxIE9MHw,27086,2852,582,"A quick, infographic look at the research on the effects that a meat tax would have on disease and how using that tax to fund subsidies for fruits and vegetables would influence health outcomes. - Links and Sources - Support Me Here: https://www.patreon.com/micthevegan My Cookbook: https://micthevegan.com/product/mics-whole-vegan-cookbook/ https://www.facebook.com/micthevegan https://www.instagram.com/micthevegan - @micthevegan https://plantspace.org TIY Tiny House Channel: https://www.youtube.com/channel/UCYhthOBh4_459pAge62at8g Amazon Wish List: http://a.co/aTEpQpK Fact Sheet Download - PDF: https://drive.google.com/open?id=1mL0kP2m-zC7jhyvm54mNfJUEYpabNxli JPEG: https://drive.google.com/open?id=1nhBbT_x1YtPfNx3T0A18pHRCBrD7Vkhd Smoking Tax and Subsidy Quote: https://www.lung.org/our-initiatives/tobacco/taxes/ Colorectal Cancer 2nd Leading Cancer: https://www.cdc.gov/cancer/colorectal/statistics/index.htm Official List of Fact Sheet References: 1. Cassady, D., Jetter, K., and Culp, J. (2007). Is Price a Barrier to Eating More Fruits and Vegetables for Low- Income Families? Journal of the American Dietetic Association, 107(11), 1909-1915. https://jandonline.org/article/S0002-8223(07)01625-2/pdf 2. American Cancer Society. (2019). Key Statistics for Colorectal Cancer. Retieved from https://www.cancer.org/cancer/colon-rectal-cancer/about/key-statistics.html 3. CDC. (2011). Colorectal Cancer. Retrieved from https://www.cdc.gov/vitalsigns/cancerscreening/colorectalcancer/index.html 4. Wang, X., Ouyang, Y., Liu J... Hu, F. (2014). Fruit and vegetable consumption and mortality from all causes, cardiovascular disease, and cancer: systematic review and dose-response meta-analysis of prospective cohort studies. BMJ, 349, g4490. https://www.ncbi.nlm.nih.gov/pubmed/25073782 5. Daniel, J., Cross, A., Koebnick, C., and Sinha, R. (2010). Trends in meat consumption in the United States. Public Health Nutr, 14(4), 575–583. https://www.ncbi.nlm.nih.gov/pmc/articles/PMC3045642/ 6. IBISWorld. (2018). Meat Markets Industry in the US. Retrieved from https://www.ibisworld.com/industrytrends/ market-research-reports/retail-trade/food-beverage-stores/meat-markets.html 7. Springmann M, Mason-D’Croz D, Robinson S, Wiebe K, Godfray HCJ, Rayner M, et al. (2018) Health motivated taxes on red and processed meat: A modelling study on optimal tax levels and associated health impacts. PLoS ONE 13(11), e0204139. https://doi.org/10.1371/journal.pone.0204139 8. Pearson-Stuttard, J., Bondozs, P., Rehm, C... O’Flaherty, M. (2017). Reducing US cardiovascular disease burden and disparities through national and targeted dietary policies: A modelling study. PLOS Medicine 14(6), e1002311. https://www.ncbi.nlm.nih.gov/pubmed/28586351 Intro/Outro Song: Sedução Momentânea by Roulet: http://freemusicarchive.org/music/Roulet/Beats_dAmor/Roulet_-_Beats_dAmor_-_07_Seduo_Momentnea"
Denmark,DK,da,US,en,en,-M1ycTSCtWg,https://www.youtube.com/watch?v=-M1ycTSCtWg,Radical Vegans Disrupt Patrons at A Local Hamburger Restaurant in Copenhagen Acadianahamburger,2019-10-09,2019-10-09T22:00:11Z,Live And Local,UCMeRQvE1PoQP7r2p0NRAa1Q,863,6,2,"Radical Vegans Interupt Patrons at A Local Hamburger Restaurant in Copehagen - Acadianahamburger.com #meat #beef #stopmessingwithourmeat #aacadianahamburger Danish man says ""I don't think so when a group of Protesting Vegans placed a standing wall in front of a hamburger restaurant in Copenhagen. See how it goes for them by clicking play. Live Music, Festivals, & Events in the Lafayette, LA & Overall Acadiana area in Louisiana. Contact Us anytime or add to the calendar link anytime at https://liveandlocalacadiana.com/live-music-calendar/ Subscribe To Our Feeds by clicking the subscribe here area on the bottom of the website. Be in the know for things to do and for live music today Live And Local Acadiana http://www.liveandlocalacadiana.com/ - Live Music, Events, & Festivals in Acadiana. Find Us 24 hours a day on Rock Louisiana and Radio Louisiana by downloading the app today on the website. Thank you for supporting Louisiana Music and Musicians!"
Denmark,DK,da,DK,en,en,fx8NzQqMpjo,https://www.youtube.com/watch?v=fx8NzQqMpjo,How to make the best of grocery shopping in Denmark,2019-10-20,2019-10-20T17:00:07Z,Student Survival Guide,UC6bl28l2WcU80Ry2NUMcJBg,15492,420,27,"Here is what we learned after 4 years about shopping in Denmark! Living in Denmark is expensive in comparison to the majority of the countries in Europe. The rent is higher, transportation with other services is also quite pricey, and on top of that, you still need to eat. Buying your groceries in a Supermarket is the obvious choice, but which one to choose? Is the nearest option always the best one? Let us give you a couple of tips regarding this topic. 💸 Secure your income after university: https://www.studentsurvivalguide.dk/posts/compare-and-choose-best-a-kasse-services-in-denmark-for-international-students 📲 Get cheap Danish SIM card, from $2: https://www.studentsurvivalguide.dk/posts/best-and-cheapest-sim-cards-in-denmark 📚 Need study books? Check out Saxo, larges DK bookstore: https://studentsurvivalguide.dk/offer/saxo-dk Supermarkets When it comes to shopping for basic groceries, all you need to remember is that LIDL with Rema 100 are the cheapest supermarkets. Netto, Bilka, and Super Brugsen are the most expensive options. This was found by the Danish webpage Detailfolk.dk, which create a study, where they shopped 30 basic everyday items and compared their prices. LIDL and Rema also allow you to save even more on the bakery products, by discounting them in the last 30 mins of their opening hours. The same applies to the salads. Too Good to Go Another great way how to get a lot of food for low prices is by using the Too Good To Go app. Their vision is to reduce the food waste, and so they allow you to purchase products from the local stores, which would have been thrown out. You can usually purchase pasty, vegetables or fruits. Bakeries, butcheries, etc… Even though everybody is doing their groceries in supermarkets, you can still find a great number of bakeries, butcheries or other specific shops all around the Horsens. The prices are usually higher in comparison to the supermarkets, but you can be sure that everything they sell is the highest quality product from the local suppliers. Pick from the ground Last, but not least is another great way how to get a lot of food for dirt cheap. And it is picking it on your own form the dirt. Around the city, you can find a farm, which allows you to pick everything by yourself. You can usually get your hands on a lot of potatoes, strawberries or some other veggies. Afterwards, you can just pay with cash or mobile pay. It is tough work, but the results are worth it. These would be all the essentials you need to know. We hope you liked the video and that you learned something new from it. If we helped you to save some money or just showed you new alternatives, feel free to give us a like, comment or share us. We hope this video series will make your stay ultimately better. Enjoy! If you have any questions, post them in the comments under this video or on our Facebook. Some other students might jump into the conversation and help you :) x x x Also, stop by on our Facebook page, which aside from this video will contain some extra content 🙂 https://www.facebook.com/StudentSurvivalG/ and let us know what would you like to see! We hope you'll have an amazing time in Denmark! Thank you for your support! Jaroslav Vyhnak (host, editor) Michael Mares (host, writer) Radim Theiner (camera, production)"
Denmark,DK,da,,en,,FFEn-EmbJzQ,https://www.youtube.com/watch?v=FFEn-EmbJzQ,The Organic Way - The Danish Model,2019-02-25,2019-02-25T20:42:13Z,Organic Denmark,UCKqOFrvjZWVkHqBI5UPdi8w,871,8,0,This film illustrates how Denmark’s ambitious organic policies have resulted in Denmark being the country in the world where organic food has the largest market share. The film gives a thorough overview of the organic sector in Denmark and the organic sector’s positions of strength.
Denmark,DK,da,DK,en,,WLWOFwA40dE,https://www.youtube.com/watch?v=WLWOFwA40dE,what we ate in copenhagen I VEGAN + CHEAP,2018-03-27,2018-03-27T13:00:02Z,trè,UCnE59mZEINCZmhLSP9V-TAQ,357,21,20,"we love food :) _________________ a small insight of our trip to copenhagen, where we visited some lovely cafes and spent most of the time eating - as usually. if you are visiting the city this will guide you to the delicious and fairly cheap cafes and maybe even inspire you to cook some quick and easy AND CHEAP meals for yourself. if not, then enjoy the #foodporn LIST OF CAFES// - paludan bookcafé: vegan options - green burger: vegan fastfood - the laundromat café: vegan option NOT recommended as you'll leave the place hungry however it's a cool and retro café and you can ask them to remove the animal products from some of the dishes for more vegan options - taste of taiwan: delicious bubble tea and milk tea!! - nicecream: all vegan, super delicious and fairly cheap MUSIC// Pryces - Reserved Song - https://youtu.be/Igv5gGaFa2U Pryces - http://smarturl.it/Pryces"
Denmark,DK,da,DK,en,en,vjqp4GAwojI,https://www.youtube.com/watch?v=vjqp4GAwojI,MY PROBLEM WITH SOCIAL MEDIA ACTIVISM // What's Wrong With Reusable Straws,2018-09-12,2018-09-12T09:09:26Z,Gittemary Johansen,UCFQ_CWYmt-ScWaPX4YfnBrQ,7147,380,32,Support my work on Patreon at https://www.patreon.com/Gittemary ---------------------------------------------------------------------------------------------------- MY BLOG - http://www.gittemary.com/ FACEBOOK - https://www.facebook.com/Gittemary ---------------------------------------------------------------------------------------------------- INSTA - http://www.instagram.com/Gittemary ---------------------------------------------------------------------------------------------------- PINTEREST - https://www.pinterest.dk/gittemary/ TUMBLR - https://www.tumblr.com/blog/gittemary ---------------------------------------------------------------------------------------------------- ❀ FAQ: ✿ Get To Know Me Tags: https://www.youtube.com/watch?v=efdsix3EYqg ✿ Is Living Zero Waste Expensive?: https://www.youtube.com/watch?v=RwKuMa1AfQQ&t=2s ✿ Zero Waste Laundry Routine: https://www.youtube.com/watch?v=kVQUENlGWGQ ✿ How To Be Zero Waste When Living With Your Parents: https://www.youtube.com/watch?v=QX0KdKCNclQ&t=14s ✿ How To Get Started: https://www.youtube.com/watch?v=mvC1T1x42T4&t=1s ✿ Hair and Skin Care Routine: https://www.youtube.com/watch?v=zDpRus3-8i8 ---------------------------------------------------------------------------------------------------- ❀ ZERO WASTE BEGINNER'S TIPS: ✿ 10 Steps To Zero Waste: https://www.youtube.com/watch?v=2Z0XSUVOp7s ✿ How To Be A Conscious Consumer: https://www.youtube.com/watch?v=uvl4T99pN5o&t=3s ✿ How To Break Bad Consumer Habits: https://www.youtube.com/watch?v=kc1S5dn6Ft8&t=25s ✿ Your Convenience is Relevant: https://www.youtube.com/watch?v=xZwuonpuut8&t=1s ---------------------------------------------------------------------------------------------------- ❀ ZERO WASTE FOOD: ✿ Come With Me When I Shop Package Free: https://www.youtube.com/watch?v=pwASMqQbdHs&t=3s ✿ My Zero Waste Pantry: https://www.youtube.com/watch?v=TEvFmQxdeKI ✿ My Vegetarian Journey: https://www.youtube.com/watch?v=EdETbpNRbhY&t=4s
Denmark,DK,da,DK,da,,8cFA6UwtaNg,https://www.youtube.com/watch?v=8cFA6UwtaNg,Copenhagen - Best in Travel 2019 - the food scene,2018-10-23,2018-10-23T09:54:49Z,VisitCopenhagen,UCQ21muzYjF3pnXBKhOrRrlA,5124,10,0,
Denmark,DK,da,DK,en,en,q1JlCLbFQUE,https://www.youtube.com/watch?v=q1JlCLbFQUE,THE 5 BEST ZERO WASTE PRODUCTS // i did not expect to love these,2019-08-10,2019-08-10T10:25:41Z,Gittemary Johansen,UCFQ_CWYmt-ScWaPX4YfnBrQ,33334,1352,39,Support my work on Patreon at https://www.patreon.com/Gittemary 5 products I dislike: https://www.youtube.com/watch?v=j5C28zHn688 Homemade lotion: https://www.youtube.com/watch?v=Cnb6pYkK_YY ---------------------------------------------------------------------------------------------------- MY BLOG - http://www.gittemary.com/ FACEBOOK - https://www.facebook.com/Gittemary ---------------------------------------------------------------------------------------------------- INSTA - http://www.instagram.com/Gittemary ---------------------------------------------------------------------------------------------------- PINTEREST - https://www.pinterest.dk/gittemary/ TUMBLR - https://www.tumblr.com/blog/gittemary ---------------------------------------------------------------------------------------------------- ❀ FAQ: ✿ Get To Know Me Tags: https://www.youtube.com/watch?v=efdsix3EYqg ✿ Is Living Zero Waste Expensive?: https://www.youtube.com/watch?v=RwKuMa1AfQQ&t=2s ✿ Zero Waste Laundry Routine: https://www.youtube.com/watch?v=kVQUENlGWGQ ✿ How To Be Zero Waste When Living With Your Parents: https://www.youtube.com/watch?v=QX0KdKCNclQ&t=14s ✿ How To Get Started: https://www.youtube.com/watch?v=mvC1T1x42T4&t=1s ✿ Hair and Skin Care Routine: https://www.youtube.com/watch?v=zDpRus3-8i8 ---------------------------------------------------------------------------------------------------- ❀ ZERO WASTE BEGINNER'S TIPS: ✿ 10 Steps To Zero Waste: https://www.youtube.com/watch?v=2Z0XSUVOp7s ✿ How To Be A Conscious Consumer: https://www.youtube.com/watch?v=uvl4T99pN5o&t=3s ✿ How To Break Bad Consumer Habits: https://www.youtube.com/watch?v=kc1S5dn6Ft8&t=25s ✿ Your Convenience is Relevant: https://www.youtube.com/watch?v=xZwuonpuut8&t=1s ---------------------------------------------------------------------------------------------------- ❀ ZERO WASTE FOOD: ✿ Come With Me When I Shop Package Free: https://www.youtube.com/watch?v=pwASMqQbdHs&t=3s ✿ My Zero Waste Pantry: https://www.youtube.com/watch?v=TEvFmQxdeKI ✿ My Vegetarian Journey: https://www.youtube.com/watch?v=EdETbpNRbhY&t=4s
Denmark,DK,da,,ja,,cZnPzutOZvY,https://www.youtube.com/watch?v=cZnPzutOZvY,"LøsMarket, First Zero Waste, Organic Store in Denmark デンマーク初「使いすて容器を使用しない」オーガニックストアLøs Market",2018-08-24,2018-08-24T20:08:23Z,Earthackers,UCIT_fFOs5cD5lLLpAugq1qA,2562,80,0,"More about Løs Market: https://www.earthackers.com/bulkstorelosmarketdenmark Løs Market: https://www.loes-market.dk/ ___________________________________________________________________ As you may have also experienced, the founder Frédéric Hamburger was often annoyed at all the unnecessary plastic packaging products when he did his daily grocery shopping at a supermarket. “Why do we need a plastic packing for just one cucumber? Is it impossible to sell rice and pasta without individual packaging?” After gathering both financial supports and a large attention of audience during a crowdfunding campagne, Frédéric and his team opened the very first package-free, organic bulk store, Løs Market in Denmark in 2016. Today, Løs Market plays an essential role in the community by providing an alternative choice for shopping and collaborating with other sustainable, circular economy related projects. I love the concept and atmosphere of Løs Market a lot! I felt also very welcomed by all the members when I went to the store for interviewing. Don't miss visiting Løs Market if you come to Copenhagen! Løs Marketのような「使いすて容器を全く使用しない量り売りのオーガニックストア」は大都市を中心にヨーロッパ全体で近年急速に増えつつあります。ドイツでは2012年に同じコンセプトのお店の第１号店がオープンしてから、わずか５年の間にドイツ全体３９店舗にも増えています。僕の印象ではヨーロッパの生活に欠かせない「各街に必ず一つ必要とされている場所」になりつつあると思います。 その理由の一つは、こうしたお店のほとんどが商品を販売するだけでなく、ソーシャルグッドやエシカルな活動のHUBとしても機能しているからだと思います。地域の他のプロジェクトとコラボをしてのワークショップや学校と連携した教育プログラム、「モノを生産して廃棄する」代わりに、既にあるものを活用して新たな経済活動を生み出す「サーキュラー・エコノミー」の取り組み等も行われています。 日本でもこういった拠点が各地にできたら、より魅力あるまちづくりに繋がるんじゃないかと思います！ ___________________________________________________________________ Earthackers: https://www.earthackers.com Earthackers Community: https://www.patreon.com/earthackers Earthackers コミュニティー：https://camp-fire.jp/projects/view/86032 Facebook: https://www.facebook.com/Earthackers ___________________________________________________________________ Interviewed with: Frédéric Hamburger (Løs Market) Music: Masato Shimokajiya (shimoshimo0130@gmail.com) Font: MADE TheArtist Script by Maxim & Denis Filmed, Photographed, Interviewed & Directed by Akihiro Yasui (Earthackers)"
