country,search_region_code,search_language,channel_country,default_language,default_audio_language,video_id,url,title,upload_date,published_at,channel,channel_id,view_count,like_count,comment_count,description
Denmark,DK,da,US,en,en,xoixpp41CCY,https://www.youtube.com/watch?v=xoixpp41CCY,Whole Foods Grocery Haul - Plant Based/Vegan,2020-02-14,2020-02-14T00:00:07Z,My Weight - My Life - My Struggle,UCnXDVGxIFpstxzwwXO18ubA,29,5,8,Hi Everyone! Here is a small Whole Foods Grocery order that I had delivered via Amazon Prime. Delivery is free if you are a Prime member so I am taking advantage of that fact since the closest Whole Foods is about 25 minutes from my house.
Denmark,DK,da,CA,en,zxx,0h1k2lY7K3w,https://www.youtube.com/watch?v=0h1k2lY7K3w,DANGROUS ISLAND,2020-11-02,2020-11-02T17:00:00Z,Ricky Berwick,UCnBhY8jMEZzSSuFPz6JSAxQ,4270247,148297,2160,https://merch.rickyberwick.com/ ---------------------------------------------------------------- i shouldn't have social media BUT.. • Twitter - https://twitter.com/rickyberwick • Instagram - https://www.instagram.com/rickyberwick • Facebook https://facebook.com/rickyberwick --------------------------------------------------------------------
Denmark,DK,da,US,en,en,DyhfbRV1Kt4,https://www.youtube.com/watch?v=DyhfbRV1Kt4,Copenhagen Day 7 2019: Mostly Gluten Free & Vegan,2020-02-05,2020-02-05T22:26:30Z,Veggie Fruitful ,UCRoso9WZsR44Z8coUyOHBsw,92,1,0,"Copenhagen 2019 Day 7: Gluten Free & Vegan/Vegetarian Breakfast: coffee w/calcium enriched vanilla soy milk. 2 Earl Gray Teas, with stevia sweetener tablets. Here is a link to Naturli vegan products: https://www.naturli-foods.com/ Here is a link to grocery stores that sell Naturli and vegan gluten free foods. Irma Grocery store website link : https://irma.dk/ Fakta Grocery Store website link : https://fakta.dk/ Red, purple, green multi-colored grapes, cucumber slices. Chia Coconut Banana Pudding, from 7-11 Denmark. Here is a link to 7-11 Denmark. They have nice and healthy looking range of gluten free & vegan. 7-11 Denmark website link : https://www.7-eleven.dk/ Joe The Juice Coffee/Mocha Protein Smoothie. I added espresso, maca, pea protein powder, chocolate cocoa powder. I need to add lots of healthy sweetener. Here is a link to the Joe The Juice website in Denmark. https://www.joejuice.com/menu/dk Ricola and Orbit gum. Salad: sweet potatoes or yams, broccoli, quinoa, sunflower seeds, pumpkin seeds, hummus. 100% Vegan and so good. Retreat website link: https://www.retreatfood.dk/ airline snack: roasted hickory infused almonds, apple juice and water. airline lunch: Ravioli Pumpkin Puttineska. I didn't have a gluten free meal, and it was probably not vegan. I had my gluten aid and lactaid pills with me. The ravioli had olive oil, spinach, olives and cherry tomatoes. Sugar Free Ricola's Swiss Herb and Lemon Mint. fruit salad: pineapple, grapes, orange, grapefruit. Antipasti Salad: marinated artichoke hearts, marinated tomato's, lettuce, dark olives. 2 cups apple juice and water to drink. Rice Focaccia with green olive slices. Here is link to a bakery where I can get vegan & gluten free sweets, bread, vegan dairy products and others. https://www.facebook.com/pages/Landbageriet/705438012920416 -I had brought home a Polarbrod cheese wrap. Polarbrod is an an Eco-Friendly Swedish bread company. Polarbrod is not a gluten free brand, they do have vegan product's though. The Polarbrod wrap had Swedish Cheese, I ate it after I got home. The Polarbrod wrap inspired me to eat vegan & gluten free soft wraps at home. I eat vegan and gluten free tortilla wraps or corn tortilla wraps. Vegan corn tortilla's, white or yellow kind, warmed in the microwave, make a nice soft wraps. Often times I layer them to make them ticker like the Polarbrod wrap. - Makeup For My Vegan/Vegetarian Gluten Free Lifestyle."
Denmark,DK,da,CA,en,,qeh4JpKe7R8,https://www.youtube.com/watch?v=qeh4JpKe7R8,Sorelle & Co. is Toronto’s new spot for vegan and gluten-free eats,2018-06-12,2018-06-12T17:40:33Z,blogTO,UCc6RY7ZDvJIl_MTdyX7QP3w,732,12,0,"Sorelle & Co. is Toronto's prettiest destination for vegan, gluten, nut, and preservative-free pastries, bowls, and sandwiches. White and marble accents, chandeliers, and plush banquettes makes the space dazzle. Stop by here for a grab-and-go snack or a sit-down breakfast or lunch. Find it at 161 Yorkville Ave. Read more: https://www.blogto.com/bakery/sorelle-and-co-yorkville-toronto/"
Denmark,DK,da,US,en,en,c3AFJEbhzuA,https://www.youtube.com/watch?v=c3AFJEbhzuA,How to Reduce Food Waste & Create Sustainable Food Habits,2020-01-23,2020-01-23T16:15:01Z,Skillshare,UCoYATiiqNT7csPFqtWWfc5w,7655,175,12,"From composting to reducing packaging waste, author & activist Kathryn Kellogg gives her top tips for developing a sustainable diet. This is one lesson from Kathryn's class on Skillshare. To keep learning, click here: https://skl.sh/3ayItsc ABOUT THE CLASS Want to make a difference for the environment, but not sure how? You have the power to make small changes in your life—and a whole bunch of people making small changes adds up to a massive impact! Discover a simple, personalized approach to sustainability that proves how easy it can be to reduce your footprint on the planet, no matter your lifestyle or budget. Guided by author and activist Kathryn Kellogg, you’ll gain a flexible framework for building sustainability into your existing routine—while finding contentment in making better, not perfect, choices. Easy-to-follow lessons include how to: - Switch your mindset from discouraged to empowered - Discover simple swaps based on the contents of your trash (yes, really!) - Shop strategically for clothes, groceries, and household products - Build long-term habits that save time, energy, and money - Communicate effectively to grow your impact beyond yourself Plus, Kathryn reveals her favorite tips and tricks for sustainable shopping no matter where you live, with lessons on location at her local supermarket and secondhand store. This 50-minute class is packed with actionable tips, hand-picked resources, and endless encouragement you can return to again and again. By the end, you’ll unlock new creative energy and leave empowered to make choices that add up to a positive impact for yourself, your community, and your planet!"
Denmark,DK,da,GB,en,en-GB,6FaVHfH5oSY,https://www.youtube.com/watch?v=6FaVHfH5oSY,Vegfest UK London 2018,2018-11-02,2018-11-02T16:23:37Z,WinkBall Video,UCR_vjXrVpV9TI-GMGUVETcg,131,2,0,"VegfestUK came into existence back in Bristol in 2003, when Yaoh manager Tim Barford had the idea of mixing the seriousness of veganism with a rock-‘n-roll festival atmosphere, where people can do the following all in one place: eating, socialising, learning about healthy ethical eating, dancing, partying – you name it! It’s a heaven for many people, whether they want to mix with like-minded people, are curious about vegan lifestyles, or just want to eat all day and soak up the party atmosphere. Charlotte Freeman-Hall and Jade Madgwick report for WinkBall. FIND OUT THE NEXT VEGFEST HERE: https://www.vegfest.co.uk/our-events/ WATCH NEXT: Hackney Downs Vegan Market https://youtu.be/De3A_VM56Xg Subscribe here: https://www.youtube.com/user/winkball... Come find us: WinkBall | https://www.winkball.com/ Facebook | https://www.facebook.com/WinkBall/ Twitter | https://twitter.com/WinkBall Instagram | https://www.instagram.com/winkballvideo/ More videos |from the WinkBall network https://www.winkball.com/"
Denmark,DK,da,DE,en,en,sKRPKl1l4QA,https://www.youtube.com/watch?v=sKRPKl1l4QA,Vegan Bodybuilding Haul 💪🏼,2019-03-28,2019-03-28T17:00:13Z,Ferdi Beck,UCtCMLIERpE97NUqGFyv-e-g,3854,279,36,"MY VEGAN BODYBUILDING GROCERIES 🤩Last video ► https://www.youtube.com/watch?v=S7TVztMQyU4&t=535s 🔥Merch ► https://www.vegansavage.com #LA #VeganGroceryHaul #WholeFoods ➖➖➖➖➖➖➖➖➖➖➖➖➖ ▶️ YouTube German ► https://www.youtube.com/VegainsDE ✨Vegan Nutrition & Training Guide & Supplements ► https://vegains.org 📱My App ► https://get.vegains-app.com 💪🏼My Transformation & why I’m Vegan ► http://bit.ly/VeganPlaylist 💚Patreon ► https://www.patreon.com/vegains 💚If you want to support me please buy on Amazon through this link, it doesn’t cost you any extra but I get a little commission: USA ► https://amzn.to/2Otl2Eg UK ► https://amzn.to/2OtmQx2 Germany ► https://amzn.to/2JKktFI 💡Instagram ► https://www.instagram.com/vegainstrength/ 🥞Instagram Food ► https://www.instagram.com/vegainsfood/ 🎙Podcast English ► https://anchor.fm/vegains 🎙Podcast German ► https://anchor.fm/vegainsde 👤Facebook ► https://www.facebook.com/vegainstrength 🎧Epidemic Sound ► is where I get my music from. Use this link to try it for free and I get a commission off it which doesn’t cost you any extra (win win): http://bit.ly/VegainsEpidemicSound Vivo Life* ► Vegan protein, maca, macha etc. save 10% with VEGAINS10 ► https://www.vivolife.co.uk/?rfsn=776706.1fab48 KoRo* ► Whole food staples save 5% with VEGAINS5 ► https://www.koro-shop.co.uk *if you use my code you get a discount and I receive a small commission. ✌🏼🌿"
Denmark,DK,da,CA,en,en,70d9naW2uRM,https://www.youtube.com/watch?v=70d9naW2uRM,2 easy vegan back to school meal ideas | hot for food,2018-08-29,2018-08-29T14:25:19Z,hot for food,UCudzojQxnLAI7uQPVYJy_oQ,53930,2370,163,I'm making 2 easy vegan back to school meal ideas using some delicious and convenient products from Yves Veggie Cuisine! Thanks to Yves for sponsoring and collaborating with me on this video. SUBSCRIBE for new videos every Wednesday! http://bit.ly/Subhotforfoodblog These kale & quinoa lettuce wraps with lemon aioli and falafel bowls with roasted cauliflower and vegan tzatziki will get you through for first week back to school! I've used the Kale & Quinoa Bites and Falafel Balls from Yves Veggie Cuisine to create these easy meals. GET THE RECIPES: http://bit.ly/2NrI3rQ MORE ABOUT YVES VEGGIE CUISINE http://bit.ly/2NwSZ7C #hotforfood #vegan #veganrecipes #easyveganrecipes #veganism #food #backtoschool #mealprep #mealplanning #falafels ***************************************************** ORDER THE #HOTFORFOODCOOKBOOK http://www.hotforfoodblog.com/cookbook ***************************************************************** CHECK OUT THE #HOTFORFOODBOOKTOUR DATES http://www.hotforfoodblog.com/booktour ***************************************************************** SIGN UP & GET EXCLUSIVE RECIPES http://eepurl.com/bZF6pv ***************************************************************** BUY HOT FOR FOOD MERCH http://www.hotforfoodblog.com/shop ***************************************************************** HOT FOR FOOD'S AMAZON STORE https://www.amazon.com/shop/hotforfoodblog ***************************************************************** ** CANON 70D ** http://amzn.to/2tUdP7l ** CANON EF 24-70mm lens ** http://amzn.to/2uf2NJd ** BLENDER BY VITAMIX ** http://amzn.to/2sewL3C ** FOOD PROCESSOR ** http://amzn.to/2B7kemE ** LEMON JUICER ** http://amzn.to/2sj9okF ** LIME JUICER ** http://amzn.to/2siXnLT ** MICROPLANE ** http://amzn.to/2tTKU3q ** CAST IRON SKILLET ** http://amzn.to/2ufmeSi SUBSCRIBE TO LAUREN TOYOTA'S CHANNEL http://bit.ly/SubLaurenToyota follow: website - http://www.hotforfoodblog.com twitter - http://www.twitter.com/hotforfood instagram - http://www.instagram.com/hotforfood facebook - http://www.facebook.com/hotforfoodblog pinterest - http://www.pinterest.com/hotforfoodblog
Denmark,DK,da,US,en,en,NAuOQ8SIzXo,https://www.youtube.com/watch?v=NAuOQ8SIzXo,"The Cinnamon Snail | New York, NY",2018-04-20,2018-04-20T19:00:01Z,mercyforanimals,UCcCUFZrM30X_YEhJty2IgXA,3285,176,3,Be sure to add this NYC restaurant to your vegan bucket list!!! 🤤 Check out their website! http://cinnamonsnail.com Make sure not to miss our future videos! Click here to Subscribe: https://www.youtube.com/user/mercyforanimals Follow us on: Facebook: https://www.facebook.com/mercyforanimals Instagram: https://www.instagram.com/mercyforanimals Twitter: https://twitter.com/MercyForAnimals Pinterest: https://www.pinterest.com/mercyforanimals Website: https://mercyforanimals.org Plant-Based Lifestyle: https://chooseveg.com Shop MFA: https://store.mercyforanimals.org
Denmark,DK,da,GB,en,en-GB,QqgI-yR1540,https://www.youtube.com/watch?v=QqgI-yR1540,Plant Based Live in London UK - Sept 2018 - w/ Family & Friends,2018-11-01,2018-11-01T22:20:54Z,Emma WhispersRed,UCd5MuXTFKEakiMtEyr3maXg,14606,377,74,"Happy World Vegan Day 2018! XX with love, Emma XX Vlog channel for Emma WhispersRed 🌺Items featured in videos - https://bit.ly/2ICABXR 📖WhispersRed Book Club - https://bit.ly/2uUnkbl ——————————————————————————————————————————————- 🎧 Downloads are now available on all streaming services worldwide *Search - WhispersRed ASMR* 🎧 Spotify - https://spoti.fi/2EugqJo Google Play - https://bit.ly/2JwXP34 Itunes - https://apple.co/2qhg6Zb Amazon Music - https://amzn.to/2Ev7R0E ——————————————————————————————————————————————— 🌟Please LIKE if you do and SUBSCRIBE if you'd like to! This makes sure that new videos show up in your feed. Click the bell if you would like notifications for new uploads🌟 💜My other Channels💜 ❥ Main Channel - https://www.youtube.com/c/WhispersRedASMR ❥ Children’s Channel - https://www.youtube.com/c/WhispersRedASMRForChildren ——————————————————————————————————————————————— 🌟Connect🌟 Website - http://whispersredasmr.com Facebook - https://www.facebook.com/WhispersRedASMR Twitter - @WhispersRedASMR Instagram - whispersred_asmr Email - emma@whispersredasmr.com ————————————————————————————————————————————-- 🌹Contribute translations to this channel! - http://www.youtube.com/timedtext_cs_panel?tab=2&c=UCd5MuXTFKEakiMtEyr3maXg———————————————————————————————————————————— Info on ASMR and what I do on the main channel - ❥ What is ASMR? - https://www.youtube.com/watch?v=netHCOt-TPQ ❥ A great place to keep up to date with research and events in the ASMR world - http://asmruniversity.com ❥ To reach the UK & Ireland ASMR Community! Facebook Group - ASMR UK & Ireland - https://www.facebook.com/groups/ASMRUK/ ———————————————————————————————————————————- *Disclaimer* - Any ASMR videos uploaded to this channel are not intended to replace any medical care or counselling that might be needed. The benefits of ASMR in terms of a therapy is so far anecdotal only. *Product links* - These are usually affiliate links. Anything you purchase through them will help in the running of my YouTube channels. However I only link items I bought myself and/or use regularly."
Denmark,DK,da,,da,,0YTx625qh0c,https://www.youtube.com/watch?v=0YTx625qh0c,Strawberries in denmark,2018-07-22,2018-07-22T22:38:16Z,hiba id,UCKVXSL7sYeHB3QIWZgJTRvA,70,9,2,
Denmark,DK,da,US,en,en,o70lPLCDxS8,https://www.youtube.com/watch?v=o70lPLCDxS8,VEGAN MEATBALL SUBWAY IS HERE 😍| Vegan News | LIVEKINDLY,2019-08-09,2019-08-09T17:00:13Z,LIVEKINDLY,UCjacRo8crmvJuQt6nyFXyBg,21584,1202,174,"This week's vegan news: Popular sandwich chain Subway is launching a vegan meatball marinara sub made with Beyond Meat. Vegan Formula 1 racing champion Lewis Hamilton just won the Hungarian Grand Prix. Leading Australian supermarket Coles just launched a vegan meat range called Eaty, that is said to rival Beyond Meat. Ricky Gervais and Late Show host Stephen Colbert get up close and personal with Impossible Foods. Costco has upped its vegan game with 2lb boxes of Gardein vegan chicken fingers and large bags of vegan coconut candy bars similar to Bounty. The first Icelandic glacier to lose its glacier status due to climate change has been memorialized by its own 'grave.' Global meat processing giant Danish Crown announced that it will be entering the plant-based meat race with its own line of vegan beef products. New Zealand's Ministry of Health advises its citizens to eat more plants. #SubwayVegan #VeganMeatballSub #VeganCostco NEWS STORIES: Subway - https://www.livekindly.com/vegan-beyond-meatball-subs-are-coming-to-subway/ Lewis Hamilton - https://www.livekindly.com/vegan-f1-driver-lewis-hamilton-grand-prix-hungary/ Coles - https://www.livekindly.com/coles-vegan-meat-brand-beyond/ Ricky Gervais - https://www.livekindly.com/gervais-colbert-vegan-impossible-burgers/ Costco - https://www.livekindly.com/costco-2-pound-boxes-vegan-chicken-fingers/ Glacier - https://www.livekindly.com/icelandic-glacier-grave/ Danish Crown - https://www.livekindly.com/another-meat-giant-launching-vegan-beef-burgers/ New Zealand - https://www.livekindly.com/new-zealand-just-urged-the-entire-country-to-eat-plant-based/ LIVEKINDLY is your home for informative, thought-provoking content for humanity, our home, and those who share it with us. Featuring new plant-based videos every Tuesday and a weekly vegan news recap every Friday. FOLLOW US: ---------------------------------------- 🥑 MEAL PLANNER: https://meals.livekindly.co/ 📚GET OUR FREE E-BOOK: https://www.livekindly.com/sign-up/ 📲SOCIAL: Facebook: https://www.facebook.com/livekindlyco/ Twitter: https://twitter.com/livekindlyco Instagram: https://www.instagram.com/livekindlyco/ LinkedIn: https://www.linkedin.com/company/livekindly/ MUSIC: –––––––––––––––––––––––––––––– Moving On by MBB, Jonas Schmidt https://soundcloud.com/mbbofficial Creative Commons — Attribution-ShareAlike 3.0 Unported — CC BY-SA 3.0 Free Download / Stream: http://bit.ly/moving-on-instrumental Music promoted by Audio Library https://youtu.be/7jjlTMn0MWA –––––––––––––––––––––––––––––– –––––––––––––––––––––––––––––– Island by extenz https://soundcloud.com/extenz Creative Commons — Attribution 3.0 Unported — CC BY 3.0 Free Download / Stream: https://bit.ly/island-extenz Music promoted by Audio Library https://youtu.be/3EI6FUVE4b0 –––––––––––––––––––––––––––––– –––––––––––––––––––––––––––––– Trip by KV https://soundcloud.com/kvmusicprod Creative Commons — Attribution 3.0 Unported — CC BY 3.0 Free Download / Stream: http://bit.ly/2JcxEB3 Music promoted by Audio Library https://youtu.be/uIqpcRPRy7s –––––––––––––––––––––––––––––– –––––––––––––––––––––––––––––– Dance by LiQWYD https://soundcloud.com/liqwyd Creative Commons — Attribution 3.0 Unported — CC BY 3.0 Free Download / Stream: http://bit.ly/2uJ7H3z Music promoted by Audio Library https://youtu.be/4KcQ90UbRsg ––––––––––––––––––––––––––––––"
Denmark,DK,da,GB,en,en,Hyg8f9PYXTs,https://www.youtube.com/watch?v=Hyg8f9PYXTs,Why I Went Vegan | Vegan Watching Tobias,2018-03-14,2018-03-14T17:00:02Z,Sofia Surreal,UCBJJ5SjgXvFT8jEyKzvgcrg,137,16,2,"Tobias shares his vegan story and experience being vegan in Denmark! He has seen first-hand how Danish farms handle their animals for food production, and details his thoughts on the difference between organic and free-range. This is part of the Vegan Watching Storytelling Series, where we watch vegans share their perspectives around the world. ****************************************************************** Subscribe for more Vegan Watching: http://buff.ly/1VVE7Nv! ****************************************************************** Follow me on Twitter https://twitter.com/veganwatching ----------------------"
Denmark,DK,da,IN,en,,sIiy8XbELjc,https://www.youtube.com/watch?v=sIiy8XbELjc,Tailor l finishing supervisor jobs in Jordan,2019-07-22,2019-07-22T09:57:25Z,Gulf Job,UC8lnAfwkX7Pp8hoeXIK5O5Q,364370,1555,,vacancy closed🚫🚫🚫🚫🚫 WhatsApp Group - https://chat.whatsapp.com/ENwemqRYhmh7PecWJ4RPms WhatsApp Chat - https://wa.me/918986553519 Apply Current jobs (Submit resume / Bio-Data / CV) :Click here- https://goo.gl/forms/vVPCAjgzYtZjfOj13 Any enquiry please fill the form: Click here- https://forms.gle/ZgqX5yJAYXBcP4fa9 Apply other jobs (Submit resume / Bio-Data / CV) :Click here-https://forms.gle/H9rzrW3hQB5xi5Cr8 Connect with us! Facebook: https://www.facebook.com/jobjra/ Best Site for abroad Jobs: __ https://www.gulfclient.com Job in Dubai for Bangladeshi Job in Dubai for Indian Job in Dubai for Pakistani Job in Dubai for girls Job in Dubai for boys Job in Dubai for how to find job in Dubai for all Job in Dubai in English Job in Dubai in Hindi Job in Dubai in Urdu Job in saudi Job in Dubai Job in Oman Job in Malaysia Job in Singapore Job in India Job in Bahrain Jobs in Dubai girls how to find job in dubai Job in Dubai Job in UAE How to find job in Dubai How to find job in UAE Job in UAE in English Job in UAE in Hindi Job in UAE in Urdu Job in Dubai on visit visa How to find job in Dubai on visit visa Job in UAE on visit visa How to come UAE on visit visa Job in Dubai on tourist visa How to find job on tourist visa Job in Ajman How to find job in Ajman Job in Sharjah How to find job in Sharjah Job in Abu Dhabi How to find job in Abu Dhabi High salary job in Dubai High salary job in UAE Sales job in Dubai Sales job in Dubai How to find sales job in UAE How to find sales job in UAE Sales job in Ajman How to find sales job in Ajman Mechanical engineer job in UAE Civil engineer job in Dubai Civil engineer job in UAE Electrical engineer job in Dubai Electrical engineer job in UAE 12th pass 10th pass Fresher Driver Driving AC Security guard Airport Free zone Sales job in Sharjah How to find sales job in Sharjah Sales job in Abu Dhabi How to find sales job in Abu Dhabi Job in mall How to find job in mall Job in IT How to find job in IT How to find bed space in Dubai How to find bed space in Ajman How to find bed space in Sharjah How to find bed space in Abu Dhabi How to find room in Dubai How to find room in Ajman How to find room in Sharjah How to find room in Abu Dhabi How to find flats in Dubai How to find flats in Ajman How to find flats in Sharjah How to find flats in Abu Dhabi How much secure in Dubai is for girls How much secure in use is for girls Mechanical engineer job in Dubai Music in this video: https://youtu.be/K4DyBUG242c
Denmark,DK,da,AU,en,en-GB,QQe-Atcm30o,https://www.youtube.com/watch?v=QQe-Atcm30o,Butcher VS Vegan Activist,2020-06-10,2020-06-10T13:14:12Z,Tash Peterson,UCOo6-OQIgEnzQW-0T6_HECQ,774573,22123,4252,"🔗 All links & support: https://vganbooty.com Watch Dominion on YouTube for the Truth ❗ Veganism = rejecting exploitation, abuse & m*rder of non-human people. ❗ Meat, dairy, eggs, honey, leather, wool, fur, feathers & testing industries are ALL unethical. ❗ Speciesism = Racism = Sexism = Oppression. #Vegan #AnimalRights #Protest #VeganActivism #TashPeterson"
Denmark,DK,da,IN,en,,oe048hp1I98,https://www.youtube.com/watch?v=oe048hp1I98,Pineapple cutting machine - Just in 20 sec,2019-08-04,2019-08-04T12:28:03Z,Wkc Kiteclub,UC3t_msOaaA6a5OdaZ3VIZDg,22008664,109412,259,Just spotted at fairprice Singapore
Denmark,DK,da,DK,da,,un4qKGU7YF4,https://www.youtube.com/watch?v=un4qKGU7YF4,Sustainable Shopping - LØS Market in Copenhagen,2020-03-15,2020-03-15T20:08:58Z,Wasted Denmark,UCS21T4nJCWrDbEB5kbXst_A,414,23,1,Wasted Denmark went on a zero waste shopping adventure @ LØS Market in Copenhagen (Jægersborggade)
Denmark,DK,da,US,en,en,52YOsjGINSc,https://www.youtube.com/watch?v=52YOsjGINSc,The Most Stressful Restaurant Experience Ever - Key & Peele,2019-06-20,2019-06-20T20:00:00Z,Key & Peele,UCdN4aXTrHAtfgbVG9HjBmxQ,15190001,256370,11417,"Two people trying out a new Macedonian restaurant inadvertently find themselves caught in the middle of a fierce cultural rivalry. About Key & Peele: Key & Peele showcases the fearless wit of stars Keegan-Michael Key and Jordan Peele as the duo takes on everything from ""Gremlins 2"" to systemic racism. With an array of sketches as wide-reaching as they are cringingly accurate, the pair has created a bevy of classic characters, including Wendell, the players of the East/West Bowl and President Obama's Anger Translator. Subscribe to Key & Peele: https://www.youtube.com/channel/UCdN4aXTrHAtfgbVG9HjBmxQ?sub_confirmation=1 For more original comedy, check out @Comedy Central Originals : https://www.youtube.com/channel/UCNVBYBxWj9dMHqKEl_V8HBQ?sub_confirmation=1 Watch more Comedy Central: https://www.youtube.com/comedycentral Follow Key & Peele: Facebook: https://www.facebook.com/KeyAndPeele/ Twitter: https://twitter.com/keyandpeele Watch full episodes of Key & Peele: http://www.cc.com/shows/key-and-peele Follow Comedy Central: Twitter: https://twitter.com/ComedyCentral Facebook: https://www.facebook.com/ComedyCentral/ Instagram: https://www.instagram.com/comedycentral/ #KeyAndPeele #MacedonianCafe"
