country,search_region_code,search_language,channel_country,default_language,default_audio_language,video_id,url,title,upload_date,published_at,channel,channel_id,view_count,like_count,comment_count,description
Netherlands,NL,nl,GB,en,en-GB,QMuU8pjclZI,https://www.youtube.com/watch?v=QMuU8pjclZI,The animal welfare behind the meat you buy - Which? investigates,2020-07-28,2020-07-28T23:00:48Z,Which?,UCkqEX4I6XYfiOZ5zIwL7oag,27376,259,286,"To understand how the different animal welfare standards on a meat farm translate to the products you buy on supermarket shelves, you need to know your labels. So we've broken down a few animal welfare standards across the different welfare schemes to help you compare the meat labels available in UK supermarkets, including Red Tractor, RSPCA Assured, free range, outdoor bred, outdoor reared, Soil Association and organic. Read more: https://www.which.co.uk/news/2020/07/red-tractor-rspca-assured-and-organic-meat-whats-the-difference/ Subscribe to make sure you never miss out on our reviews and advice: http://bit.ly/JoinWhichOnYouTube Looking for the latest product reviews and advice? You're in the right place. Which? has been championing the cause for consumers since 1957, asking probing questions of businesses and manufacturers, and pursuing the answers that put you in the driving seat. Reviews You Can Trust Which? has more than 1.3m members and supporters, making us the largest independent consumer body in the UK. Our commitment to providing unbiased advice to consumers is at the heart of everything we do. So from choosing a TV, mobile phone, new car, or holiday, to managing your personal financial needs, we’re always on your side. Completely Independent The unique thing about Which? is that we are completely independent. This means we work entirely on behalf of you – so you can rest assured that you're getting the very best advice available. Which? works for you reviewing products and services, so that you make the best purchase decisions for your needs. For more expert advice visit: https://www.which.co.uk Follow us on Twitter: https://twitter.com/whichuk Join the discussion on Facebook: https://www.facebook.com/whichuk/"
Netherlands,NL,nl,,en,,_olxi98dTJU,https://www.youtube.com/watch?v=_olxi98dTJU,Soosee App Preview,2020-06-16,2020-06-16T15:43:52Z,Soosee,UCNZaMedntIDqjc_jpmUVvEg,1641,8,1,Soosee helps you scan your products for allergens and other dietary constraints. Here you can see how the app scans five different products in less than 30 seconds.
Netherlands,NL,nl,,en,,z2-1ZvguD3U,https://www.youtube.com/watch?v=z2-1ZvguD3U,Wok to Go Vs Wok to Walk-BEST NOODLES in the NETHERLANDS-Plus ULTIMATE VEGAN Preview,2020-02-11,2020-02-11T20:54:14Z,AFRICAN🌍APPETITE,UCqIhaGxEYwaZ3gLF78Vol6Q,668,18,15,"Wok to Go Vs Wok to Walk, in this vlog am on a quest to eat the BEST NOODLES in the NETHERLANDS-Plus ULTIMATE VEGAN Preview of Maoz ! Wok & Go; Wok to Go"
Netherlands,NL,nl,,en,,ey0UU-NSPCI,https://www.youtube.com/watch?v=ey0UU-NSPCI,Vegan & Gluten-free Weed Edibles Kit,2019-08-30,2019-08-30T18:50:27Z,The Marijuana Group,UCBH3KYiA1z806n64kNvzklw,146,1,0,"re you annoyed by rules and regulations established by the Cannabis Act and the inability to access crucial products? Have you been concerned about the stigma or health concerns revolving around the combustion or smoking of dried Cannabis? Are you tired of wasting hard earned cash on expensive illegal edibles? These questions and concerns can now be answered with The Marijuana Groups Do it Yourself Cannabis Edibles Box. A health conscious way to consume Cannabis edibles! Cook up specifically dosed vegan, gluten-free and low sugar content edibles in the comfort of home with The Marijuana Groups Edibles Box. Each box contains a different and unique surprise recipe that is always vegan, gluten-free and low sugar content. This allows you to consume your Cannabis hesitation free! The Marijuana Group's boxes include everything you need to get started, just add the recommended amount of legally purchased dried Cannabis to the recipe. Every box will contain the cooking instructions, dosing recommendations, cooking utensils, ingredients and THC/CBD extraction supplies necessary for cooking homemade vegan and gluten-free edibles. The ingredients within your box are carefully handpicked and the consumers health is taken into great consideration, we believe in only using the finest ingredients. The recipes you receive from The Marijuana Group have been handcrafted and perfected by professional within the Cannabis field and passionate cooks looking to bring quality and simplistic procedures to the Cannabis Industry. With our box we hope to make cooking with Cannabis as easy as buttering bread. The Marijuana Group is dedicated to providing health conscious Cannabis Solutions to the masses. We believe in providing quality products that save time, money and are personalized to your specific requirements. We believe in consuming Cannabis in a health conscious way. Our group is free of animal products and gluten, so you can enjoy your experience hesitation free. Cannabis products are not a “one size fits all” type of gig. Every individual is unique and thus The Marijuana Group seeks to provide a unique and personalized Cannabis Experience. We know your time is valuable, and that no one wants a product with a steep learning curve. This is why The Marijuana Group strives to bring speedy and effortless processes to Cannabis consumption."
Netherlands,NL,nl,NL,en,en,5m1nUYKTJzk,https://www.youtube.com/watch?v=5m1nUYKTJzk,Lockdown in a Vegan Sushi Restaurant with Claudia Deken. Small Businesses Respond to COVID-19,2020-06-23,2020-06-23T07:27:31Z,AlterContacts,UCINpOF0bB1pNA1SX3dxSXZA,163,12,9,"In this interview, we meet local entrepreneur Claudia Deken, the owner of Plant-Based Sushi, the first vegan sushi restaurant in the Netherlands, that opened in January 2020. She shares how confronting it was to close the restaurant because of the lockdown when things were going just picking up and the team was formed. But it motivated them to develop a local business marketing strategy and go into deliveries, which was done overnight. At first through third-party delivery companies, which was very costly and unpredictable. But very shortly they set up their own delivery service that allowed people to pre-order which helped the sales and made the customers feel more in touch with the restaurant team. Everyone in the team was delivering the sushi and it became a great opportunity to be in touch with their customers and bring them a happy moment. Please support the Lockdown Economy initiative on our GoFundMe page https://www.gofundme.com/f/lets-help-small-businesses-overcome-the-pandemic #LockdownEconomy #SustainableDevelopementGoals #AlterContacts #SDGaction36773 #lockdowneconomy_local About the Guest Claudia Deken is the owner of Plant-Based Sushi, the first vegan sushi restaurant in the Netherlands, Claudia grew up in South Africa but recently moved to The Netherlands where she studied business administration. Claudia found it difficult going to sushi restaurants with her friends as a vegan as the options were simply so limited and if there were vegan options it was limited to cucumber or carrot. Hence the beginning of Plant-Based Sushi. Plant-Based Sushi is the first vegan sushi restaurant in the Netherlands - surviving up a vegan remix of sushi. Plant-Based Sushi is on a mission to show diversity in sushi; to prove that sushi doesn’t need fish to be enjoyed. Not only will this keep your options diverse but it will keep the ocean and planet diverse. From the 27th of June, we are open in the new location with a terrace in Amsterdam East. https://www.facebook.com/plantbasedsushi/ https://www.instagram.com/plantbasedsushi.eu/ About the Host Julia Skupchenko is an award-winning entrepreneur and innovator. She is the co-founder of Think Tank for Sustainable Development, AlterContacts.org. She is running LockdownEconomy.org, a United Nations registered non-profit socio-economic and educational initiative to help small businesses and self-employed professionals to overcome the challenges of the COVID-19 pandemic and reactivate the economy. Julia is a published writer for a leading international online magazine for small business with millions of readers, Entrepreneur.com. She is also a business mentor at Rockstart and other accelerators. In her personal practice as a Business Developer and Advisor, Julia has consulted 100+ entrepreneurs, experts, small and medium businesses across the globe. She has won a Silver Award as the Female Innovator of the Year 2020. https://sustainabledevelopment.un.org/partnership/?p=36773 https://julia.altercontacts.org https://www.linkedin.com/in/juliaskupchenko/ #SDGNL #SDG08NL UNSDG #Entrepreneurs #COVID19NL #COVID19 #AlterContacts #LockdownEconomyNL #LockdownEconomy_Local"
Netherlands,NL,nl,US,en,en,3M8BmJsAHRI,https://www.youtube.com/watch?v=3M8BmJsAHRI,100% vegan baby care collection,2020-10-15,2020-10-15T03:04:40Z,LetsTalkAboutIT! TV,UCPzofVBd-L6OK6ZJ70TH8uw,2581,35,0,"Hello guys our Roya Luxs LLC Beauty Collection is ready and I want all of customers to make this go viral for me please... Please follow us on Instagram @Royalluxsbeautycollection @Royalluxs Our Hair care ,skin care, beard care,weight loss are ready for your purchase, go GET YOURS NOW!! LINKS ON OUR BIO! Have you seen the commercials visit us now! To get your natural vegan and skin line .... www.royalluxs.biz Www.royalluxs.net Model: @jadoremealprep @dr.charline @royalluxsbeautycollection Makeup artist:@ms_creelynnmua Photographer: @tonydelerme Tag anyone who should see this is 👇🏾👇🏾👇🏾👇🏾 #blackbusiness #blackownedbusinesses #viral"
Netherlands,NL,nl,,en,fr-BE,ujz1hqkNC0w,https://www.youtube.com/watch?v=ujz1hqkNC0w,EFFA Flavour Ambassadors: Senior Development Chef - Simon Bragg-Coulthard,2019-03-26,2019-03-26T09:12:17Z,European Flavour Association (EFFA),UCtZBYSAaj0kkNQ31-0TvfJg,448,8,0,"Senior Development Chef, Simon Bragg-Coulthard, shares how flavours are developed to meet the demands of the customers and consumers alike. To find out more about the project and view other Flavour Ambassadors Interviews go to https://www.effa.eu/flavour-ambassadors Twitter: https://twitter.com/EFFA_Flavour LinkedIn: https://www.linkedin.com/company/european-flavour-association/"
Netherlands,NL,nl,NL,en,,cR42BbSSYI8,https://www.youtube.com/watch?v=cR42BbSSYI8,BEST VEGAN CAKES OF AMSTERDAM... THE STORY BEHIND WILLEM PIE,2019-01-27,2019-01-27T18:37:05Z,Amsterdam Vegan Guide,UCMFmnHN0XK_0rII17mCUiMQ,244,2,0,"Willemijn is Willem Pie herself. After a burn-out she decided to do what she loves to do: baking. She started her business 2 years ago - selling veganized cakes B2B. Recently she opened her pop-up cafe in Oud Zuid in Amsterdam. A place where she can interact with her end customers. A quick feedback loop and a lot of energy is what she gets out of it. Willemijn makes her recipes herself, but will always test new cakes with her grandmother. If she does not notice it is vegan it is good!! In this video Willemijn shares her story. Why she started baking vegan cake, how she experiences the market and what her ambitions are for next year."
Netherlands,NL,nl,,en,en,BLclFeOPClE,https://www.youtube.com/watch?v=BLclFeOPClE,Dutch Valley Market,2019-08-15,2019-08-15T15:52:06Z,newdaycleveland,UCtLd3sOV5Jl0hBqi6tS9-hA,564,9,1,"https://www.dhgroup.com/shops/dutch-valley-market * * * * * * * * * * * * * * * * * * * * Produced & Edited by New Day Cleveland © 2019 WJW Television, LLC All Rights Reserved. * * * * * * * * * * * * * * * * * * * *"
Netherlands,NL,nl,,en,en-US,KnjDfZAwMN8,https://www.youtube.com/watch?v=KnjDfZAwMN8,"Vegan sausage, insect shakes, and an electric tractor",2020-01-22,2020-01-22T16:05:16Z,AP Archive,UCHTK-2W11Vh1V4uwofOfR4w,230,3,1,"(17 Jan 2020) LEAD IN: Germany's largest food and agriculture fair, the International Green Week, has opened in Berlin, with its focus on sustainability. Swiss food giant Nestle is using the show to launch a vegan sausage while other companies are showing food made from insects, alcohol free wine and there's even a concept model of an electric tractor. STORY-LINE: This might look like any other sausage being served in any of the hundreds of sausage kiosks in the German capital Berlin. But this one is a bit different, it doesn't contain any meat. The sausage is being launched here at the International Green Week food fair in Berlin by Swiss food giant Nestle. It follows the launch of several vegan burgers over the last few years. And at the start of the year, the launch of vegan pork by US company Impossible foods. ""This is the Incredible sausage. It is fully made from plants. And it tastes really good and has a good consistency and fully natural ingredients and it tastes like a sausage. So no one has to live without a real sausage anymore,"" says Miguel Serrano, Nestle Head of vegetarian products. The vegan sausage will be sold as the Incredible Sausage under Nestle's vegetarian brand Garden Gourmet. The sausage is made from soy protein and plants, such as beetroot. ""Consumers want real alternatives because meat consumption is being questioned more and more by society. And people want a better diet, a more balanced diet,"" says Serrano. Meat consumption is often linked to emissions of greenhouse gasses and vegetarian alternatives are seen by many consumers as a more sustainable alternative. ""As Nestle, we want to add our small, but very important contribution. We are a big company and with that size comes a big responsibility,"" says Serrano. Over 1,550 exhibitors are showing their products here at International Green Week in Berlin. Many are traditional companies and restaurants, but there are several small start-ups in the halls of the Berlin exhibition grounds. One of them is Isaac nutrition, a Cologne-based company making protein shakes and protein balls out of insects and larvae. These shakes and balls are made out of Buffalo worms, the larvae of the Alphitobius diaperinus, a species of beetle. ""This is the Buffalo worms. It is farmed with low resources in the Netherlands. For example, beef needs 2500 times more water and has a 200 times larger CO2 footprint than Buffalo worms. They also need very little space and food,"" says Charlotte Binder, CEO of Isaac Nutrition. Berlin-based Kolonne is showing its range of alcohol free wine. Unlike most alcohol free wines on the market, Kolonne buys high-end wines and then removes the alcohol through a heating and vacuum process. ""This is of course a segment that is growing all the time. People are more health focused. This really doesn't have many calories. And it makes more fun to drink this compared to a Coke or an apple drink with your food."" It's not just food which is taking on a green hue. Over at the agriculture hall of the fair, US tractor maker Steyr is showing a concept of an electric hybrid tractor. The hybrid engine can also be exchanged for a plug-in electric engine or a Hydrogen engine. But, at this stage the tractor is just a concept, Steyr does not have any plans to release it to the market right now. ""When you look at a concept like this you have to wonder, when will it be available. And I think this is something that we are all going to learn from. But I think the answer is, 'it won't take that long,'"" says Jona Hormann, Steyr's sales manager. Find out more about AP Archive: http://www.aparchive.com/HowWeWork Twitter: https://twitter.com/AP_Archive Facebook: https://www.facebook.com/APArchives ​​ Instagram: https://www.instagram.com/APNews/ You can license this story through AP Archive: http://www.aparchive.com/metadata/youtube/dfa4a558b4cc41478fb2d33184121042"
Netherlands,NL,nl,US,en,en,mf-6vEoTZZY,https://www.youtube.com/watch?v=mf-6vEoTZZY,"Shavon Stockpiled $60,000 in Goods! | Extreme Couponing",2020-03-26,2020-03-26T17:30:04Z,TLC,UCqf2gzmKtH3PaAbt-qgFFsw,5036134,54010,5532,"In North Carolina, Shavon does her grandma Flossie proud by helping her sister Mandy rebuild her stockpile. Flossie left Shavon a treasure trove of coupons with no expiration dates, and Shavon wants to make sure she uses them to get maximum savings. Stream More Episodes of Extreme Couponing: https://www.tlc.com/tv-shows/extreme-couponing/ Subscribe to TLC: http://bit.ly/SubscribeTLC Facebook: https://www.facebook.com/TLC Twitter: https://twitter.com/TLC Instagram: https://www.instagram.com/TLC"
Netherlands,NL,nl,NL,en,zxx,YkSGtw0wShU,https://www.youtube.com/watch?v=YkSGtw0wShU,Just one more bite....,2019-07-06,2019-07-06T15:00:59Z,PANCAKES Amsterdam,UCwT5E4XPCrT4PPkOsvq9cmA,272,3,0,"""WHERE THE WORLD IS FLAT"" - PANCAKES Amsterdam At first glance, our new slogan might sound weird. We’ve established the world is round, right? Well, not here at PANCAKES Amsterdam. - Everything is flat - After taking a good look at all facets of our company, we suddenly realised that everything is flat in the world of PANCAKES Amsterdam. First, and most importantly, pancakes are flat. But that’s not where it ends. The way our company and brand are structured is flat. There is a direct line between employees and management. There are no complicated channels of communication. Everyone, from the founder of PANCAKES Amsterdam to the restaurant chefs, is in the same group chat. And we can take it even further! Our supply chain is “flat”. We receive many of our products, like our flour and milk, directly from the suppliers. Our flour comes from Korenmolen de Windotter and they have been providing us with our flour since 2007, when PANCAKES Amsterdam first opened. They make a flour mix especially for us, so we have our own PANCAKES Amsterdam flour mix! Our milk is supplied by More than Milk Amsterdam (MOMA).Their aim is to create a direct link between city and countryside, by taking the milk directly from the farmers to consumers. They’re basically the modern-day milk man! Still not convinced that the world of PANCAKES Amsterdam is flat? Well, consider this: the main product on our menu is the traditional Dutch pancake. And it just so happens that the Netherlands is the third flattest country in the world! So there you have it: our product, the company, the supply chain and even the country of origin are all flat. And we’re proud to let everyone know about PANCAKES Amsterdam: Where the world is flat! PANCAKES Amsterdam's new slogan is ""Where the world is flat"" and we are celebrating this new slogan with a huge marketing campaign to let everyone know about it. A while back we shot an amazing video at our location next to the Anne Frank House, on the Prinsengracht. We asked several people to sit down and have a Dutch pancake. We wanted to know what they thought, but most of all, we just wanted people to try our delicious pancakes! Check our brand new video online! Would you like to visit one of the PANCAKES Amsterdam locations, no problem just check our website or Google Maps for the nearest location. PANCAKES Amsterdam Negen Straatjes | Berenstraat 38 PANCAKES Amsterdam Centraal | Prins Hendrikkade 48 PANCAKES Amsterdam Westermarkt | Prinsengracht 277 PANCAKES Amsterdam Aan 't IJ | Steiger 10 OPEN 7 DAYS A WEEK For breakfast, lunch and dinner!"
Netherlands,NL,nl,CA,en,en-CA,I0MR2KwyfdU,https://www.youtube.com/watch?v=I0MR2KwyfdU,Dutch Monarch Low-Carb Ice Cream Mix - LCG Foods Distribution,2020-11-06,2020-11-06T19:28:37Z,LCG Foods Distribution,UCo6hVscZnFRjvkd_IJlesYw,259,,,"Offer your customers the perfect product to make delectable, health-conscious ice cream right in their very own kitchens with Dutch Monarch Ice Cream Mix! Low carb, no sugar added, gluten-free, and available in a lactose-free variety, Dutch Monarch is a great addition to your grocery store shelves. Contact the team here at LCG Foods Distribution to get started carrying Dutch Monarch products today!"
Netherlands,NL,nl,,en,,gCe9JIUO_uU,https://www.youtube.com/watch?v=gCe9JIUO_uU,Dutch Apple Coffee,2018-03-08,2018-03-08T20:48:53Z,Alexandra Mott,UCmuqdCPQc_XkjG5n0CSxehA,69,2,0,This blend will ignite your tastebuds with the seasonal nostalgia of fall. ❤️ Shop Java Momma Now ⬇️ www.javamomma.com/amott Music : Over and Over Musician : Not The King.👑
Netherlands,NL,nl,US,en,en,qRgrXbVtGo0,https://www.youtube.com/watch?v=qRgrXbVtGo0,Vegan protester at McDonald’s,2020-07-28,2020-07-28T15:39:57Z,THEPLANETEARTH,UCcTZ9A6-KvxmHBaHY8WA7kw,2638,49,21,
Netherlands,NL,nl,US,en,,slGHGqNmk3M,https://www.youtube.com/watch?v=slGHGqNmk3M,Consumer Reports: Meat lover's guide to healthy living,2020-03-10,2020-03-10T22:55:14Z,Channel 3000 / News 3 Now,UCeX20-rTnN46DUD6C7IplWg,32,0,0,Consumer Reports shares tips on how to maintain a healthy diet without completely cutting out meat.
Netherlands,NL,nl,US,en,en,R6_q0MwImTE,https://www.youtube.com/watch?v=R6_q0MwImTE,The Translator | Awkward Puppets,2020-08-03,2020-08-03T15:00:04Z,Awkward Puppets,UCQG4cX86zZ51IU2cerZgPSA,9130674,276787,3344,SUBSCRIBE ► http://youtube.com/channel/UCQG4cX86zZ51IU2cerZgPSA?sub_confirmation=1 WATCH MORE ▶ https://youtube.com/playlist?list=PLilARj1JfbVz8pJD16_GgZPogePdxr8qO THANKS FOR WATCHING! LIKE & SUBSCRIBE FOR MORE VIDEOS! -------------------------------------------------------------------- FIND US ON: TikTok | http://tiktok.com/@awkwardpuppets Instagram | http://instagram.com/awkwardpuppets Twitter | http://twitter.com/awkwardpuppets Facebook | https://facebook.com/awkwardpuppets Lil Shop | http://lilshop.com/awkwardpuppets FOLLOW RUDY MANCUSO: Instagram | http://instagram.com/rudymancuso YouTube | http://youtube.com/rudymancuso Twitter | http://twitter.com/rudymancuso Facebook | http://facebook.com/rudymancuso TikTok | http://tiktok.com/@rudymancuso #Puppets #AwkwardPuppets #Diego #RudyMancuso
Netherlands,NL,nl,,en,,Cou3Ah8Znh0,https://www.youtube.com/watch?v=Cou3Ah8Znh0,Product video - Binky Protein - Production by Jeuris,2020-05-08,2020-05-08T13:32:43Z,Jeroen Jeurissen,UCsT0Yt26qC0M22HzitlwFrA,169,1,0,This is the launch video for a new (vegan) protein productline. Produced for Binky Protein based in The Netherlands. This protein aims at recovery after sporting activities. A lot of customers are fitness and/or endurance sporters.
Netherlands,NL,nl,US,en,en,veO6U_OzWSg,https://www.youtube.com/watch?v=veO6U_OzWSg,Vegan Bento Box Ideas for Breakfast,2019-06-17,2019-06-17T11:13:15Z,Honeysuckle,UCwsa-MpLNx4pnsM1PiQwhyQ,39301,1909,131,"Pack these Incredible BREAKFAST BENTOS so you won't be hungry! Recipes Below. A portion of this video is sponsored by #JustEgg - you won't believe how it tastes - check it out: https://www.ju.st/en-us/products/consumer/egg SUBSCRIBE & Hit The Notification Bell ➜ http://bit.ly/honeysucklecatering Turn ON Notifications! Last Video: Make sure you LIKE, COMMENT, and SUBSCRIBE to my YouTube Channel for Easy & Healthy Recipes and Inspiration! WATCH MORE! Bento Box Link: https://shopstyle.it/l/4Gve HEALTHY HOLIDAYS: https://www.youtube.com/playlist?list=PL81ef2gEnaNNPy3qM-xczPUBmBakpA554 COOKBOOK COOK-A-LONG: https://www.youtube.com/playlist?list=PL81ef2gEnaNOUkKdUtcum8XiH_U_m3F6M CHALLENGES: https://youtube.com/playlist?list=PLq... WEEKNIGHT MEALS: https://www.youtube.com/playlist?list=PL81ef2gEnaNNrxW3fIJU__oG50b5t-g-C LATEST VIDEOS: https://www.youtube.com/user/honeysucklecatering/videos?sort=dd&view=0&shelf_id=18 Follow Me :) MY NEW WEBSITE: http://bit.ly/honeysucklenewblog Instagram: https://www.instagram.com/honeysuckle/ Twitter: http://twitter.com/dzunglewis Business inquires: hi@dzunglewis.com My Blue Nonstick Pans (similar): https://shopstyle.it/l/4iNz My COLORFUL Pots: http://bit.ly/honeysucklecreuset My Chef's Knives: http://bit.ly/2SMmfdj My Waffle Iron: https://shopstyle.it/l/20gW Gold Rimmed Ramekins: Mini Food Processor: https://shopstyle.it/l/20fz Cast Iron Skillet: http://shopstyle.it/l/BmVW Le Creuset Pink Pot: http://shopstyle.it/l/h6GL Marble Slab Board: http://shopstyle.it/l/h6hf Non-stick Frying Pan: http://shopstyle.it/l/uvRN Mini Food Processor: http://shopstyle.it/l/tSDD Vitamix Blender: http://shopstyle.it/l/tSFm Hot Plate Burner: http://shopstyle.it/l/jsCX Crate and Barrel bowl: http://shopstyle.it/l/h6Gi West Elm Gold Flatware: http://shopstyle.it/l/h6t3 My Staub: http://shopstyle.it/l/knN5 Anthropologie bowls: http://shopstyle.it/l/h6G3 My Latte Bowls: http://shopstyle.it/l/knNy Cutting board: http://shopstyle.it/l/h6uj KitchenAid Mixer: http://shopstyle.it/l/bZfs Immersion Soup Blender: http://shopstyle.it/l/knOf Le Creuset Dutch Oven: http://shopstyle.it/l/bPXm Smeg Toaster: http://shopstyle.it/l/bPXr Raccoon Salt Jar: http://bit.ly/2tzMFoU Peach Oatmeal Bars In a large bowl mix: 1 1/2 cups flour 1 cup rolled oats 1/2 cup dark brown sugar 1/2 tsp baking soda 1/2 tsp cinnamon 1/2 tsp kosher salt Add 7 tbsp melted coconut oil. Mix again into a crumbly dough Pack 3/4 of the mixture into a parchment-lined baking pan. Layer 1-2 cups reduced peaches (lemon juice, 3 tbsp sugar, 1/4 cup water, cooked down into a jam) Sprinkle over the rest of the oat mixture. Bake 350º F for 35 minutes until the top is golden brown. Let cool before serving. Breakfast Fried Rice: In a non-stick pan add olive oil Saute 1/4 cup chopped onions until translucent Add 1/3 cup Just Egg, scramble together Add 1 cup spinach 1 1/2 cups cooked brown rice 1 1/2 tbsp soy sauce 1 tsp sesame oil Mix and serve. The FRIENDLIEST Recipes for #BuzyBeez + #Momdays New videos every week! Mailing Address: P.O. Box 2786 Toluca Lake, CA 91602 © 2019 Honeysuckle Catering. All Rights Reserved. Recipes - Topic"
