country,search_region_code,search_language,channel_country,default_language,default_audio_language,video_id,url,title,upload_date,published_at,channel,channel_id,view_count,like_count,comment_count,description
Denmark,DK,da,ID,en,zxx,_y9Ni4Ozrro,https://www.youtube.com/watch?v=_y9Ni4Ozrro,The Green Solution,2020-11-02,2020-11-02T12:26:41Z,ASEAN Youth Organization,UC-pN7EAjNy5Zm-YXth_cg6w,455,48,3,"Responsible consumption highlights one of the key solutions and elements to truly achieving food security. Our consumption-driven economy has pushed industries to increase their output, which in turn increases our already high carbon footprint. It is not only the responsibility of our institutions and governments, but the youth to play a great role in achieving this future, by actively changing their behavior and mindset to care more for the Earth."
Denmark,DK,da,GB,en,,NlptZ2wggp0,https://www.youtube.com/watch?v=NlptZ2wggp0,Sustainable Food: Plant-based diets for the planet! -The 'Conservation Is' Podcast,2020-01-06,2020-01-06T11:14:14Z,Conservation Chat UK,UCCtZjrMb-pKN6vWPI17AyaQ,400,6,1,The Conservation Is Podcast - Sustainable Food Are your food choices costing the earth? Do you know what to eat to be sustainable? In this episode we discuss sustainable food and how to reduce your impact on the earth just by making conscious food choices.
Denmark,DK,da,US,en,en-US,8LwveoDO_M8,https://www.youtube.com/watch?v=8LwveoDO_M8,Questions to ask at the End of an Interview,2020-09-20,2020-09-20T13:00:02Z,Life Work Balance,UCAGFQKnwEz4rrOiCqxO6Egg,3267147,113453,3177,"Questions to ask in a job interview: there are three different types of questions you should ask during a job interview. Watch this video to see what those three different types of questions are AND what types of questions you should NOT ask during an interview. If you’re looking for customized help with your job search process (including crafting your answers to very common interview questions, creating an incredible resume that will help you get noticed, or general interview prep) check out my website and let me know if you want to work together! Check out my website here: https://lwbalance.com Check out the different services I offer, pricing, and schedule directly with me here: https://lwbalance.com/services/pricing/ Email me directly at: abby@lwbalance.com Check out my website for a **FREE** list of 52 common behavior-based interview questions: https://lwbalance.com/2020/06/06/free-list-of-52-behavior-based-interview-questions/ ~*~*~*~*~*~*~*~*~*~*~*~*~*~*~*~*~*~*~*~*~*~*~*~*~*~* WATCH NEXT: Questions to ask at the End of an Internal Interview: https://youtu.be/S7eU33hsYR8 Questions to Ask at the END of Your FIRST Interview: https://youtu.be/A3Rv34iJMns Questions to Ask at the End of a Second-Round Interview: https://youtu.be/aXAtzOvAGRA CULTURE Questions to Ask at the End of an Interview: https://youtu.be/85TM4LTQDTk ROLE-SPECIFIC Questions to Ask at the End of an Interview: https://youtu.be/F2veJT6mTvQ HARD/HESITATION Questions to Ask at the End of an Interview: https://youtu.be/CTOWbYPfCcc How to answer almost ANY interview question: https://youtu.be/qFCwtSA2y5U Tell me about yourself: How to answer this common interview question: https://youtu.be/KhzLqsOj2y4 Interview Tips: Questions about Weaknesses: https://youtu.be/hFJ_0P_zf5A Interview Tips playlist: https://www.youtube.com/playlist?list=PLzWOz8R0BVKl4PETqrCvLdQJyGvPQFx4m ~*~*~*~*~*~*~*~*~*~*~*~*~*~*~*~*~*~*~*~*~*~*~*~*~*~* 🎉Have my videos helped you in your job search or landed you a job? If you'd like to say thanks you can always buy me a coffee ☕️ or sponsor me on Patreon! Buy me a ☕️ : https://www.buymeacoffee.com/abbyLWB Sponsor me: https://www.patreon.com/lifeworkbalance Life Work Balance Amazon Store SHOP AMAZON to see my favorite things! It's no extra cost to you, but it does give me a small percentage for giving you the recommendation! SHOP → → → https://www.amazon.com/shop/lifeworkbalance Items to help you have a successful: 🎥 video interview: https://a.co/f0CJ6r7 👥 in-person interview: https://a.co/7adbf3r Want customized coaching or consulting to help you with the interview process? Check out my packages here: https://lwbalance.com/services/pricing/ Visit my website for a **FREE** Resume e-book: https://lwbalance.com/2020/05/16/free-resume-e-book/ Connect with me! LinkedIn: https://www.linkedin.com/in/abigail-hoeh Facebook: https://www.facebook.com/lwbalance Instagram: https://www.instagram.com/lwbalance/ Twitter: https://twitter.com/lwbalance1 Subscribe today! https://www.youtube.com/channel/UCAGFQKnwEz4rrOiCqxO6Egg About Life Work Balance & Abby: Hi! I help individuals, companies, and organizations obtain and use the tools needed to improve their professional, relational, and organizational performance. Feeling like your job is draining all of your energy and you're looking for a change? Interested in becoming an entrepreneur, but not sure where to start? Abby & Life Work Balance are here for you! Please subscribe and hit that notifications bell to be updated when new videos are uploaded every Sunday! #lifeworkbalance #career #careercoach #careeradvice #HowTo #Interview #InterviewQuestions #QuestionsToAsk #QuestionsToAskDuringInterview #JobSearch #Interviewing"
Denmark,DK,da,US,en,en,jVt2B9YLEDc,https://www.youtube.com/watch?v=jVt2B9YLEDc,Before the Grocery Store: Understanding the Value of Food | Sophia Forstmann | TEDxTheMastersSchool,2019-06-06,2019-06-06T20:39:00Z,TEDx Talks,UCsT0YIqwnpJCM-mx7-gSA4Q,1399,16,1,"In this TEDx Talk, Sophia Forstmann considers food consciousness and the importance behind appreciating one’s food. Forstmann believes that understanding the origins of food creates both an awareness and understanding of the privilege of harvesting both plants and animals. Her goal is to spark curiosity and to encourage people to ask questions about the sources of their food, the “system of food,” and various types of food. Sophia Forstmann has always had a passion for sustainability and is a vice president of The Masters School’s environmental club, EFFECT. For the past six years, Forstmann has volunteered, taken classes and interned at the Stone Barns Center for Food and Agriculture in Pocantico Hills, New York. During her freshman year of high school, Forstmann and two of her peers started the zero-waste initiative at Masters. She was nominated to attend the Washington Youth Summit on the Environment, taking place in June 2019, and will be a delegate for the state of New York. This talk was given at a TEDx event using the TED conference format but independently organized by a local community. Learn more at https://www.ted.com/tedx"
Denmark,DK,da,DE,en,,CQ8oLAw6gjY,https://www.youtube.com/watch?v=CQ8oLAw6gjY,"Vegan Queens - Folge 23 - Trine Hahnemann (Hahnemanns Køkken, Kopenhagen) / english episode",2018-07-11,2018-07-11T08:14:03Z,Sophias vegane Welt,UCUjBLy8DDSuwzzeOYmHmqiw,262,2,0,"Chef owner and author Trine Hahnemann has written19 cookbooks and leads her own catering company and restaurant/ cooking school in the danish capital and food metropolis Copenhagen. But Trine also has strong political opinions: For choleric behaviour, sexist and racist comments she has a zero-tolerance policy in her company which applies not only for her employees but also for customers. The gender ratio within her company is 50:50 male/ female. In conversation with Sophia this impressive woman opens up about the impact and importance of #metoo, the evolution of the cookbook market, sustainability, eating habits, feminism, the up- and downsides of her hippie childhood as well as culinary inspirations and childhood memories from the danish countryside. A few of Trine's books have also been published in German, such as "" 100 Wohlfühlgerichte - HYGGE"" or ""Skandinavisch Kochen"", you can get/ order them in every bookshop - support your local bookshop! Trines Restaurant Hahnemanns Køkken: http://hahnemannskoekken.dk/ A TedTalk Trine did about bread baking/ bread culture/ biodiversity: https://www.youtube.com/watch?v=4lzo_F4x_Ps"
Denmark,DK,da,,en,en,hg-Kf1eNDHA,https://www.youtube.com/watch?v=hg-Kf1eNDHA,These People Tried The Blue Zones Diet For 3 Months: See What Happened | TODAY,2019-12-03,2019-12-03T22:00:08Z,TODAY,UChDKyKQ59fYz3JO2fl0Z6sg,522336,6833,487,"TODAY teamed with Dan Buettner to write down recipes from five areas of the world where people are unusually long-lived. When people in one American city went on a Blue Zones diet for three months, the results were dramatic. TODAY special anchor Maria Shriver reports. » Subscribe to TODAY: http://on.today.com/SubscribeToTODAY » Watch the latest from TODAY: http://bit.ly/LatestTODAY About: TODAY brings you the latest headlines and expert tips on money, health and parenting. We wake up every morning to give you and your family all you need to start your day. If it matters to you, it matters to us. We are in the people business. Subscribe to our channel for exclusive TODAY archival footage & our original web series. Connect with TODAY Online! Visit TODAY's Website: http://on.today.com/ReadTODAY Find TODAY on Facebook: http://on.today.com/LikeTODAY Follow TODAY on Twitter: http://on.today.com/FollowTODAY Follow TODAY on Instagram: http://on.today.com/InstaTODAY Follow TODAY on Pinterest: http://on.today.com/PinTODAY #BlueZonesDiet #Diet #TodayShow These People Tried The Blue Zones Diet For 3 Months: See What Happened | TODAY"
Denmark,DK,da,,en,da,6EMhkxFmvZ4,https://www.youtube.com/watch?v=6EMhkxFmvZ4,"Leveraging consumers flexibility for the provision of ancillary services, Giulia de Zotti",2020-12-21,2020-12-21T12:21:49Z,DTU Compute,UCInJNkGjG_nH8cmZ9513w8A,122,0,,"Flexibility in electricity consumption will be a keyword for the green transition, in the energy system of the future based on solar and wind. Giulia de Zotti from the Danish Energy Agency and DTU Compute talks here about how to unlocking consumers flexibility potential. --- CITIES - Centre for IT-Intelligent Energy Systems - is a strategic research project funded by Innovation Fund Denmark with a project runtime from 2014 to 2020. The research in CITIES has focused on methodologies and solutions/tools for smart energy systems to facilitate the green transition to a fossil-free energy system by intelligent use of data; ‘green digitalization’. CITIES continues from 2021 as ‘CITIES Centre’ to collect and share knowledge about digitalization, flexibility, and sector coupling."
Denmark,DK,da,IN,en,en,50ZCowGjltg,https://www.youtube.com/watch?v=50ZCowGjltg,Webinar #1: GFI India Featuring Big Idea Ventures,2020-08-14,2020-08-14T04:59:10Z,GFI India,UCqqJJR6F3JuQ09mobsIahMQ,735,13,0,"If you are an entrepreneur focused on the alternative protein sector or are curious about getting some incubation support for your startup or you want to learn about the consumer insights and the marketing of plant-based meat, eggs, and dairy in India, this webinar is for you. Mr. Andrew Ive, Founder & General Managing Partner of Big Idea Ventures (https://bigideaventures.com/) (BIV) & New Protein Fund presents BIV's overview about the global investments in this sector and the role of incubators in cultivating the innovation ecosystem. He talks about their focus on India and ends with a call for applications for BIV's latest Cohort II."
Denmark,DK,da,,en,,LI705cApe3I,https://www.youtube.com/watch?v=LI705cApe3I,The Short Story of Teatulia,2018-06-01,2018-06-01T21:29:16Z,Teatulia Organic Tea,UCQfW5OFVYovQ0LROImHQSfQ,603,10,0,"Our garden-to-cup teas from Bangladesh not only taste good but also do good…for the land, for the people, and for the environment. Teatulia’s single-garden direct, sustainably grown teas hail from our very own tea garden in the Tetulia region of Northern Bangladesh. We created a new tea-growing region, nestled between Assam and Darjeeling at the base of the Himalayas, that has introduced the unique flavor profile of Bangladesh teas to the rest of the world. We have transformed the region from a wasteland to the lush organic tea garden it is today. Established in 2000, our organic tea garden is one of the largest in the world and has successfully regenerated the ecosystem and rejuvenated the economy of the entire map. FOR THE LAND Teatulia Tea GardenOur teas are responsibly sourced from our own USDA, SGS, JAS certified organic tea garden. As one of the largest organic tea gardens in the world, we’re not just sustainable—we’re regenerative. By using only natural farming methods, we’re improving the soil and rejuvenating the land for future generations. What started as barren, virgin land is now 3,000 acres (and growing!) of organic tea gardens and farmland. We cultivate our land without the use of synthetic chemicals or machinery, and we practice soil, water, and land conservation. After years of organic cultivation, we’re now seeing a diverse and thriving ecosystem teeming with a variety of once endangered plant and animal species. We’re Rainforest Alliance certified! Rainforest Alliance certification helps conserve biodiversity and ensure sustainable livelihoods by transforming land-use practices, business practices and consumer behavior with the goal of creating a world where people and the environment prosper together. FOR THE PEOPLE Literacy ProgramTeatulia’s organic tea garden was a social enterprise designed to create jobs in a remote and impoverished region of Bangladesh—we wanted to do something that would make a difference for the land and its people. All tea sales support Teatulia’s farming cooperative, which introduced a revolutionary new economic model to the region. Co-op members working in Teatulia’s garden and surrounding communities now benefit from innovative education, health, and cattle-lending programs that help families out of the cycle of poverty. The tea garden employs more than 600 workers and supports 1,700+ community members through its co-op. The co-op teaches organic farming, providing families with food and a way to strengthen their socio-economic condition by selling crops to local village markets and city supermarkets. The co-op’s education programs have improved literacy rates by 50% or more and graduated more than 370 of its members. More than 3,000 cows have been distributed to thousands of Bengali women as part of the co-op’s cattle-lending program. The co-op has distributed more than $500,000 in cattle loans. Dairy farming has increased employment by 450% and co-op members’ incomes by 300%. The lending program has also increased monthly milk production by 450% and cow dung for soil fertility by 828%. In 2014, Teatulia became the first Colorado tea company to become certified as a B Corporation FOR THE ENVIRONMENT Less Waste PackagingTeatulia’s revolutionary eco-canister doesn’t just look good…it does good. Every decision we make is one we hope will reduce our global footprint and inspire others to do the same. Our earth-friendly eco-canisters are designed with recyclable and compostable materials made from post consumer waste. Our tea bags are designed with less waste in mind, free of excess packaging like strings, tags, and staples. Our retail packaging alone saved more than 10,000 tons of waste from landfill last year! FOR THE TASTE And what about the tea? Delicious! From white and green teas to black and herbal teas, our entire product selection is handpicked from our own organic tea garden and other like-minded gardens around the world. Because it comes direct from our garden to your teacup, Teatulia is some of the freshest, best-tasting tea available. Sip for yourself and see. We have more than 25 flavors available as loose leaf tea or packaged in eco-friendly and convenient whole leaf pyramid tea bags or fine cut round tea bags. Look for our earth-friendly eco-canisters at major grocery retailers across the country, including Whole Foods, Natural Grocers, and Safeway. Fine-dining restaurants like Linger Denver and fast casual chains like Tokyo Joes are brewing fresh Teatulia hot and iced teas as part of their healthy menu options."
Denmark,DK,da,,en,en-US,vagYSFKRsZg,https://www.youtube.com/watch?v=vagYSFKRsZg,COMPLIANCE INTERVIEW Questions and ANSWERS! (Compliance Officer and Manager Job Positions),2020-02-15,2020-02-15T15:59:52Z,CareerVidz,UCrtPXCqjm9c7nqgJL-vBSZg,377977,13797,256,"Learn how to PASS a Compliance Manager or Officer interview with Richard McMunn's interview tips, questions and answers training tutorial. https://passmyinterview.com/compliance-officer-interview/ #complianceinterviewquestions #compliancemanager #complianceofficer MAKE SURE YOU PREPARE FOR THE FOLLOWING COMPLIANCE INTERVIEW QUESTIONS AND ANSWERS Q. Tell us about yourself and why you want to work in compliance? Q. Why do you want to work for our organization as a Compliance Officer? Q. What would you do in the first 30 days of starting as our Compliance Manager / Officer? Q. Describe a situation when something didn't go to plan and how you dealt with it? Q. What’s your biggest weakness? Q. Why should we hire you as our Compliance Officer / Manager? This compliance interview training video is suitable for all jobs and roles, including: Banking Compliance Interviews; Healthcare Compliance Interviews; Risk and Compliance Interviews; Contract Compliance Interviews; Compliance Manager Interview Questions; Compliance Officer Interview Questions. Connect with Richard McMunn on LinkedIn.com at: https://www.linkedin.com/in/richard-mcmunn-coach/ Watch Richard's MANAGER Interview Questions and Answers training tutorial here: https://youtu.be/Kzkgte_rLRE DOWNLOAD THE ANSWERS HERE! https://passmyinterview.com/compliance-officer-interview/"
Denmark,DK,da,US,en,en,3J8FOW6yCQ0,https://www.youtube.com/watch?v=3J8FOW6yCQ0,Are Vegan Diets Safe for Children?? - RESPONSE to Belgian Prosecution of Vegan Parents,2019-06-01,2019-06-01T15:40:47Z,Born Vegan,UCu_rvBwaEZLZPQH1XsuyRhw,630,54,17,"Is it safe for parents to impose vegan diets on their children? Are vegan children malnourished and nutrient deficient? As a life-long vegan this is my response the recent Belgium position paper calling for the monitoring and prosecution of vegan parents Please like, share, and subscribe if you enjoyed this! -Sarina Farb ------------------------------ Connect WITH ME: ★ INSTAGRAM: http://www.instagram.com/bornvegan1 ★ WEBSITE: http://www.bornvegan.org ★ TWITTER: https://twitter.com/BornVegan1 ------------------ CITATIONS: ★ Belgian Position Paper http://www.armb.be/index.php?eID=tx_nawsecuredl&u=0&g=0&hash=9d0545dbd4fbbe309ce0f2417c2c3d44a782de9a&file=fileadmin/sites/armb/upload/armb_super_editor/armb_editor/pdf/Avis/2019/ARMB_re__g_ve__ge__talien_version_complete.pdf ★ PROTEIN MYTH https://nutritionfacts.org/video/animal-protein-pregnancy-and-childhood-obesity/ https://nutritionfacts.org/video/the-protein-combining-myth/ https://nutritionfacts.org/video/the-great-protein-fiasco/ https://www.youtube.com/watch?v=bc4t6BUHZH8&vl=en https://www.youtube.com/watch?v=dVJe_CrvLvY ★ Danish study looking at micro and macronutrient intakes https://www.ncbi.nlm.nih.gov/pmc/articles/PMC4628270/ ★ Beta-carotene converted into vitamin-A https://academic.oup.com/ajcn/article/91/5/1468S/4597430 ★ Iron deficiency rates equivalent between vegans and non-vegans https://academic.oup.com/ajcn/article/76/1/100/4689466 ★Vegans low in B12 https://www.nature.com/articles/ejcn201446 ★ 30% of Belgians below recommended fatty acid intake levels https://www.karger.com/Article/FullText/355437 ★ Calcium and milk intake not associated with fracture risk https://ajph.aphapublications.org/doi/abs/10.2105/AJPH.87.6.992 https://academic.oup.com/ajcn/article/77/2/504/4689714 ★ Vitamin K and bone mineral density https://academic.oup.com/ajcn/article/89/5/1627S/4596952 ★ IFG-1 and cancer risk http://clincancerres.aacrjournals.org/content/14/20/6364 ★ Vegans have lower IGF-1 levels http://cebp.aacrjournals.org/content/11/11/1441.short ★ WHO -- Red and processed meats https://www.who.int/features/qa/cancer-red-meat/en/ ★ Type 1 Diabetes incidence in Belgium http://care.diabetesjournals.org/content/diacare/25/5/840.full.pdf ★ Type 1 diabetes and milk https://www.ncbi.nlm.nih.gov/pmc/articles/PMC5518798/ ★ Cardiovascular disease in children https://www.ncbi.nlm.nih.gov/pmc/articles/PMC2812791/ https://academic.oup.com/ajcn/article/89/5/1627S/4596952 ★ Fiber and chronic constipation https://journals.lww.com/jpgn/Fulltext/1999/02000/Diet_and_Chronic_Constipation_in_Children__The.15 ★ Fish consumption and cognitive speed and behavior https://academic.oup.com/jn/article/144/3/311/4637677 https://www.ncbi.nlm.nih.gov/pmc/articles/PMC165591/ ★ 1 in 10 children suffer from neglect https://www.sciencedirect.com/science/article/pii/S0140673608617067 ★ Hospitalized children in Europe are malnourished https://europepmc.org/abstract/med/16051076 https://adc.bmj.com/content/95/7/489.short ★ Preventing Deficiencies on a vegan diet https://www.youtube.com/watch?v=zKwnMCEp3HM PCRM Response to Belgian position paper https://www.pcrm.org/news/news-releases/us-doctors-blast-belgian-misinformation-vegan-diets #Veganism #VeganNutrition #BornVegan"
Denmark,DK,da,US,en,en,MZsoQqMnPZI,https://www.youtube.com/watch?v=MZsoQqMnPZI,Janitorial Restroom Cleaning Step-By-Step Training,2018-09-13,2018-09-13T19:58:15Z,Relay Resources,UCA9jhkyeyeU3NS57ATgmAXw,2183087,25217,121,"A building interior sets the stage for how people experience an organization. Relay Resources can help make the best impression with high-quality cleaning services. This video is a supplemental training and refresher for our janitorial team members at Relay Resources. Relay Resources is a nonprofit based out of Portland, Oregon providing access to jobs for people with disabilities or other barriers to employment. Our high-quality janitorial team oversees one of the largest commercial cleaning services in the state. How can we help you? careers@relayresources.org www.relayresources.org/careers"
Denmark,DK,da,PK,en,ur,qUXNceGlyT0,https://www.youtube.com/watch?v=qUXNceGlyT0,Interview Questions and Answers in Urdu – Interview Tips,2020-09-29,2020-09-29T16:18:49Z,MOTISOL,UCOXm_DICHYDNAiPL8M-7HUw,333858,4510,90,"An interview is an important step of job hunting where confidence and behaviour are tested greatly. There are a few common questions that are asked frequently in interviews by the interviewers. In this video, you will learn how to answer the most common interview questions in an interview. Interview Questions and Answers in Urdu | Common Interview Questions and Answers | Interview Tips You may watch my other interview related videos: 1. 7 Best Tips For Job Interview: https://youtu.be/TwmIZDhal9I 2. Interview Dress Code: https://youtu.be/3U1P2HH5iVQ 3. How To Handle Unexpected Interview Question: https://youtu.be/X4vIi44bShc 4. How to get your first job without experience: https://youtu.be/ozBmW8vdnNU 5. How To Love Your JOB: https://youtu.be/1VE7O2cBoqw I wish you the best of luck with your interview. CHAPTERS: 0:00 Intro 0:41 Tell me about yourself 1:23 Why should we hire you? 2:09 Where do you see yourself in 5 years? 2:56 What is your greatest weakness? 3:39 What is your expected salary? 4:37 Describe your current job responsibilities 5:29 Why do you want to leave your last job? 6:08 Outro 6:30 Call to action Welcome to the youtube channel Motisol. About channel: Motisol is all about motivation, positivity, hope and personal development. On this channel, you will get 100 Seconds motivational videos, book summaries and content related to personal development. For more videos: Subscribe to our channel and stay tuned: https://www.youtube.com/c/Motisol786 PLAYLISTS by MOTISOL: 1. Personal Development: https://youtube.com/playlist?list=PL7yIzRTKFqKeRWxSt4Nt0lUE8H5WBYLoZ 2. English Videos: https://youtube.com/playlist?list=PL7yIzRTKFqKcAvTnQML6IlmhJZgAg7qCq 3. Motivational Stories: https://youtube.com/playlist?list=PL7yIzRTKFqKefuF7uUbTwGP_4dOBklQou 4. Book Summaries: https://youtube.com/playlist?list=PL7yIzRTKFqKdwDsqIb9PEFNNpMMHNXs5M 5. Job & Interview: https://youtube.com/playlist?list=PL7yIzRTKFqKfd2UYmAMHqO1QuU-tCcQlo 6. 100 Sec Book Summaries: https://youtube.com/playlist?list=PL7yIzRTKFqKfn6Ewynz1pDBEGGGP8Ae4g 7. 100 Second Motivation: https://youtube.com/playlist?list=PL7yIzRTKFqKf-p4-T1n4U8343nlHj1AVq 8. Short Personality Development (PD) Course: https://youtube.com/playlist?list=PL7yIzRTKFqKepSr_ntq9RYRIBdG_vjbXA 9. YouTube Shorts: https://youtube.com/playlist?list=PL7yIzRTKFqKfp4LIV12i5QPAIz5hEJb2o ______________/Connect On Social Media\_____________ ► Facebook:➜ https://www.facebook.com/motisol123 ► Instagram:➜ https://www.instagram.com/moti_sol/ ► Twitter: ➜ https://www.twitter.com/motisol786 - Stay Inspired Thank you for watching!!! #InterviewQuestions #JobInterview #Topinterviewquestionandanswers #MostAskedInterviewQuestions"
