country,search_region_code,search_language,channel_country,default_language,default_audio_language,video_id,url,title,upload_date,published_at,channel,channel_id,view_count,like_count,comment_count,description
France,FR,fr,,en,en-CA,tk4hx5vDbrc,https://www.youtube.com/watch?v=tk4hx5vDbrc,PPAA Webinar 4: Disruptive Food Industry Trends with Prof. Sylvain Charlebois,2020-06-03,2020-06-03T18:12:50Z,Shannon Snaden,UC8MtUetxIzshGcQcMGeARrQ,292,9,1,"Webinar as part of Plant Protein Alliance of Alberta's coffee chat series discussing disruptive food industry trends with Professor Sylvain Charlebois. Look at the short- and long-term changes we are all facing in the food and beverage industry due to the pandemic. There are transformational shifts happening that will last far beyond the outbreak. Dr. Charlebois is a leading agrifood expert from Dalhousie University, and in this video, he talks about the democratization of the supply chain, growth in online grocery shopping, a new emphasis on food security and food processing, as well as an accelerated return to the trend in plant-based proteins. This is the fourth and final webinar in the Navigating Through Disruption series which focuses on learning from experts and PPAA members about the strategies they are using to navigate through the business disruption of the COVID-19 outbreak. Find out about the many challenges and opportunities; as well, learn from the innovation that is developing during this challenging time."
France,FR,fr,,en,en-GB,E93ngm97cUQ,https://www.youtube.com/watch?v=E93ngm97cUQ,Nexira’s new brand Inavea uses acacia to meet consumer needs around health and sustainability.,2019-12-09,2019-12-09T13:37:14Z,FoodBev Media,UCL3EupkccalPSDOTEM7nRJQ,233,1,0,"http://www.foodbev.com -- Julie Impérato, marketing manager at Nexira, spoke to FoodBev’s Bryony Andrews about the company’s new brand Inavea and how it can help customers to improve their carbon footprint and sustainability credentials."
France,FR,fr,US,en,en-US,3lrJYTsKdUM,https://www.youtube.com/watch?v=3lrJYTsKdUM,Why beef is the worst food for the climate,2020-05-13,2020-05-13T12:00:01Z,Vox,UCLXo7UDZvByw2ixzpQCufnA,1150716,42450,5472,"Avoiding high-emission foods can have a bigger climate impact than any other consumption change. Become a Video Lab member! http://bit.ly/video-lab Our consumption habits emit billions of tons of greenhouse gases into the atmosphere. Our diets account for one-fourth of those emissions. The food we eat emits so many greenhouse emissions because of the land it takes to grow it, but it also has something to do with biology. This video explains why the production of some foods emit more than others, and which foods to avoid to be a more climate-conscious consumer. This video was based on this chart, created by the University of Oxford’s Our World in Data: https://ourworldindata.org/food-choice-vs-eating-local Sources: For more Vox.com coverage of food emissions: https://www.vox.com/future-perfect/2020/2/20/21144017/local-food-carbon-footprint-climate-environment For more of Our World in Data’s data on the emissions related to food production: https://ourworldindata.org/environmental-impacts-of-food A lecture given by Joseph Poore, co-author of the study this chart was based on: https://youtu.be/8miQs3mPGu8 Cow and sheep burping footage: https://www.youtube.com/watch?v=tDjEqYR6CGE https://www.youtube.com/watch?v=bNrFdrxIToo https://www.youtube.com/watch?v=kgGSqJDzN6o https://www.youtube.com/watch?v=l9yRdVAmAag https://www.youtube.com/watch?v=xLJqZknei9I https://www.youtube.com/watch?v=LPmweCJgvIM https://www.youtube.com/watch?v=3fHjmPQl8FU Vox.com is a news website that helps you cut through the noise and understand what's really driving the events in the headlines. Check out http://www.vox.com. Watch our full video catalog: http://goo.gl/IZONyE Follow Vox on Facebook: http://goo.gl/U2g06o Or Twitter: http://goo.gl/XFrZ5H"
France,FR,fr,,en,en,4idJX1u39R4,https://www.youtube.com/watch?v=4idJX1u39R4,Vegan steak that looks and tastes JUST like meat launches at Tesco,2018-05-19,2018-05-19T05:42:41Z,"Nachel Pono Co., LTD",UCCn-oZB-86W7QO0rPHTtzng,4,0,0,"A plant-based 'steak' that is said to look and taste just like real meat will soon be available at a major supermarket.The steak, which is made of wheat and soy, will launch at 400 Tesco stores across the UK from May 21 as the country sees a boom in popularity for veganism and flexitarian lifestyles.The product has been made by Dutch manufacturer Vivera, which describes it as 'barely distinguishable from real steak' in taste, texture and smell. It comes after British supermarkets have reported a surge in sales of vegan food, with the Vegan Society saying that more than half of adults are adopting plant-based 'buying behaviours'.The number of vegans in the UK has also increased by up to four times in the last 10 years. Share this article Share The new plant-based steak is thought to be the first realistic steak lookalike product to launch in a mainstream UK supermarket. It is not known yet how much it will cost.A spokesman for Vivera said: 'Vivera announces that it, as the first company in the world, will bring the 100 percent plant-based steak to market. Vegetarians, vegans and flexitarians will be able to enjoy this ground-breaking product. 'Vivera has already started production and expects to produce several million pieces in 2018.'The 'steak' will first launch in the UK before arriving in the Netherlands, Germany, France and Italy in the second half of 2018. Gert Jan Gombert of Vivera told Plant Based News: 'A large group of vegetarians, vegans and flexitarians has been very interested in such a product for years. With the breakthrough of its market introduction and large-scale production, a large group of consumers can enjoy this very tasty plant-based product.'The smell, taste and bite can hardly be distinguished from real steak and we are convinced that this product will meet a large need of consumers.'It is very important that we eat less meat, both for our own health, animal welfare and for our planet. Innovative and high-quality plant-based products can make a significant contribution here.' Tesco has made strides in bringing plant-based food to the mass market this year after launching its Wicked Kitchen vegan range in January, developed in collaboration with chefs Derek and Chad Sarno.Bringing these products to the mass market means this will be a big year for veganism, Derek Sarno told Plant Based News.He added: 'This is the year that we will see a major shift in food service offerings. The commitment and stance Tesco has taken...is just amazing!'Accessibility will no longer be a barrier for anyone wanting to embrace a healthier and more compassionate way of eating that actually tastes amazing and isn't just boring and bland. This is here to stay and, and it's far beyond a trend. This is a very exciting year ahead and there's lots more to follow.'"
France,FR,fr,,en,en,zxhGbwYLzXo,https://www.youtube.com/watch?v=zxhGbwYLzXo,Vegan steak that looks and tastes JUST like meat launches at Tesco,2018-05-19,2018-05-19T05:57:54Z,"Xion Gion Co., LTD",UC54v2ky0iUX6K-6cn_dEsLg,17,0,0,"A plant-based 'steak' that is said to look and taste just like real meat will soon be available at a major supermarket.The steak, which is made of wheat and soy, will launch at 400 Tesco stores across the UK from May 21 as the country sees a boom in popularity for veganism and flexitarian lifestyles.The product has been made by Dutch manufacturer Vivera, which describes it as 'barely distinguishable from real steak' in taste, texture and smell. It comes after British supermarkets have reported a surge in sales of vegan food, with the Vegan Society saying that more than half of adults are adopting plant-based 'buying behaviours'.The number of vegans in the UK has also increased by up to four times in the last 10 years. Share this article Share The new plant-based steak is thought to be the first realistic steak lookalike product to launch in a mainstream UK supermarket. It is not known yet how much it will cost.A spokesman for Vivera said: 'Vivera announces that it, as the first company in the world, will bring the 100 percent plant-based steak to market. Vegetarians, vegans and flexitarians will be able to enjoy this ground-breaking product. 'Vivera has already started production and expects to produce several million pieces in 2018.'The 'steak' will first launch in the UK before arriving in the Netherlands, Germany, France and Italy in the second half of 2018. Gert Jan Gombert of Vivera told Plant Based News: 'A large group of vegetarians, vegans and flexitarians has been very interested in such a product for years. With the breakthrough of its market introduction and large-scale production, a large group of consumers can enjoy this very tasty plant-based product.'The smell, taste and bite can hardly be distinguished from real steak and we are convinced that this product will meet a large need of consumers.'It is very important that we eat less meat, both for our own health, animal welfare and for our planet. Innovative and high-quality plant-based products can make a significant contribution here.' Tesco has made strides in bringing plant-based food to the mass market this year after launching its Wicked Kitchen vegan range in January, developed in collaboration with chefs Derek and Chad Sarno.Bringing these products to the mass market means this will be a big year for veganism, Derek Sarno told Plant Based News.He added: 'This is the year that we will see a major shift in food service offerings. The commitment and stance Tesco has taken...is just amazing!'Accessibility will no longer be a barrier for anyone wanting to embrace a healthier and more compassionate way of eating that actually tastes amazing and isn't just boring and bland. This is here to stay and, and it's far beyond a trend. This is a very exciting year ahead and there's lots more to follow.'"
France,FR,fr,,en,en,WHZTuCBKDkA,https://www.youtube.com/watch?v=WHZTuCBKDkA,Vegan steak that looks and tastes JUST like meat launches at Tesco,2018-05-15,2018-05-15T15:56:34Z,"Bat Lona Co., LTD",UC2N6DQDG488vD6AqWncQ1UA,12,0,0,"A plant-based 'steak' that is said to look and taste just like real meat will soon be available at a major supermarket.The steak, which is made of wheat and soy, will launch at 400 Tesco stores across the UK from May 21 as the country sees a boom in popularity for veganism and flexitarian lifestyles.The product has been made by Dutch manufacturer Vivera, which describes it as 'barely distinguishable from real steak' in taste, texture and smell. It comes after British supermarkets have reported a surge in sales of vegan food, with the Vegan Society saying that more than half of adults are adopting plant-based 'buying behaviours'.The number of vegans in the UK has also increased by up to four times in the last 10 years. Share this article Share The new plant-based steak is thought to be the first realistic steak lookalike product to launch in a mainstream UK supermarket. It is not known yet how much it will cost.A spokesman for Vivera said: 'Vivera announces that it, as the first company in the world, will bring the 100 percent plant-based steak to market. Vegetarians, vegans and flexitarians will be able to enjoy this ground-breaking product. 'Vivera has already started production and expects to produce several million pieces in 2018.'The 'steak' will first launch in the UK before arriving in the Netherlands, Germany, France and Italy in the second half of 2018. Gert Jan Gombert of Vivera told Plant Based News: 'A large group of vegetarians, vegans and flexitarians has been very interested in such a product for years. With the breakthrough of its market introduction and large-scale production, a large group of consumers can enjoy this very tasty plant-based product.'The smell, taste and bite can hardly be distinguished from real steak and we are convinced that this product will meet a large need of consumers.'It is very important that we eat less meat, both for our own health, animal welfare and for our planet. Innovative and high-quality plant-based products can make a significant contribution here.' Tesco has made strides in bringing plant-based food to the mass market this year after launching its Wicked Kitchen vegan range in January, developed in collaboration with chefs Derek and Chad Sarno.Bringing these products to the mass market means this will be a big year for veganism, Derek Sarno told Plant Based News.He added: 'This is the year that we will see a major shift in food service offerings. The commitment and stance Tesco has taken...is just amazing!'Accessibility will no longer be a barrier for anyone wanting to embrace a healthier and more compassionate way of eating that actually tastes amazing and isn't just boring and bland. This is here to stay and, and it's far beyond a trend. This is a very exciting year ahead and there's lots more to follow.'"
France,FR,fr,HK,en,en-GB,7awd-y_DTQY,https://www.youtube.com/watch?v=7awd-y_DTQY,"Ugh, fine, I guess you are my little pogchamp",2020-11-20,2020-11-20T05:59:53Z,PEAR哥,UC98FqLb-fljVb4l6e_FdWjw,12276334,533086,25290,"Sadly yes this is the original, I animated this. I'm recently active on here https://twitter.com/Peargor Audio from https://twitter.com/gothmei/status/1309307834677571585"
France,FR,fr,,en,en,IAqRpBA09uI,https://www.youtube.com/watch?v=IAqRpBA09uI,Vegan steak that looks and tastes JUST like meat launches at Tesco,2018-05-15,2018-05-15T14:27:56Z,"Sa Colo Co., LTD",UCv_Dz-hGXc1bz0gNut77LqA,50,0,0,"A plant-based 'steak' that is said to look and taste just like real meat will soon be available at a major supermarket.The steak, which is made of wheat and soy, will launch at 400 Tesco stores across the UK from May 21 as the country sees a boom in popularity for veganism and flexitarian lifestyles.The product has been made by Dutch manufacturer Vivera, which describes it as 'barely distinguishable from real steak' in taste, texture and smell. It comes after British supermarkets have reported a surge in sales of vegan food, with the Vegan Society saying that more than half of adults are adopting plant-based 'buying behaviours'.The number of vegans in the UK has also increased by up to four times in the last 10 years. Share this article Share The new plant-based steak is thought to be the first realistic steak lookalike product to launch in a mainstream UK supermarket. It is not known yet how much it will cost.A spokesman for Vivera said: 'Vivera announces that it, as the first company in the world, will bring the 100 percent plant-based steak to market. Vegetarians, vegans and flexitarians will be able to enjoy this ground-breaking product. 'Vivera has already started production and expects to produce several million pieces in 2018.'The 'steak' will first launch in the UK before arriving in the Netherlands, Germany, France and Italy in the second half of 2018. Gert Jan Gombert of Vivera told Plant Based News: 'A large group of vegetarians, vegans and flexitarians has been very interested in such a product for years. With the breakthrough of its market introduction and large-scale production, a large group of consumers can enjoy this very tasty plant-based product.'The smell, taste and bite can hardly be distinguished from real steak and we are convinced that this product will meet a large need of consumers.'It is very important that we eat less meat, both for our own health, animal welfare and for our planet. Innovative and high-quality plant-based products can make a significant contribution here.' Tesco has made strides in bringing plant-based food to the mass market this year after launching its Wicked Kitchen vegan range in January, developed in collaboration with chefs Derek and Chad Sarno.Bringing these products to the mass market means this will be a big year for veganism, Derek Sarno told Plant Based News.He added: 'This is the year that we will see a major shift in food service offerings. The commitment and stance Tesco has taken...is just amazing!'Accessibility will no longer be a barrier for anyone wanting to embrace a healthier and more compassionate way of eating that actually tastes amazing and isn't just boring and bland. This is here to stay and, and it's far beyond a trend. This is a very exciting year ahead and there's lots more to follow.'"
France,FR,fr,US,en,,Qg1WFvGlqqs,https://www.youtube.com/watch?v=Qg1WFvGlqqs,What Happens To Your Body After Eating A GMO Food? Questions And Answers,2019-02-22,2019-02-22T21:00:02Z,The Real Truth About Health,UCp_ShZAUGtFLpYkgcTrayRQ,3959,118,35,"Lecture by McKay Jenkins author of Food Fight: GMOs and the Future of the American Diet • Staying Healthy in a Toxic World, The Harzardous Substances that American's Eat, Breathe and Touch Everyday. Do you know what chemicals are in your shampoo? How about your cosmetics? Do you know what’s in the plastic water bottles you drink from, or the weed killer in your garage, or your children’s pajamas? If you’re like most of us, the answer is probably no. But you also probably figured that most of these products were safe, and that someone—the manufacturers, the government—was looking out for you. The truth might surprise you. After experiencing a health scare of his own, journalist McKay Jenkins set out to discover the truth about toxic chemicals, our alarming levels of exposure, and our government’s utter failure to regulate them effectively. Mckay Jenkins reveals how dangerous, and how common, toxins are in the most ordinary things, and in the most familiar of places. McKay Jenkins has been writing about people and the natural world for 25 years. His most recent book, Poison Spring (Bloomsbury, 2014), co-written with E.G. Vallianatos, has been called a jaw-dropping expose of the catastrophic collusion between the Environmental Protection Agency [EPA] and the chemical industry.(Booklist, starred review) He is also the author of What’s Gotten Into Us: Staying Healthy in a Toxic World (Random House, 2011), which chronicles his investigation into the myriad synthetic chemicals we encounter in our daily lives, and the growing body of evidence about the harm these chemicals do to our bodies and the environment. Jenkins holds degrees from Amherst, Columbia’s Graduate School of Journalism, and Princeton, where he received a PhD in English. A former staff writer for the Atlanta Constitution, he has also written for Outside, Orion, The New Republic, and many other publications. Jenkins is currently the Cornelius Tilghman Professor of English, Journalism and Environmental Humanities at the University of Delaware, where he has won the Excellence in Teaching Award. “In the past few years, scientists have become increasingly worried about the growing presence of synthetic chemicals in our bodies, and in our environment — and the connection these chemicals may have to cancer, hormonal imbalances, and many other diseases. These are not just the toxins leaking out of industrial dumps — they are the chemicals leaking into us from the products we use every day: from cosmetics, cookware, and the fabric in our upholstery; from pharmaceuticals in our drinking water and the pesticides we spray on our lawns. I learned this the hard way. A few years ago, I discovered a surprise in my abdomen: a tumor the size of a baseball. An hour before I was to enter the operating room, researchers asked if I had ever been exposed to toxic chemicals. In my life, I asked? This seemed like an odd question. What kind of chemicals do you mean? The researchers began reading from a list, which turned out to be very long. Some things I had heard of, many others I had not. Formaldehyde? Weed killers? Glues? Dry cleaning fluids? Detergents? Lacquers? Flame retardants? Plastic meat wrap? Plastic meat wrap? Clearly, what I knew about my chemical exposure history was pretty vague. I decided to search for clues. My new book, What’s Gotten Into Us: Staying Healthy in a Toxic World, takes a clear-eyed look at the ways everyday things may be making us sick, and shows how we can protect ourselves by making wiser, healthier choices. It examines the way products are made and regulated (or, typically, not regulated); the way synthetic chemicals enter our bodies, and the latest research about what this chemical “body burden” may be doing to our health. It looks at our shopping habits, our drinking water, and our lawn care, and it ponders the ways advertising and marketing have blinded us to some pretty obvious problems.” Connect with The Real Truth About Health http://www.therealtruthabouthealth.com/ https://www.facebook.com/The-Real-Truth-About-Health-467500836655781/ https://www.instagram.com/therealtruthabouthealth/ https://twitter.com/RTAHealth Passionate believers in whole food plant based diets, no chemicals, minimal pharmaceutical drugs, no GMO's. Fighting to stop climate change and extinction."
France,FR,fr,,en,en,xEIJneiPo88,https://www.youtube.com/watch?v=xEIJneiPo88,Vegan steak that looks and tastes JUST like meat launches at Tesco | ABS US DAILY NEWS,2018-05-15,2018-05-15T15:46:26Z,"TIN AN CO., LTD",UCqlixRJs2CwjLGph-a8gQYw,24,0,0,"★More ABS NEWS - Entertainment Video►► https://www.youtube.com/channel/UCqlixRJs2CwjLGph-a8gQYw?sub_confirmation=1 A plant-based 'steak' that is said to look and taste just like real meat will soon be available at a major supermarket.The steak, which is made of wheat and soy, will launch at 400 Tesco stores across the UK from May 21 as the country sees a boom in popularity for veganism and flexitarian lifestyles.The product has been made by Dutch manufacturer Vivera, which describes it as 'barely distinguishable from real steak' in taste, texture and smell. It comes after British supermarkets have reported a surge in sales of vegan food, with the Vegan Society saying that more than half of adults are adopting plant-based 'buying behaviours'.The number of vegans in the UK has also increased by up to four times in the last 10 years. Share this article Share The new plant-based steak is thought to be the first realistic steak lookalike product to launch in a mainstream UK supermarket. It is not known yet how much it will cost.A spokesman for Vivera said: 'Vivera announces that it, as the first company in the world, will bring the 100 percent plant-based steak to market. Vegetarians, vegans and flexitarians will be able to enjoy this ground-breaking product. 'Vivera has already started production and expects to produce several million pieces in 2018.'The 'steak' will first launch in the UK before arriving in the Netherlands, Germany, France and Italy in the second half of 2018. Gert Jan Gombert of Vivera told Plant Based News: 'A large group of vegetarians, vegans and flexitarians has been very interested in such a product for years. With the breakthrough of its market introduction and large-scale production, a large group of consumers can enjoy this very tasty plant-based product.'The smell, taste and bite can hardly be distinguished from real steak and we are convinced that this product will meet a large need of consumers.'It is very important that we eat less meat, both for our own health, animal welfare and for our planet. Innovative and high-quality plant-based products can make a significant contribution here.' Tesco has made strides in bringing plant-based food to the mass market this year after launching its Wicked Kitchen vegan range in January, developed in collaboration with chefs Derek and Chad Sarno.Bringing these products to the mass market means this will be a big year for veganism, Derek Sarno told Plant Based News.He added: 'This is the year that we will see a major shift in food service offerings. The commitment and stance Tesco has taken...is just amazing!'Accessibility will no longer be a barrier for anyone wanting to embrace a healthier and more compassionate way of eating that actually tastes amazing and isn't just boring and bland. This is here to stay and, and it's far beyond a trend. This is a very exciting year ahead and there's lots more to follow.'"
France,FR,fr,US,en,en-US,wxm8jTzU_8o,https://www.youtube.com/watch?v=wxm8jTzU_8o,How Cheese Is Made,2018-10-13,2018-10-13T15:00:10Z,Tasty,UCJFp8uSYCjXOMnkUyb3CQ3Q,19882686,156353,10091,"""The better the milk, the better the cheese. Everybody believes that."" Beecher's Handmade Cheese: http://beechershandmadecheese.com/ 5 Spoke Creamery: http://www.5spokecreamery.com/ Check us out on Facebook! - facebook.com/buzzfeedtasty Credits: https://www.buzzfeed.com/bfmp/videos/64865"
