country,search_region_code,search_language,channel_country,default_language,default_audio_language,video_id,url,title,upload_date,published_at,channel,channel_id,view_count,like_count,comment_count,description
Denmark,DK,da,US,en,en,AeRanuiJoVE,https://www.youtube.com/watch?v=AeRanuiJoVE,Danish man shoves Protesting Vegans at a Hamburger restaurant Breaking Burger News AcadianaHamburger,2019-10-10,2019-10-10T13:30:11Z,Live And Local,UCMeRQvE1PoQP7r2p0NRAa1Q,6304,84,20,"Live Music, Festivals, & Events in the Lafayette, LA & Overall Acadiana area in Louisiana. Contact Us anytime or add to the calendar link anytime at https://liveandlocalacadiana.com/live-music-calendar/ Subscribe To Our Feeds by clicking the subscribe here area on the bottom of the website. Be in the know for things to do and for live music today Live And Local Acadiana http://www.liveandlocalacadiana.com/ - Live Music, Events, & Festivals in Acadiana. Radio Louisiana Network located in Louisiana - Find us at http://www.radiolouisiananetwork.com/ http://www.radiolouisiana.com/ http://www.rocklouisiana.com/ http://www.louisianadanceradio.com/ http://www.liveandlocalacadiana.com/ http://www.acadianabn.com/ http://www.liveandlocalnetwork.com/ Find Us 24 hours a day on Rock Louisiana and Radio Louisiana by downloading the app today on the website. Thank you for supporting Louisiana Music and Musicians!"
Denmark,DK,da,SG,en,,XfU9f3qCpZQ,https://www.youtube.com/watch?v=XfU9f3qCpZQ,Sweet Danish Magic - Andersen Ice Cream,2020-10-12,2020-10-12T05:52:55Z,FirstCom Solutions - One Stop Go Digital Agency,UCTRppVuSwqzoGuqnqx16XAA,260,3,0,"Video Produced by FirstCom Solutions. Andersen's of Denmark Ice Cream offers award-winning premium quality ice cream together with quality products. At Andersen's of Denmark Ice Cream, customers are offered superior service in a friendly, clean and inviting Danish environment where the Ice Cream presentation is based around the traditional Danish! Since 2020, we have been enabling businesses to take that first step to go Digital, otherwise we have been building and growing our client's brands and services islandwide. If you share our passion, find us on the many channels available below. Follow us on Instagram: https://www.instagram.com/FirstComSol... Make our acquaintance on Facebook: https://www.facebook.com/firstcomsolu... Share your experience with us: ☎️68484984 |🌐www.firstcom.com.sg"
Denmark,DK,da,CH,en,en,spALZizXwZQ,https://www.youtube.com/watch?v=spALZizXwZQ,"GRØD - DENMARK, KØBENHAVN",2018-03-26,2018-03-26T05:15:04Z,Local Traveller,UCmewrYvcSd-_hOKLLHNWeMQ,1158,8,0,"DOWNLOAD THE APP: https://itunes.apple.com/fr/app/local-traveller/id1199035677?l=en&mt=8 GRØD - DENMARK, KØBENHAVN http://groed.com/ Grød was the first porridge in Copenhagen and since its opening in 2011, it has been very successful with their Nordic porridge adventures. Together with Broste Copenhagen, they have now designed a frame that fits perfectly with both the cold and the hot porridge dishes. Address: kl tv 50 Jægersborggade København N, 2200 København, Denmark Phone: +45 50 58 55 79 info@groed.com https://www.facebook.com/groed https://www.instagram.com/groedcph Copyright © GRØD APS Music by:http://www.epidemicsound.com Local Traveller By Willo’s Worlds Also on : Site : http://www.localtraveller.com Facebook : https://www.facebook.com/localtravellerofficial Twitter : https://twitter.com/WillosWorlds Instagram: https://www.instagram.com/local.traveller.official/ Make sure you subscribe! Thank you!!"
Denmark,DK,da,,en,,fzVqyRCb8ZM,https://www.youtube.com/watch?v=fzVqyRCb8ZM,Vegetarian LOSES IT at McDonald's staff for wrong order!!,2019-03-19,2019-03-19T13:23:39Z,Daily Mail World,UCw3fku0sH3qA3c3pZeJwdAw,40082,133,85,"The man, who has not been named but was with a woman and child, flew into a rage after ordering veggie burgers at the drive-thru restaurant in Aylesford, Kent. When staff got his order wrong a second time, the furious customer approached the food counter and demanded to speak to head office. Original Article: http://www.dailymail.co.uk/news/article-6826149/McDonalds-vegetarian-customer-rants-staff-serve-meat-twice.html Original Video: http://www.dailymail.co.uk/video/news/video-1886138/Video-Vegetarian-shouts-McDonalds-staff-getting-order-wrong.html Daily Mail Facebook: http://facebook.com/dailymail Daily Mail IG: http://instagram.com/dailymail Daily Mail Snap: https://www.snapchat.com/discover/Daily-Mail/8392137033 Daily Mail Twitter: http://twitter.com/MailOnline Daily Mail Pinterest: http://pinterest.co.uk/dailymail Daily Mail Google+: https://plus.google.com/+DailyMail Get the free Daily Mail mobile app: http://dailymail.co.uk/mobile"
Denmark,DK,da,DK,en,,iUIgZoiUg-0,https://www.youtube.com/watch?v=iUIgZoiUg-0,How nature helps you stay healthy - Danish Ancient Kale by Green Gourmet Denmark,2019-07-31,2019-07-31T09:37:06Z,GREEN GOURMET,UCXw8tspkjbfFQvfAXikXgdQ,161,1,0,"In this video, we show the story of our delicate green kale powder from the seeds until the end product ""KaLOHAS"". Hope you will learn more about our kale after watching this video. If any questions, always feel free to contact us! Green Gourmet Denmark Email: ulla.andersen@green-gourmet.dk Phone: +45 86 40 81 04 Website: https://green-gourmet.dk/ Facebook: https://www.facebook.com/www.greengourmetdenmark.dk/ Instagram: https://www.instagram.com/greengourmetdenmark/ Linkedin: https://www.linkedin.com/company/green-gourmet-denmark/?viewAsMember=true Please follow us!"
Denmark,DK,da,GB,en,,T2bY6C_OZJA,https://www.youtube.com/watch?v=T2bY6C_OZJA,Indian Subway employee puts bacon in Muslim mans food,2019-05-12,2019-05-12T21:11:52Z,Mango Lussi,UCktKiv2_btOHPoU6D0byXyg,580,12,4,Mic Righteous confronts Subway staff for putting bacon into his cheese sub. Recorded at a branch near Victoria Coach Station
Denmark,DK,da,PL,en,en,XXrCHq370lA,https://www.youtube.com/watch?v=XXrCHq370lA,CARE 2018 | David Pedersen: Veganism is capitalism in practice,2019-02-15,2019-02-15T23:57:38Z,CARE: Conference on Animal Rights in Europe,UC1ph0HH-knzyW0UubRfNrbA,212,2,1,"It has been said that the cold war began to thaw, and capitalism definitively prevailed, not with the fall of the Berlin wall on November 9th 1989, but on January 31st 1990, the day a McDonalds opened in the heart of Moscow. There’s some anecdotal evidence to suggest, that neither capitalism nor McDonalds is mentioned in flattering, loving terms among the broader animal protection movement. Regardless of any lack of love on our part, it is clear, however, that in the big arm-wrestling contest of ideologies, capitalism has won the Darwinian gold-medal, in the “Survival of the Fittest”-category. Economic thinking has affected the weighing of arguments in global discourse, to a point where matters of public and planetary health, animal welfare and food justice is overruled by concerns of economic growth almost every time, as if we were playing a pre-determined game of “Rock, Paper, Return on Investment”. One option would be to boycott the system all together and become self-sustainable farmers. However, we have tasked ourselves with the protection of billions of farmed animals, and global meat consumption is projected to rise, regardless of our own consumption patterns. Luckily, recent years have seen an explosion in the supply and demand for alternatives to animal products and our movement is well-positioned to accelerate this “protein-transitioning”. The strategy becomes then, perhaps less one of direct resistance towards a hegemonic ideology, but of how we can use the logic inherent in the system, to help some animals not get eaten. The concrete suggestion will be to expand the movement vocabulary to include new vegan classics such as “Risk-Mitigation through Diversification of your Protein Portfolio”, “Revenue Generation through Reduction of Supply-Chain Complexity”, “Future-proofing Production-Flow by Internalizing External Costs” and many others. About the speaker: David has been running the Meat Free Monday Campaign in Denmark for 4 years. His degree in Philosophy, Social Entrepreneurship and Business Management, makes for a compelling combination of the soft values of veganism with the cold, revenue-generating language of the corporate world. Among others he has done a vegetarian training course for the Copenhagen Association of Butchers, showing them that consumers and investors all over the world are increasingly becoming interested in one important question: Where do we get our protein? Favorite topics include meat-a-physics, the business case for green proteins, dry danish sarcasm and trans-ideological messaging. He is currently working as a campaign manager for ProVeg International. https://www.careconf.eu #CAREconfPrague #AnimalRights"
Denmark,DK,da,,no,,_JHm3e3v0Rg,https://www.youtube.com/watch?v=_JHm3e3v0Rg,Espresso House | Strømmen Storsenter,2018-12-10,2018-12-10T11:03:13Z,StrommenStorsenter,UCbrf_OT07ZlMwTdfF7S4m6Q,540,7,0,Ta en pause i shoppingen med en deilig kopp kaffe og en matbit hos Espresso House! De nye lokalene har en behagelig stemning som gir deg muligheten til en fortjent pust i bakken. Vi holder til i 1. etasje i Strømmen Storsenter.
Denmark,DK,da,SG,en,,QpqscQix_PU,https://www.youtube.com/watch?v=QpqscQix_PU,LCP Topic 11: Culture & Cross-Cultural Consumer Behaviour - McDonalds Confirm Shiok ad,2020-05-15,2020-05-15T07:09:21Z,Learning Consumer Psychology,UCB1HHjVg2xhDUFpRA7AMxVQ,296,3,0,"In this McDonalds Singapore advertisement, the use of local slang enhances connection with the local audience. Note: I do not own the copyrights to the video"
Denmark,DK,da,,en,en,BLclFeOPClE,https://www.youtube.com/watch?v=BLclFeOPClE,Dutch Valley Market,2019-08-15,2019-08-15T15:52:06Z,newdaycleveland,UCtLd3sOV5Jl0hBqi6tS9-hA,564,9,1,"https://www.dhgroup.com/shops/dutch-valley-market * * * * * * * * * * * * * * * * * * * * Produced & Edited by New Day Cleveland © 2019 WJW Television, LLC All Rights Reserved. * * * * * * * * * * * * * * * * * * * *"
Denmark,DK,da,US,en,en-US,zpS9PPOvK5k,https://www.youtube.com/watch?v=zpS9PPOvK5k,How to Make Vegan Golden Milk Spice Blend | Healthy Recipes | Kroger,2018-01-15,2018-01-15T20:44:53Z,Kroger,UCjlF9Z_Fz-0siGLYYIIcIYw,955,10,0,"Vegan Golden Milk Spice Mix Shop the recipe: https://www.kroger.com/r/vegan-golden-milk-spice-mix-recipe/5ad9ffea84aea5f4550f909b Serves: 40 Ingredients 1 cup Simple Truth™ Coconut Oil 2 tablespoons grated fresh ginger root 1⁄2 cup Simple Truth™ Ground Turmeric 1 teaspoon fresh ground black pepper 2 teaspoons Simple Truth™ Ground Cinnamon 1 teaspoon ground cardamom 1⁄4 teaspoon ground cloves 1⁄2 cup Simple Truth™ Coconut Sugar Step 1 Melt ½ cup of the coconut oil in a medium sauté pan and add the ginger root, turmeric, and black pepper and heat until they sizzle. Stir in the cinnamon, cardamom and cloves. Transfer the spice blend to a mixing bowl. Step 2 Stir in the remaining ½ cup coconut oil and the coconut sugar and stir to mix well. Pour into a glass storage jar and allow to cool at room temperature, stirring occasionally until set up to make sure that the spices do not all settle to the bottom of the container. Seal the container and keep in the refrigerator for up to 3 weeks, or keep frozen for up to 6 months. Step 3 To make a cup of golden milk, heat 1-1½ teaspoons of the spice blend in a small saucepan and add 8 ounces of almond, soy, hempseed, or coconut milk and heat until warmed through. SUBSCRIBE: https://bit.ly/2YD5zdK About Kroger: Liberating the food lovers of America, subscribe for fresh content and food inspiration. We are Fresh For Everyone. At Kroger, we are nearly half a million associates who serve over 11 million customers daily. We provide Americans with a seamless digital shopping experience, 2,761 retail food stores under a variety of banner names, and aim to create Zero Hunger Zero Waste communities by 2025. #Kroger #FreshForEveryone #KrogerRecipes Website:https://www.kroger.com YouTube:https://www.youtube.com/kroger Facebook:https://www.facebook.com/kroger Instagram:http://instagram.com/krogerco Pinterest:http://www.pinterest.com/krogerco Twitter:https://twitter.com/kroger How to Make Vegan Golden Milk Spice Blend | Healthy Recipes | Kroger https://youtu.be/zpS9PPOvK5k Kroger http://www.youtube.com/kroger"
Denmark,DK,da,US,en,en,qRgrXbVtGo0,https://www.youtube.com/watch?v=qRgrXbVtGo0,Vegan protester at McDonald’s,2020-07-28,2020-07-28T15:39:57Z,THEPLANETEARTH,UCcTZ9A6-KvxmHBaHY8WA7kw,2638,49,21,
Denmark,DK,da,US,en,,vV7Di49dBHQ,https://www.youtube.com/watch?v=vV7Di49dBHQ,How to Pay with MobilePay at Nayax Payment Machines,2018-04-24,2018-04-24T09:43:59Z,Nayax,UC1Tx6scQDDbHRQoXXtlWOFQ,372290,691,13,"Now MobilePay, the leading payment app in Denmark, is now available for transactions with any Nayax cashless payment device. Payments via static QR code provide a seamless, quick and painfree customer experience! Learn all about Nayax’s cashless payment solutions: VPOS TOUCH All-In-One Cashless & Telemetry Device https://www.youtube.com/watch?v=ed2QGyX0LEQ VPOS Touch is Nayax’s all-in-one solution for cashless payments and integrated telemetry. Now create marketing and sales opportunities that can bring great consumer engagement for improved upsell and increased revenue. Consumers can experience the personal touch of their neighborhood store combined, with the convenience of a 24/7 unattended, automated operation. Find out more: https://www.nayax.com/cashless_payments/vpos-touch/ VPOS FUSION Cashless Payment Card Reader https://www.youtube.com/watch?v=8xyyM6nF3xw Featuring BILL VALIDATOR SUPPORT. One device for all payments, both CASH AND CASHLESS The all-in-one solution for payments also features integrated telemetry and a dynamic marketing, loyalty & consumer engagement platform, for increased revenue. Find out more: https://www.nayax.com/cashless_payments/vpos-fusion/ ONYX Contactless Card Reader https://www.youtube.com/watch?v=gB4SdpIvGgY Innovative card reader & telemetry device. Featuring NFC payments & QR codes This sleek contactless card reader can fit on any small machine and gives your consumer a convenient cashless payment experience. While consumers complete transactions quickly, operators access a world of operational benefits and insights, notably increased sales. The Onyx is more than a card reader: It’s a device packed with powerful capabilities including contactless, NFC and QR payments, telemetry, marketing tools and remote machine management. Find out more: https://www.nayax.com/cashless_payments/onyx-contactless-card-reader/ ABOUT NAYAX: Nayax offers a complete cashless solution including telemetry, management suite and consumer engagement tools, to unattended retail and self-serve markets. Nayax’s features help operators improve their day-to-day operations and long-term planning, while their marketing tools assist operators in transforming unattended machines into 24/7 retail stores with consumer engagement and IoT activities. As a global company, Nayax’s goal is to provide all payment methods in each region, ensuring consumers can pay with their preferred payment method, wherever they are located."
Denmark,DK,da,,en,,ZkMy6WJ1k3A,https://www.youtube.com/watch?v=ZkMy6WJ1k3A,“Manager accused of selling drugs at McDonald’s”,2020-12-20,2020-12-20T17:23:51Z,Top Tea News,UCTN9dWxXEFqN7_S_1oFKV3Q,2171,46,2,
Denmark,DK,da,US,en,,cFcvXDGoHiA,https://www.youtube.com/watch?v=cFcvXDGoHiA,Pesto Puff Pastry Twists,2020-07-09,2020-07-09T15:30:49Z,FastFood,UCRx8Q-sqXjgWnHPeUDW3gUg,150,0,0,"Fast food is a type of mass-produced food designed for commercial resale and with a strong priority placed on ""speed of service"" versus other relevant factors involved in culinary science. Fast food was originally created as a commercial strategy to accommodate the larger numbers of busy commuters, travelers and wage workers who often did not have the time to sit down at a public house or diner and wait for their meal. By making speed of service the priority, this ensured that customers with strictly limited time (a commuter stopping to procure dinner to bring home to their family, for example, or an hourly laborer on a short lunch break) were not inconvenienced by waiting for their food to be cooked on-the-spot (as is expected from a traditional ""sit down"" restaurant). For those with no time to spare, fast food became a multibillion-dollar industry. Describing food is not as easy as it would seem. How many ways can you say something was really tasty? You can compare a dish to a picture, a sports game, a musical performance or give it personality. Describe its sunny or somber mood, shyness, assertiveness, or contradiction of flavors. Knowing the words for describing tastes and flavors will help you to find the right adjective in other areas."
Denmark,DK,da,,en,,aVFPlJD-1n4,https://www.youtube.com/watch?v=aVFPlJD-1n4,Wok N Grill in Kolding | Ordertake away food,2018-05-10,2018-05-10T06:53:39Z,Alexander Østergaard,UCY0xznTS-riborpbX_SgN4A,134,3,0,"Wok n Grill in Kolding offes you as a customer, whatever you want. Is it the traditional burger you want, It has several burgers that you can choose from, whatever you want. Visit Here:- https://wokngrill-kolding.dk/ See Menu:- https://wokngrill-kolding.dk/menu Visit here for take away food:- https://eatmore.dk/takeaway/wok-n-grill/"
Denmark,DK,da,US,en,en,ZejUfmbojho,https://www.youtube.com/watch?v=ZejUfmbojho,American Candy Makers Try Denmarkian Candy,2018-06-03,2018-06-03T12:00:06Z,Hercules Candy,UCFV5pMEsfMP8duOumA8klmA,92386,2009,413,"Check out our website: https://www.herculescandy.com/ Hercules Merch: https://zazzle.com/herculescandy Add us on Snapchat @herculescandy Find us on Facebook: @Hercules Candy https://www.facebook.com/Hercules-Candy-Co-145420888813009/?fref=ts Follow us on instagram: @herculescandy https://www.instagram.com/herculescandy/ Follow us on Twitter: https://twitter.com/herculescandyco?lang=en Craig's YouTube channel: https://www.youtube.com/channel/UCyZ9pEYl4VeOBKVhehwXWUg Follow Craig on instagram: @noeggcraig https://www.instagram.com/noeggcraig/ outro music: $hake by itsmi on soundcloud https://soundcloud.com/itsmimusic/hake The following are affiliate links, which means if you click on any of them and purchase anything from Amazon within 24 hours of clicking on it I (Craig) will receive a small commission. If you love these videos and want to support me then it's a great way to do so without you having to actually pay me anything. my camera & go to lens: https://www.amazon.com/gp/product/B00DMS0LCO/ref=as_li_tl?ie=UTF8&camp=1789&creative=9325&creativeASIN=B00DMS0LCO&linkCode=as2&tag=noe036-20&linkId=23d0c22ca9ed27ad0912049c016339be what I edit with: https://www.amazon.com/gp/product/B01N7IBN3D/ref=as_li_tl?ie=UTF8&camp=1789&creative=9325&creativeASIN=B01N7IBN3D&linkCode=as2&tag=noe036-20&linkId=947b9c345921c248cbf8a73e4b307f16 my microphone: https://www.amazon.com/gp/product/B00GQDORA4/ref=as_li_tl?ie=UTF8&camp=1789&creative=9325&creativeASIN=B00GQDORA4&linkCode=as2&tag=noe036-20&linkId=e120e64b860d0f45b969344d1e29afec my tripod: https://www.amazon.com/gp/product/B013UES9UU/ref=as_li_tl?ie=UTF8&camp=1789&creative=9325&creativeASIN=B013UES9UU&linkCode=as2&tag=noe036-20&linkId=fd65096964e7a937557be04686df0bd7"
Denmark,DK,da,AU,en,en-GB,6XdwydOJgSk,https://www.youtube.com/watch?v=6XdwydOJgSk,POLICE STOP VEGAN PROTESTER,2020-08-15,2020-08-15T02:42:49Z,Tash Peterson,UCOo6-OQIgEnzQW-0T6_HECQ,8773,223,211,"Why should YOU be vegan? Watch this to find out: https://watchdominion.org 🔞 All links: https://vganbooty.com ♻️ Vegan tees: https://linktr.ee/vganclan 📧 Contact me: https://tashpeterson.com/contact If you wish to support my animal rights activism, you can join here: 🐷 Patreon: https://patreon.com/vganbooty 🐄 This video will CHANGE your life: https://youtu.be/LQRAfJyEsko 🌱 How to go VEGAN: https://veganeasy.org/challenge?ref=tash ⚠️ Watch DOMINION MOVEMENT (YouTube) & SEASPIRACY (Netflix) ❗️Veganism is an ethical view against exploitation, abuse & murder of non-human animals ❗️Animals are forced into slaughterhouses, murdered & their flesh chopped into pieces for you to consume their body parts ❗️Dairy cows are r*ped & forcibly impregnated to produce milk for humans to profit from, steal & consume. When mother dairy cows give birth, their babies are KIDNAPPED from them & murdered if they’re born male ❗️The egg industry enslaves chickens & murders egg laying hens once they don’t produce enough eggs. The baby male chicks are macerated ALIVE the moment they’re born ❗️ The flesh (meat), dairy, egg, honey, skin (leather), wool, fur, down (feathers), scales, silk, non-human animal breeding (pets), captivity (zoos & aquariums), entertainment (circuses), racing (horse & greyhounds) & testing (beauty products etc.) industries are exploitative, abusive & UNETHICAL ❗️SPECIESISM = RACISM = SEXISM: ALL are forms of OPPRESSION ❗️Do YOU choose exploitation, abuse & murder OR veganism? ⚠️ Other YouTube channels to follow: ➡️ EDUCATIONAL: https://youtube.com/ed.winters & https://youtube.com/GaryYourofskyAdaptt ➡️ DEBATES: https://youtube.com/jackhiggs269 & https://youtube.com/JoeyCarbstrong 🎥 Content filmed by Jack Higgs: https://youtube.com/jackhiggs269 About Tash: Tash is an animal rights activist based in Perth, Western Australia. She has been featured and interviewed on various media outlets across the world including UniLad, New York Post, Sky News Australia & Piers Morgan Uncensored UK. The Project and Flashpoint Australia have also aired featured stories about her activism on national TV. Tash is known for her unique and controversial style of activism, which she states is essential for social awareness and change, because civil disobedience generates attention to animal rights through media exposure."
Denmark,DK,da,CH,en,en,jWzYraUg5EA,https://www.youtube.com/watch?v=jWzYraUg5EA,ISM 2019: A New RUBY Era | Barry Callebaut,2019-02-28,2019-02-28T10:06:58Z,Barry Callebaut Group,UCIO2EOsmiegRP7E-7OUv5uA,2109,53,0,"With the unveiling of Ruby as the fourth type of chocolate we launched one of the greatest breakthroughs in chocolate in decades in Shanghai in 2017. Since its launch, we have seen many consumer and artisanal brands, including Prestat, Baci Perugina, KitKat, Leonidas and Fazer, introducing Ruby in their own products for their consumers in Asia Pacific, Europe, the Middle East and South Africa. At ISM 2019, we painted the town RUBY and brought chefs from around the world to come together, with our customers and the press, to offer workshops and showcase Ruby’s signature creations in confectionery, drinks, bakery, dairy and desserts. Eleven of our customers are introducing their own Ruby chocolate products, and that’s only at this year’s ISM. At ISM 2019, we clearly gave our customers an even bigger reason to visit the ‘BC Studio’ dedicated to Ruby, to taste and experience the intense sensorial delight offered by Ruby. As we continue to build Ruby chocolate as the fourth category of chocolate, we look forward to many more Ruby launches over the next coming months and years. Ruby chocolate is THE food trend to watch. From Saturday Night Live hailing its U.S. launch to making ranks for being the most innovative products in lists by the American (NY Mag, National Confectioners Association), Australian (Smooth FM), Danish (7-Eleven), Indian (Harper’s Bazaar India), Japanese (Nikkei trendy), Middle Eastern (Gulfood Manufacturing Industry Excellence Awards 2018) and even global associations and media (Foodbev), Ruby chocolate has clearly seen its global renown skyrocket since its launch. Ruby even made it on the dessert menu at the Official Afterparty of the Oscars, offering the guests and celebrities of Hollywood the taste of the berry-fruitiness and luscious smoothness of the fourth category of chocolate. #BarryCallebaut #ISM2019 #RubyChocolate ► Read more on: https://rubychocolate.com --- More information: https://www.barry-callebaut.com/ Follow us: Facebook: https://www.facebook.com/BarryCallebautGroup/ LinkedIn: https://www.linkedin.com/company/barry-callebaut-group/"
Denmark,DK,da,US,en,en,6PH88aAL7hU,https://www.youtube.com/watch?v=6PH88aAL7hU,The Season's Best Holiday Ad - Bouygues Christmas (still awesome in 2024),2018-11-26,2018-11-26T03:12:59Z,Anthony Miyazaki,UCwVtaxLBmcLQs7G0flLT4og,3039325,27704,1583,"Subscribe... New ads on their way! (Try these two: https://www.youtube.com/watch?v=0Ha1dtAFbAA and https://youtu.be/RuWWLZRvkh4) Great ads for families, kids, fathers, mothers, and those who get teary-eyed at the joys of nostalgia. Ad: ""Bouygues Christmas 2018"" Director: Martin Werner Agency: BETC Paris Music: ""Come and Get Your Love"" by Redbone Product/Brand: Bouygues Telecom Client Management: Tanguy Moillard, Anne-Laure Dreano, Audrey Longuet Agency Management: Bertille Toledano, Mathieu Laugier, Vera Lucas, Justine Avenel, Elodie Colin Executive Creative Director: Stéphane Xiberras Creative Directors: David Soussan, Marie-Ève Schoettl Copywriter: Rémi Campet Art Director: Rayhaan Khodabux Music Creative Director: Christophe Caurret Agency Producer: Sebastien Lintingre Production Company: Henry Producer: Jean Ozannat Sound Production: General Pop CAST: Father: Truchi Christophe (http://twitter.com/TruchiChristop1 & https://vimeo.com/167623419) Mother: (Unknown -- if you know, please mention it in the comments.) Boy as child: (Unknown -- if you know, please mention it in the comments.) Boy as teen/young adult: (Unknown -- if you know, please mention it in the comments.)"
