country,search_region_code,search_language,channel_country,default_language,default_audio_language,video_id,url,title,upload_date,published_at,channel,channel_id,view_count,like_count,comment_count,description
Netherlands,NL,nl,,en,nl,fZ7ahu7aUVE,https://www.youtube.com/watch?v=fZ7ahu7aUVE,"Vegetarian and Vegan NPD (product development) examples at TOP b.v. Wageningen, Netherlands (c) 2020",2020-09-23,2020-09-23T05:47:19Z,Wouter De Heij,UCflKxdqZ41Mek689bz_yZ0Q,402,1,5,Some illustrations of NPD projects that run at TOP b.v. We are specialised in practical food innovations in the domain vegetarian and vegan products. Thus plant-based proteins. Primary the NPD of products liked by the new flexitarian consumers (we call this 'real meat applications') that could be stored 'chilled' is part of our skill-set at TOP b.v. Take a look at : www.top-bv.nl Wouter de Heij www.wouterdeheij.nl www.wouterdeheij.com
Netherlands,NL,nl,,en,en-US,4m6fLtUdeyc,https://www.youtube.com/watch?v=4m6fLtUdeyc,"Plant-based plastic decomposes in years, not centuries",2020-07-17,2020-07-17T09:12:15Z,AP Archive,UCHTK-2W11Vh1V4uwofOfR4w,417,9,5,"(12 Jul 2020) LEAD IN: A company has developed a plant-based plastic that it says can be used commercially but with less environmental impact that petroleum-based plastics. Avantium hopes a major drinks producer will use the technology when the company opens its first factory in 2023. STORY-LINE: Could this be the eco-friendly future of plastics? Amsterdam biochemical company Avantium has created a plant-based plastic that can be used in items like bottles for fizzy drinks. The company uses a chemical bio based polymer called Polyethylene Furanoate, PEF - also called the polyester of the future. The compound is a 100 percent bio-based alternative to petroleum-based PET (polyethylene terephthalate) commonly used in many consumer products and packaging. Last autumn, Avantium joined a project to create a plant-based and recyclable paper bottle. A thin layer of the PEF is enough to stop gas from permeating the bottle, essential for holding beverages like beer and carbonated drinks. """"That's why PEF and in this case, this paper bottle are such a good match because the strengths for the paper bottle will come from the paper and you only need a thin layer of PEF for the barrier properties to have to keep the content well for a desired period of time,"" says Gert-Jan Gruter, Avantium's Chief Technology Officer. The company claims that once it is thrown away, the plant-based plastic will degrade naturally in just a few years rather than over several centuries. It thinks its product could compete in many areas where plastic is used. ""It's also an interesting material, too, to consider and evaluate for fibre applications to go to textiles, apparel. We're looking at film applications because of the barrier material, so you can make stretch film for food packaging or for non-food packaging,"" says Gruter. There is still research to be done. Avantium is conducting experiments to see how its plant-based material degrades in different environments. Samples are placed in containers filled with fresh and salt water, earth and sediment. The company wants its product to be recycled but needs to know what will happen if it is thrown away instead. How to deal with discarded plastics is an area many scientists are grappling with. All too often, bottles, bags and other packaging end up in nature where they pollute the environment for centuries. ""So we need bio-based plastics with a good or superior performance that can be recycled, that are saving CO2, that are known to last but rapidly biodegrade once they get into the ocean or in the environment. And that last part, that's something we still need to further develop and optimize,"" explains Dr. Jacco van Haveren, a researcher at the Biobased Chemicals and Fuels Institute of the Wageningen University who has no connection to Avantium. Van Haveren's team of researchers is about to start research into ways plastic can be broken down more quickly. The EU-funded project will investigate how an enzyme incorporated into packaging could help. ""Once the plastic gets into the environment or in seawater, for instance, the enzyme package gradually opens up and then the enzyme starts to eat, effectively, the plastic, thereby degrading the plastic,"" says van Haveren. Avantium has announced it will open a production factory in 2023, hoping to win support from environmentally conscious soft drink and beer producers. Its production volume will be modest - and therefore expensive. ""In the beginning, it's impossible to compete on price with the existing polymers that are produced at millions of tons in really large factories,"" says Gruter. Find out more about AP Archive: http://www.aparchive.com/HowWeWork Twitter: https://twitter.com/AP_Archive Facebook: https://www.facebook.com/APArchives ​​ Instagram: https://www.instagram.com/APNews/ You can license this story through AP Archive: http://www.aparchive.com/metadata/youtube/e2bec7d2ffe74680982ffa7aa89baf17"
Netherlands,NL,nl,AT,en,en-GB,m7c5dV1OUg8,https://www.youtube.com/watch?v=m7c5dV1OUg8,EHFG 2020 - S5: Science of healthy living,2020-10-29,2020-10-29T09:14:41Z,European Health Forum Gastein,UCXGLKdXnw-HcbjalpZfGLAw,108,1,0,"Challenging the status quo to enable healthier choices Organised by United European Gastroenterology (UEG) Unhealthy lifestyles, often driven by the consumption of ultra-processed food and alcohol, fuel the growing burden of chronic digestive diseases. This session will discuss the impact of alcohol and unhealthy foods on (digestive) health with a focus on the commercial determinants of health. You will hear about the synergies that exist between risk factors such as alcohol, sugar, and obesity and the development of liver disease, as well as the existing links between unhealthy food and cancer. To explore the influence marketing has on unhealthy eating habits, the discussion will also provide a critical perspective on consumer behaviour in the context of marketing practices. With the aim of making a case for the availability and affordability of healthy food, industry’s efforts on that matter will also be showcased. Policy-wise, the discussion will focus on good practice examples of public health interventions which have enabled positive systemic change. Speakers & panellists BENTE MIKKELSEN, Director, Department of Noncommunicable Diseases, World Health Organization EMMA CALVERT, Food Policy Officer, European Consumer Organisation (BEUC) MARKUS PECK-RADOSAVLJEVIC, Chair of Public Affairs Committee, UEG MONIQUE VAN LEERDAM, Netherlands Cancer Institute, Netherlands Cancer Institute SHIRA ZELBER-SAGI, Head of School of Public Health, Faculty of Social Welfare and Health Sciences, University of Haifa MODERATED BY ANYA SITARAM, Founding Director and Executive Producer, Rockhopper TV"
Netherlands,NL,nl,US,en,,3LP9falrw3M,https://www.youtube.com/watch?v=3LP9falrw3M,Caterpillar Doesn't Want to be Carried || ViralHog,2019-06-11,2019-06-11T15:37:26Z,ViralHog,UC3339WgBDKIcxTfywuSmG8w,1383039,18090,544,"Occurred on August 9, 2018 / Monteverde, Costa Rica ""While doing an entomology internship in Monteverde, Costa Rica this past summer, I came across this massive caterpillar, the larva of Pachylia syces. I went to pick it up but was shocked and a little alarmed to find that it had a strange defense mechanism. This giant caterpillar thrashed around and made a loud clicking noise, unlike anything I'd ever seen or heard before! The caterpillar's crazy looking colors and surprising behavior are unique and fascinating."" Contact licensing@viralhog.com to license this or any ViralHog video. Make money from your videos! Submit footage here: https://goo.gl/yejGkm Subscribe, Like, or Follow ViralHog: YouTube: https://goo.gl/A0gBKk Facebook: https://goo.gl/XQWqJt Instagram: https://goo.gl/NMq8dl Twitter: https://goo.gl/pF8Xop"
Netherlands,NL,nl,US,en,en-US,8LwveoDO_M8,https://www.youtube.com/watch?v=8LwveoDO_M8,Questions to ask at the End of an Interview,2020-09-20,2020-09-20T13:00:02Z,Life Work Balance,UCAGFQKnwEz4rrOiCqxO6Egg,3267151,113453,3177,"Questions to ask in a job interview: there are three different types of questions you should ask during a job interview. Watch this video to see what those three different types of questions are AND what types of questions you should NOT ask during an interview. If you’re looking for customized help with your job search process (including crafting your answers to very common interview questions, creating an incredible resume that will help you get noticed, or general interview prep) check out my website and let me know if you want to work together! Check out my website here: https://lwbalance.com Check out the different services I offer, pricing, and schedule directly with me here: https://lwbalance.com/services/pricing/ Email me directly at: abby@lwbalance.com Check out my website for a **FREE** list of 52 common behavior-based interview questions: https://lwbalance.com/2020/06/06/free-list-of-52-behavior-based-interview-questions/ ~*~*~*~*~*~*~*~*~*~*~*~*~*~*~*~*~*~*~*~*~*~*~*~*~*~* WATCH NEXT: Questions to ask at the End of an Internal Interview: https://youtu.be/S7eU33hsYR8 Questions to Ask at the END of Your FIRST Interview: https://youtu.be/A3Rv34iJMns Questions to Ask at the End of a Second-Round Interview: https://youtu.be/aXAtzOvAGRA CULTURE Questions to Ask at the End of an Interview: https://youtu.be/85TM4LTQDTk ROLE-SPECIFIC Questions to Ask at the End of an Interview: https://youtu.be/F2veJT6mTvQ HARD/HESITATION Questions to Ask at the End of an Interview: https://youtu.be/CTOWbYPfCcc How to answer almost ANY interview question: https://youtu.be/qFCwtSA2y5U Tell me about yourself: How to answer this common interview question: https://youtu.be/KhzLqsOj2y4 Interview Tips: Questions about Weaknesses: https://youtu.be/hFJ_0P_zf5A Interview Tips playlist: https://www.youtube.com/playlist?list=PLzWOz8R0BVKl4PETqrCvLdQJyGvPQFx4m ~*~*~*~*~*~*~*~*~*~*~*~*~*~*~*~*~*~*~*~*~*~*~*~*~*~* 🎉Have my videos helped you in your job search or landed you a job? If you'd like to say thanks you can always buy me a coffee ☕️ or sponsor me on Patreon! Buy me a ☕️ : https://www.buymeacoffee.com/abbyLWB Sponsor me: https://www.patreon.com/lifeworkbalance Life Work Balance Amazon Store SHOP AMAZON to see my favorite things! It's no extra cost to you, but it does give me a small percentage for giving you the recommendation! SHOP → → → https://www.amazon.com/shop/lifeworkbalance Items to help you have a successful: 🎥 video interview: https://a.co/f0CJ6r7 👥 in-person interview: https://a.co/7adbf3r Want customized coaching or consulting to help you with the interview process? Check out my packages here: https://lwbalance.com/services/pricing/ Visit my website for a **FREE** Resume e-book: https://lwbalance.com/2020/05/16/free-resume-e-book/ Connect with me! LinkedIn: https://www.linkedin.com/in/abigail-hoeh Facebook: https://www.facebook.com/lwbalance Instagram: https://www.instagram.com/lwbalance/ Twitter: https://twitter.com/lwbalance1 Subscribe today! https://www.youtube.com/channel/UCAGFQKnwEz4rrOiCqxO6Egg About Life Work Balance & Abby: Hi! I help individuals, companies, and organizations obtain and use the tools needed to improve their professional, relational, and organizational performance. Feeling like your job is draining all of your energy and you're looking for a change? Interested in becoming an entrepreneur, but not sure where to start? Abby & Life Work Balance are here for you! Please subscribe and hit that notifications bell to be updated when new videos are uploaded every Sunday! #lifeworkbalance #career #careercoach #careeradvice #HowTo #Interview #InterviewQuestions #QuestionsToAsk #QuestionsToAskDuringInterview #JobSearch #Interviewing"
Netherlands,NL,nl,US,en,en-US,9xnHrBzLgaQ,https://www.youtube.com/watch?v=9xnHrBzLgaQ,Don't Waste Your Money: Best laundry detergents,2018-04-07,2018-04-07T18:09:53Z,WXYZ-TV Detroit | Channel 7,UC6HyKpYWmX4zsy6_bJZIK7A,1930552,14079,2186,"Powder, liquid, pods. When it comes to laundry detergent, the options seem endless."
Netherlands,NL,nl,US,en,en,zLxrRD0nEC4,https://www.youtube.com/watch?v=zLxrRD0nEC4,How To Remove Toxic Heavy Metals From Your Brain And Fix Your Hormones with Dr. Dan Pompa,2019-02-01,2019-02-01T17:17:34Z,Biohacking Secrets,UCwVWQ2SUXd7_psW6hneYPSw,1631,44,6,"In this episode, I sit down with Dr. Daniel Pompa, D.C., Dr. Dan is a global leader in the health and wellness industry, having traveled across the country for the past 15 years educating practitioners and the public on the root causes of inflammation driven diseases such as Weight Loss Resistance, Hypothyroid, Diabetes, Chronic Fatigue Syndrome, Autoimmune Disorders and other chronic conditions. His authority today is rooted in his own personal battle, having overcome serious neurotoxic illness using the tools and strategies included in True Cellular DetoxTM. At the core of his own recovery, True Cellular DetoxTM passionately fuels his mission and is changing lives around the world. Dr. Pompa's multi-faceted approach to cellular healing is a key factor in his practitioners' coaching program, wherein he teaches practitioners cutting edge methods to transform clients health and lives. He is also the host of Cellular Healing TV, watched throughout the world via the Internet, and co-host of Health Seekers radio, a nationally syndicated radio show. Links True Cellular Detox Challenge: Tcdbiohack.com Website: Drpompa.com Studies EWS Study - 200+ chemicals found in umbilical cord blood: https://www.ewg.org/research/body-burden-pollution-newborns Drasch Study - Mercury in mother's mouths directly proportional to heavy metals in baby's brains: https://www.ncbi.nlm.nih.gov/pmc/articles/PMC3025977/ Videos Smoking Tooth Video: https://www.youtube.com/watch?v=9ylnQ-T7oiA Tests Genova Complete Hormones: https://www.gdx.net/product/complete-hormones-test-urine DUTCH Hormone Test: https://dutchtest.com/ Cone Beam Test: https://www.radiologyinfo.org/en/info.cfm?pg=dentalconect Life Extension C-Reactive Protein Test: https://www.lifeextension.com/Vitamins-Supplements/itemLC120766/C-Reactive-Protein-CRP-Cardiac-Blood-Test Life Extension Hemoglobin A1C Test: https://www.lifeextension.com/Vitamins-Supplements/itemLC001453/Hemoglobin-A1C-HbA1C-Blood-Test Visual Contrast Sensitivity Test: https://www.vcstest.com/ Life Extension NMR LipoProfile: https://www.lifeextension.com/Vitamins-Supplements/itemLC123810/NMR-LipoProfile-Blood-Test CONNECT WITH ANTHONY AND BIOHACKING SECRETS Click Here to Subscribe via Apple Podcasts https://itunes.apple.com/us/podcast/the-biohacking-secrets-show/id1139825099 Click Here to Subscribe via Stitcher https://www.stitcher.com/podcast/the-biohacking-secrets-show Click here to Subscribe via Podbean https://www.podbean.com/podcast-detail/65smi-4316a/The-Biohacking-Secrets-Show-Podcast Get Anthony’s Free Book: The Biohacker’s Guide to Upgraded Energy and Focus (just help with s/h) https://biohackersguide.com/biohackers-guide-free See If You Qualify For A FREE $10,000 Trusii Molecular Hydrogen Water Machine (apply for the Case Study) www.trusiih2.com/biohacks Overweight? Stressed? Under-Performing? Apply to Work with Anthony 1-On-1 to Get In The Best Shape of Your Life and Unlock High Performance in Body and Mind www.biohackingsecrets.com/coaching Get your FREE Avoid the Afternoon Energy Crash Cheat Sheet here – https://biohackersguide.com/energycrash Follow Anthony on Facebook – https://www.facebook.com/anthonydiclementi Subscribe to the Biohacking Secrets channel on YouTube here – http://bit.ly/BSYTsubscribe Follow Biohacking Secrets on Instagram – https://www.instagram.com/biohackingsecrets/ DISCLAIMER: This communication does not provide medical advice. The information, including but not limited to, text, videos, graphics, images and other material contained in this communication are for informational purposes only. The purpose of this message is to promote broad consumer understanding and knowledge of various health topics. It is not intended to be a substitute for professional medical advice, diagnosis or treatment. Always seek the advice of your physician or other qualified health care provider with any questions you may have regarding a medical condition or treatment and before undertaking a new health care regimen, and never disregard professional medical advice or delay in seeking it because of something you have read in this message or in materials or websites referred to herein."
Netherlands,NL,nl,,en,en-US,KkFuBQFbQ0A,https://www.youtube.com/watch?v=KkFuBQFbQ0A,"Plant-based plastic decomposes in years, not centuries",2020-07-18,2020-07-18T12:23:13Z,AP Archive,UCHTK-2W11Vh1V4uwofOfR4w,328,10,0,"(13 Jul 2020) LEAD IN: A company has developed a plant-based plastic that it says can be used commercially but with less environmental impact that petroleum-based plastics. Avantium hopes a major drinks producer will use the technology when the company opens its first factory in 2023. STORY-LINE: Could this be the eco-friendly future of plastics? Amsterdam biochemical company Avantium has created a plant-based plastic that can be used in items like bottles for fizzy drinks. The company uses a chemical bio based polymer called Polyethylene Furanoate, PEF - also called the polyester of the future. The compound is a 100 percent bio-based alternative to petroleum-based PET (polyethylene terephthalate) commonly used in many consumer products and packaging. Last autumn, Avantium joined a project to create a plant-based and recyclable paper bottle. A thin layer of the PEF is enough to stop gas from permeating the bottle, essential for holding beverages like beer and carbonated drinks. """"That's why PEF and in this case, this paper bottle are such a good match because the strengths for the paper bottle will come from the paper and you only need a thin layer of PEF for the barrier properties to have to keep the content well for a desired period of time,"" says Gert-Jan Gruter, Avantium's Chief Technology Officer. The company claims that once it is thrown away, the plant-based plastic will degrade naturally in just a few years rather than over several centuries. It thinks its product could compete in many areas where plastic is used. ""It's also an interesting material, too, to consider and evaluate for fibre applications to go to textiles, apparel. We're looking at film applications because of the barrier material, so you can make stretch film for food packaging or for non-food packaging,"" says Gruter. There is still research to be done. Avantium is conducting experiments to see how its plant-based material degrades in different environments. Samples are placed in containers filled with fresh and salt water, earth and sediment. The company wants its product to be recycled but needs to know what will happen if it is thrown away instead. How to deal with discarded plastics is an area many scientists are grappling with. All too often, bottles, bags and other packaging end up in nature where they pollute the environment for centuries. ""So we need bio-based plastics with a good or superior performance that can be recycled, that are saving CO2, that are known to last but rapidly biodegrade once they get into the ocean or in the environment. And that last part, that's something we still need to further develop and optimize,"" explains Dr. Jacco van Haveren, a researcher at the Biobased Chemicals and Fuels Institute of the Wageningen University who has no connection to Avantium. Van Haveren's team of researchers is about to start research into ways plastic can be broken down more quickly. The EU-funded project will investigate how an enzyme incorporated into packaging could help. ""Once the plastic gets into the environment or in seawater, for instance, the enzyme package gradually opens up and then the enzyme starts to eat, effectively, the plastic, thereby degrading the plastic,"" says van Haveren. Avantium has announced it will open a production factory in 2023, hoping to win support from environmentally conscious soft drink and beer producers. Its production volume will be modest - and therefore expensive. ""In the beginning, it's impossible to compete on price with the existing polymers that are produced at millions of tons in really large factories,"" says Gruter. Find out more about AP Archive: http://www.aparchive.com/HowWeWork Twitter: https://twitter.com/AP_Archive Facebook: https://www.facebook.com/APArchives ​​ Instagram: https://www.instagram.com/APNews/ You can license this story through AP Archive: http://www.aparchive.com/metadata/youtube/8199de921d5d41c8b291342e86cd6eaa"
Netherlands,NL,nl,GB,en-GB,en,t4z7Nes9I3U,https://www.youtube.com/watch?v=t4z7Nes9I3U,French lockdown forcing some restaurants to bite the bullet,2020-11-26,2020-11-26T16:43:49Z,euronews,UCSrZ3UV4jOidv8ppoVuvW9Q,634,5,0,With a lockdown that READ MORE : https://www.euronews.com/2020/11/26/french-lockdown-forcing-some-restaurants-to-bite-the-bullet Subscribe to our channel: https://www.youtube.com/c/euronews?sub_confirmation=1 Watch our LIVE here: https://www.youtube.com/c/euronews/live Subscribe to our thematic channels: NoComment: https://www.youtube.com/c/nocommenttv?sub_confirmation=1 Euronews Living: http://bit.ly/2sMsaDB Knowledge: https://www.youtube.com/c/euronewsknowledge?sub_confirmation=1 Euronews is available on YouTube in 12 languages: https://www.youtube.com/user/euronewsnetwork/channels #WebDigitalStories
Netherlands,NL,nl,US,en,,WzmUkCfE1Xo,https://www.youtube.com/watch?v=WzmUkCfE1Xo,U.S. Beverage Market Outlook 2020: Grocery Shopping & Personal Consumption in the Coronavirus Era,2020-07-08,2020-07-08T20:47:58Z,Packaged Facts,UC_xqlS6615oBL1V9xdjMlsA,270,1,0,"To learn more, visit us at https://hubs.ly/H0shSNr0 Most packaged beverage categories are mature and rely primarily on population growth, leaving beverage marketers with the challenge of bringing something new to the table. Opportunities abound for companies that invest in new product launches, seasonal offerings, the addition of functional ingredients and specialty flavors, and different marketing tactics to appeal to changing consumer preferences. The COVID-19 pandemic has led to a sudden and sharp increase in demand for beverages in the retail sector – albeit not to the degree of the food sector, which saw more extensive stockpiling – as consumption has been shifted from the foodservice industry (including cafeterias in schools and restaurants) to the home. As a result, demand on the retail side has increased to balance some amount of the losses in the foodservice market as consumers shift their beverage spending to at-home consumption. With a focus on “what’s next” – along with bringing decades of food and beverage market perspective and analysis to the table – U.S. Beverage Market Outlook 2020 is packed with insights about consumer trends, behavior, and motivations. This report delivers actionable predictions and recommendations designed to guide retailers, service providers, wholesalers, beverage processors, packaging firms, and investors in making business decisions about the beverage market."
Netherlands,NL,nl,US,en,en,k8K6wQLxooU,https://www.youtube.com/watch?v=k8K6wQLxooU,Product Team Meeting - 2019-07-09,2019-07-09,2019-07-09T14:58:18Z,GitLab Unfiltered,UCMtZ0sc1HHNtGGWZFDRTh5A,1003437,2398,,
Netherlands,NL,nl,US,en,,zK4zbQ4VJs8,https://www.youtube.com/watch?v=zK4zbQ4VJs8,71 Year Old Fruitarian Explains Why Fruitarian Vegan Is The Best Form Of Veganism,2020-10-11,2020-10-11T20:35:11Z,Fruit n Sport,UCdXmOi1_w4vTI8Aay5jo4oQ,924,94,23,"Check Out Our Shopping Bag- https://tinyurl.com/ycyx26xn VISIT the WEBSITE HERE: https://www.FruitNSport.com https://www.facebook.com/fruitnsport Get Tom’s Program for transitioning to healthy living here: Please visit https://www.FruitNSport.com for Tom's digital products on how to start transitioning to healthy eating, and feeling better than ever. It includes a 96 page E-Book with the mindset you want to develop and delicious recipes for breakfast, lunch, dinner, salad dressings and desserts. It also includes Tom’s Top 10 Smoothies and Tom’s report on why the Standard American Diet (S.A.D.) creates disease and does not promote health. Get it today at the regular low price of $47 Hope you enjoyed, please SUBSCRIBE, LIKE and COMMENT down below. Check Out My Store: https://tomaverytennisctwacademy.myspreadshop.com/ #TomAvery #Fruitarian #vegancoach, #vegandiet, #veganrecipes, #plantbasedcoach, #plantbasedrecipes, #veganfitness, #plantbasedfitness, #transitioningtovegan, #transitioningtoplantbased, #plantbaseddiet, #4URHealthyself. #lowfatrawveganfruitarian, #fruitarianlifestyle, #fruitarianrecipes, #fruitarian, #71YearOldFruitarian, #TomAvery, #Sports, #athletes, #athletesdiet, #seniors, #Seniorhealth Fruit Farm Tour Does Talking To Plants Help Them Grow? Coach Tom Avery Healthy Living Raw Food Vegan Discloser: All My Content Is From My Personal Experience, And Years Of Study. The Links Above Helps Me Support This Channel To Educate Other. Thank you For Your Support. #TomAvery # Fruitarian #vegancoach VISIT the WEBSITE HERE: https://www.FruitNSport.com I'm giving away a FREE bundle that includes: 96 Page Vegan Diet Recipes, my Top 10 Smoothies and a 30 Day Guide to help you transition. Please send an email to: info@tomavery.com saying: ""I'M READY!"" Then I know you're committed to improving your health and I will forward to you via email 3 of my best digital products including a 96 page E-Book with recipes for breakfast, lunch, dinner, salad dressings and desserts. Hope you enjoyed, please SUBSCRIBE, LIKE and COMMENT down below."
