country,search_region_code,search_language,channel_country,default_language,default_audio_language,video_id,url,title,upload_date,published_at,channel,channel_id,view_count,like_count,comment_count,description
Netherlands,NL,nl,US,en,en,LJYWM-5taIE,https://www.youtube.com/watch?v=LJYWM-5taIE,"3D-printed, plant-based steak is here",2020-07-07,2020-07-07T18:17:05Z,Yahoo Finance,UCEAZeUIeJs0IjQiqTCdVSIg,183398,466,157,"This startup combined plant-based meat with 3D-printing technology to join the global alternative meat market. #vegetarian #plantbasedsteak #3dplantbasedsteak Subscribe to Yahoo Finance: https://yhoo.it/2fGu5Bb About Yahoo Finance: At Yahoo Finance, you get free stock quotes, up-to-date news, portfolio management resources, international market data, social interaction and mortgage rates that help you manage your financial life. Connect with Yahoo Finance: Get the latest news: https://yhoo.it/2fGu5Bb Find Yahoo Finance on Facebook: http://bit.ly/2A9u5Zq Follow Yahoo Finance on Twitter: http://bit.ly/2LMgloP Follow Yahoo Finance on Instagram: http://bit.ly/2LOpNYz"
Netherlands,NL,nl,,en,en,WHZTuCBKDkA,https://www.youtube.com/watch?v=WHZTuCBKDkA,Vegan steak that looks and tastes JUST like meat launches at Tesco,2018-05-15,2018-05-15T15:56:34Z,"Bat Lona Co., LTD",UC2N6DQDG488vD6AqWncQ1UA,12,0,0,"A plant-based 'steak' that is said to look and taste just like real meat will soon be available at a major supermarket.The steak, which is made of wheat and soy, will launch at 400 Tesco stores across the UK from May 21 as the country sees a boom in popularity for veganism and flexitarian lifestyles.The product has been made by Dutch manufacturer Vivera, which describes it as 'barely distinguishable from real steak' in taste, texture and smell. It comes after British supermarkets have reported a surge in sales of vegan food, with the Vegan Society saying that more than half of adults are adopting plant-based 'buying behaviours'.The number of vegans in the UK has also increased by up to four times in the last 10 years. Share this article Share The new plant-based steak is thought to be the first realistic steak lookalike product to launch in a mainstream UK supermarket. It is not known yet how much it will cost.A spokesman for Vivera said: 'Vivera announces that it, as the first company in the world, will bring the 100 percent plant-based steak to market. Vegetarians, vegans and flexitarians will be able to enjoy this ground-breaking product. 'Vivera has already started production and expects to produce several million pieces in 2018.'The 'steak' will first launch in the UK before arriving in the Netherlands, Germany, France and Italy in the second half of 2018. Gert Jan Gombert of Vivera told Plant Based News: 'A large group of vegetarians, vegans and flexitarians has been very interested in such a product for years. With the breakthrough of its market introduction and large-scale production, a large group of consumers can enjoy this very tasty plant-based product.'The smell, taste and bite can hardly be distinguished from real steak and we are convinced that this product will meet a large need of consumers.'It is very important that we eat less meat, both for our own health, animal welfare and for our planet. Innovative and high-quality plant-based products can make a significant contribution here.' Tesco has made strides in bringing plant-based food to the mass market this year after launching its Wicked Kitchen vegan range in January, developed in collaboration with chefs Derek and Chad Sarno.Bringing these products to the mass market means this will be a big year for veganism, Derek Sarno told Plant Based News.He added: 'This is the year that we will see a major shift in food service offerings. The commitment and stance Tesco has taken...is just amazing!'Accessibility will no longer be a barrier for anyone wanting to embrace a healthier and more compassionate way of eating that actually tastes amazing and isn't just boring and bland. This is here to stay and, and it's far beyond a trend. This is a very exciting year ahead and there's lots more to follow.'"
Netherlands,NL,nl,,en,en,ShVODfuJcrU,https://www.youtube.com/watch?v=ShVODfuJcrU,Is the Future of Meat Meatless?,2018-03-06,2018-03-06T20:43:56Z,CB Insights,UC96nq-gVV0vy96gfYXfEhmA,87,0,0,This is an excerpt from the Food Tech: 2018 Trends to Watch Briefing. Click to watch the full video here: https://www.cbinsights.com/research/briefing/food-tech-trends-in-2018/
Netherlands,NL,nl,,en,,aufrxJy7Y7U,https://www.youtube.com/watch?v=aufrxJy7Y7U,Food for Earth Day FFI/FAO- Session 17: Chicago,2020-04-22,2020-04-22T20:28:48Z,Future Food Institute,UCcACWXpqrTNom1q0ZJ6fqmw,791,17,0,SESSION 17 - ILLINOIS - CHICAGO #FoodforClimateLeague Food for Earth Day: the world’s largest lesson on feeding the future in a 24-hour global marathon with FAO. Watch now the 17th session! #goodaftercovid19 #food4earth #earthday
Netherlands,NL,nl,,en,en,B_u7w_0nVjs,https://www.youtube.com/watch?v=B_u7w_0nVjs,Plant-based burgers | FoodTest Dummies episode 2,2019-10-22,2019-10-22T13:06:11Z,EIT Food,UCwRtNjyVEL8eZt8fdxfENJQ,107,0,0,"Our curious team gives their verdict on new novel foods and the latest food tech. In this second edition, we're sampling plant-based aubergine burgers, made by our #RisingFoodStar FoodPairing This video featured in our Future of Food newsletter. Sign up here to receive this kind of content directly in your inbox: https://www.eitfood.eu/newsletter-subscription/"
Netherlands,NL,nl,,en,,L3mlbmZ8mZE,https://www.youtube.com/watch?v=L3mlbmZ8mZE,Meet the new Milkman – Stretching the Concept of Milk,2020-10-21,2020-10-21T16:08:28Z,Think East Netherlands,UCBO5qjJTHqyhszJYH2nWlAg,436,4,0,"Be part of the protein revolution and get inspired by Tom and Bart Grobben. These two young innovative farmers tell how they transformed the milk business of their parents into a new business model. They believe in local, transparent and ustainable products. They created the first Dutch plant based Milkman for production from seed-to-product. A Short Food Chain, in order to deliver delicious local flavoured, Twente Soy Milk to consumers."
Netherlands,NL,nl,HK,en,en,1tIanjHHKfU,https://www.youtube.com/watch?v=1tIanjHHKfU,Nestle gears up to launch its own plant-based burger in the US,2019-06-03,2019-06-03T16:23:09Z,YT Night News,UC0X7KM_MtznTh2oIe0SD54Q,136,1,0,"Thank you, everyone, for watching my videos and sharing them with friends ❤️. Please follow our twitter https://twitter.com/YTNightNews1 and get the latest hot news in future.Nestle is looking to take a bite of the growing U.S. plant-based burger market.Through its Sweet Earth brand, which it acquired in 2017, the global food giant will launch its Awesome Burger in the fall. The vegan meat substitute will be available at grocery stores, restaurants and universities.Sweet Earth founders Brian and Kelly Swette said they began developing their own plant-based burger several years ago — before nearly every restaurant chain announced a plant-based option and Beyond Meat went public.The Swettes are not newcomers to plant-based meat alternatives either. The company they founded makes about 13,000 pounds of plant-based protein, including meatless bacon and ham, every day. While the Awesome Burger is not Sweet Earth's first veggie burger, it is the first by the brand that is meant to more closely mimic real burgers.As the world's largest food company, Nestle is able to help Sweet Earth with sourcing and production — a competitive advantage for the plant-based food brand, according to Kelly Swette. Both Impossible Foods and Beyond Meat, the two leading purveyors of plant-based burgers, have struggled at times to meet soaring demand because of limited production capacity. ""We have great admiration for our competitors and what they're trying to do, but we're also excited about competing,"" Brian Swette said.In April, Nestle launched a soy- and wheat-based veggie burger under its Garden Gourmet brand in Europe. German customers can purchase its Incredible Burger in McDonald's. Sweet Earth's burger will be primarily made with yellow pea protein. ""We just felt for the U.S. market, pea protein is really trending and is popular for a variety of reasons, one of which is that it's an extremely sustainable crop,"" Kelly Swette said.Beyond also uses pea proteins for its beef substitutes, while Impossible Foods uses a soy protein base.An organic version of the Awesome Burger will also be sold. Kelly Swette said that the burger acts similarly to traditional beef when cooked but is higher in protein and fiber.The Awesome Burger will be priced ""competitively"" to other plant-based burgers. But down the road, she said, as manufacturing and sourcing improve, the price could move closer to that of a beef burger.Nestle is not the only Big Food company trying to compete with Impossible Foods and Beyond Meat as more consumers try to reduce how much meat they eat. Tyson Foods sold its stake in Beyond prior to the latter's initial public offering so that it could make its own meatless burger. Kellogg's Morningstar Farms brand plans to be entirely plant-based by 2021. And last year, Unilever acquired The Vegetarian Butcher, a Dutch maker of plant-based meat.More U.S. consumers are eating meat substitutes as a way of reducing their meat consumption for health and environmental reasons.Alexia Howard, a senior research analyst at Bernstein, estimates that sales of imitation products, which account for around $13 billion currently, could rise to $40 billion to $41 billion in the next 10 years."
Netherlands,NL,nl,US,en,en-US,Zv0SPOGMzsc,https://www.youtube.com/watch?v=Zv0SPOGMzsc,Meat mimics -- are they really healthier for you?,2019-08-21,2019-08-21T18:11:49Z,LOCAL 12,UC673WfesrYoCgG9VsekGlEQ,117,2,0,"CINCINNATI (WKRC) - A new report takes a closer look at something that looks and tastes like meat but really isn't, and some say it may or may not be good for you. Meatless meals are certainly trendy right now. Many of us are trying to choose ""almost"" burgers and ""not"" dogs to try and reduce the risk for common health concerns linked to red meat, such as heart disease and certain types of cancer. But when it comes to meat mimics, are they really better for you than real beef burgers? Nutrition specialists at the Cleveland Clinic reviewed a new report that takes a look at everything from burgers made from pea protein to those that even bleed like real meat when you toss them on the grill. For the most part, when they evaluated these products, they found they can be lower in fat and calories than some beef burgers. They also may have more fiber if they are made with added grains. But according to this report, we don't actually have a lot of long-term data to figure that out. While some are good for the environment, they point out that it may depend on how you serve them or choose to eat them. For example, if you put cheese, mayonnaise, avocado and onion straws on a meatless burger, you may get as many calories, or more, than a plain, lean beef burger. You also can get as much fat with lots of toppers, although it may be a better kind of fat compared to the saturated fat in some beef. The bottom line is that while plant proteins are recommended to reduce red meat intake, don't be fooled into thinking that just because it mimics meat, it's the secret to eating a healthier diet. As with anything, how it's prepared and what it's served with will make a big difference in your overall diet. Since many are served in restaurants with fries, getting a side salad or topping it with other vegetables instead may be the real secret to making this food a healthier option."
Netherlands,NL,nl,,en,en-US,II3e2ioh2ms,https://www.youtube.com/watch?v=II3e2ioh2ms,Nutrition and processed foods: A perspective from Hinoman's CEO,2019-10-31,2019-10-31T06:24:58Z,McKinsey & Company,UCQMqUlg362Hhar_iCZ9tcjQ,520,7,0,"The CEO of an agritech start-up shares his views on how to make processed foods healthier. See more in ""The future of food: Meatless?"" in The Next Normal series: https://www.mckinsey.com/featured-insights/the-next-normal/alternative-proteins"
Netherlands,NL,nl,US,en,,YmL4TYCbDoc,https://www.youtube.com/watch?v=YmL4TYCbDoc,The Nutrition Doctor | Dr. P.K. Newby Discusses Beyond Meat,2019-06-24,2019-06-24T15:05:22Z,Dr. P.K. Newby,UC4X6QOPZme2R4ncQSjfsqPA,387,3,0,I'm kind of obsessed with Beyond Meat. Check out the video for more info on why. (Interview with NBC10 meteorologist Michael Page)
Netherlands,NL,nl,,en,en,IAqRpBA09uI,https://www.youtube.com/watch?v=IAqRpBA09uI,Vegan steak that looks and tastes JUST like meat launches at Tesco,2018-05-15,2018-05-15T14:27:56Z,"Sa Colo Co., LTD",UCv_Dz-hGXc1bz0gNut77LqA,50,0,0,"A plant-based 'steak' that is said to look and taste just like real meat will soon be available at a major supermarket.The steak, which is made of wheat and soy, will launch at 400 Tesco stores across the UK from May 21 as the country sees a boom in popularity for veganism and flexitarian lifestyles.The product has been made by Dutch manufacturer Vivera, which describes it as 'barely distinguishable from real steak' in taste, texture and smell. It comes after British supermarkets have reported a surge in sales of vegan food, with the Vegan Society saying that more than half of adults are adopting plant-based 'buying behaviours'.The number of vegans in the UK has also increased by up to four times in the last 10 years. Share this article Share The new plant-based steak is thought to be the first realistic steak lookalike product to launch in a mainstream UK supermarket. It is not known yet how much it will cost.A spokesman for Vivera said: 'Vivera announces that it, as the first company in the world, will bring the 100 percent plant-based steak to market. Vegetarians, vegans and flexitarians will be able to enjoy this ground-breaking product. 'Vivera has already started production and expects to produce several million pieces in 2018.'The 'steak' will first launch in the UK before arriving in the Netherlands, Germany, France and Italy in the second half of 2018. Gert Jan Gombert of Vivera told Plant Based News: 'A large group of vegetarians, vegans and flexitarians has been very interested in such a product for years. With the breakthrough of its market introduction and large-scale production, a large group of consumers can enjoy this very tasty plant-based product.'The smell, taste and bite can hardly be distinguished from real steak and we are convinced that this product will meet a large need of consumers.'It is very important that we eat less meat, both for our own health, animal welfare and for our planet. Innovative and high-quality plant-based products can make a significant contribution here.' Tesco has made strides in bringing plant-based food to the mass market this year after launching its Wicked Kitchen vegan range in January, developed in collaboration with chefs Derek and Chad Sarno.Bringing these products to the mass market means this will be a big year for veganism, Derek Sarno told Plant Based News.He added: 'This is the year that we will see a major shift in food service offerings. The commitment and stance Tesco has taken...is just amazing!'Accessibility will no longer be a barrier for anyone wanting to embrace a healthier and more compassionate way of eating that actually tastes amazing and isn't just boring and bland. This is here to stay and, and it's far beyond a trend. This is a very exciting year ahead and there's lots more to follow.'"
Netherlands,NL,nl,,en,,7KNkQCLklBA,https://www.youtube.com/watch?v=7KNkQCLklBA,The Protein Shift - Jeroen Willemsen,2018-06-24,2018-06-24T10:07:31Z,Jeroen Willemsen Food for Impact,UCBs1I8xrtwCLUpnbxMK6nOg,11,0,0,"Dutch 'Green Protein Crusader' Jeroen Willemsen: the protein transition creates opportunities for consumers, entrepreneurs and governments."
Netherlands,NL,nl,,en,en-US,693SdK_IiiQ,https://www.youtube.com/watch?v=693SdK_IiiQ,"2019 - veganism becomes mainstream, even at Easter",2019-04-23,2019-04-23T09:19:25Z,AP Archive,UCHTK-2W11Vh1V4uwofOfR4w,61,1,0,"(18 Apr 2019) +REPLAY W/UPDATED LEAD IN + UK VEGANISM SOURCE: ASSOCIATED PRESS RESTRICTIONS: AP Clients Only LENGTH: 6:31 ASSOCIATED PRESS London, UK - 6 March 2019 1. Various of chef making vegan cheese using almonds and cashew milk in the wine and vegan cheese night at the Plant Academy 2. Vegan cheeses ASSOCIATED PRESS London, UK - 30 March 2019 3. Lauren Lovett teaching Plant Hub's Decadent Desserts workshop 4. SOUNDBITE (English) Lauren Lovett, Plant Hub co-founder and creator of the Plant Academy academy: ""Like fermentation is a hot thing right now, like everyone kind of knows what it is. But, people still have that kind of barrier of 'I have no idea how to make kimchi, sauerkraut, kombucha' (a fizzy fermented tea). But, yeah what I'm noticing, especially with that, is that people dabble at home, but when it's something like that which is really simple, but does like a more of a kind of advanced technique, people really just need to see it once and then they do it."" ASSOCIATED PRESS London, UK - 6 March 2019 5. Various of participants at the wine and vegan cheese night ASSOCIATED PRESS London, UK - 30 March 2019 6. SOUNDBITE (English) Lauren Lovett, Plant Hub co-founder and creator of the Plant Academy academy: ""It's a tipping point. Yeah, if you go anywhere in England especially where I'm from in The Cotswolds, I can go to the village pub and there are loads of options on the menus. I think people have, like chefs have realised that it's necessary. We have so many more kind of intolerances and things these days that vegan, gluten-free food hopefully is accessible to everyone, so I think people are picking up on the demand."" 7. Various of customer eating in the cafe 8. Pan from shelf with containers of kombucha to people in the cafe 9. Various of Plant Hub co-founder and chef Antonio Alderuccio cooking in the kitchen 10. Plate of full cooked plant based breakfast 11. SOUNDBITE (English) Antonio Alderuccio, Plant Hub co-founder and chef: ""We destroyed the wall in between professional side and customer because also after they eat our dinner they can also try to book a workshop with us and we can teach them how to make a dinner too. So we just tried to change the normal standard way in between, the relation between the customer and the restaurant"". 12. People making cannabidiol (CBD slices) - a take on the millionaire shortbread - in the Decadent Desserts workshop. CBD is the non-psychoactive part of cannabis. The green CBD slice has a coconut caramel carob topping 13. SOUNDBITE (English) Charlie May, Decadent Desserts Workshop participant and chef: ""I think it is massively changing. There's courses like this for example that you would never have had like even five years ago, becoming more accessible. But also not only courses but online, every other video I see, I know it's probably tailored to me on Instagram because of what I watch, but every other video I see is a recipe or a like a snippet of how to create something vegan."" 14. Close of CBD shortbread 15. SOUNDBITE (English) Mica Vaipan, entrepreneur: ""I've had over the last, particularly over the last 10 years, I've dealt with a lot of intolerances, I've dealt with inflammations, internal inflammations, fungal infections, just you name it. And increasingly, without even realising, I have moved towards a plant based diet."" ASSOCIATED PRESS London, UK - 22 March 2019 16. Set up shot of Edward Bergen, Global Food & Drink Analyst for research firm Mintel 17. SOUNDBITE (English) Edward Bergen, Global Food & Drink Analyst, Mintel: ASSOCIATED PRESS London, UK - 30 March 2019 LEAD IN: STORYLINE: Find out more about AP Archive: http://www.aparchive.com/HowWeWork Twitter: https://twitter.com/AP_Archive Facebook: https://www.facebook.com/APArchives ​​ Instagram: https://www.instagram.com/APNews/ You can license this story through AP Archive: http://www.aparchive.com/metadata/youtube/46c29480282230da60a2055ea480ded5"
Netherlands,NL,nl,CA,en,en,cO9g4Cf0GA0,https://www.youtube.com/watch?v=cO9g4Cf0GA0,Vegan Salami | Deli Meat - no weird ingredients,2020-08-12,2020-08-12T17:20:36Z,YdaJun's Plant-based Kitchen,UCZvlms-yJ4ZL-zuJ71jG5Zw,411470,17776,1121,"If you're missing the taste of deli meat yet want something healthier, please try this vegan salami. It’s so easy to make, has no weird ingredients and tastes amazing! If you try this recipe, please feel free to leave a review in the comments below on how you liked it! Also, take a picture of your salami and share it on Instagram, please tag us @ydajunsplantbasedkitchen and use the hashtag #ydajunsplantbasedkitchen, we would love to see your remakes! Note: To get a more successful result and to make measurements more precise, using a kitchen scale is highly recommended. Enjoy! Ingredients for white “fat”: 40g vital wheat gluten (⅓ cup) 16g cornstarch (2 Tbsp) 1 tsp onion powder 60g water (¼ cup) 15g olive oil (1 Tbsp) Dry Ingredients for red “meat”: 120g vital wheat gluten (1 cup) 1 Tbsp onion powder 1 Tbsp garlic powder ½ tsp ground white pepper 1 tsp ground black pepper 1 tsp smoked paprika Wet Ingredients for red “meat”: 120g water (½ cup) 30g olive oil (2 Tbsp) ½ bouillon (porcini mushroom) ½ tsp kosher salt 1 tsp sugar 1 Tbsp apple cider vinegar 1 tsp liquid smoke 1 small raw beet (80g), peeled & chopped (optional, used for color) Our Favorite Products: 5 Quart Mixer: https://amzn.to/3DO7nrj 7 Quart Mixer: https://amzn.to/4hoQK3d Loaf Pan: https://amzn.to/4ii1W2R 16 Cup Food Processor: https://amzn.to/4bFyX6F 3.5 Cup Food Chopper/Processor: https://amzn.to/4ikY94X Personal Blender: https://amzn.to/4iH4yqY High Speed Blender: https://amzn.to/4kA9Ypr 5-Pc Food Container Set: https://amzn.to/4hkR0Al 3-Pc Food Container Set: https://amzn.to/41D0T6B Air Fryer: https://amzn.to/4kFhHCJ Disclaimer: As an Amazon Associate I earn from qualifying purchases. This means that, at zero cost to you, I will earn an affiliate commission if you click through the link and finalize a purchase. Other links in this video description may also be affiliate links. Thank you for your support! Music: Tenderness - Bensound Source: http://www.bensound.com #VeganSalami #vegandeli #vegandelimeat #veganmeat"
Netherlands,NL,nl,US,en,en,KI5xkaBwSH0,https://www.youtube.com/watch?v=KI5xkaBwSH0,Plant Based Foods – Enough Already?,2019-11-18,2019-11-18T18:18:43Z,The Lempert Report,UCn9VI_rQ-ABp2upZB505M5Q,85,0,0,"FMI’s 2019 U.S. Grocery Shopper Trends report finds a rising number of households (33%) have at least one member voluntarily following a vegan, vegetarian, pescatarian or flexitarian diet - a trend which is higher for Gen Z and Millennial households. Plant-based proteins are foods that can fit into many of these unique diets, but are we getting carried away? Atomo, based in Seattle which is known for its coffee and headquarters of Starbucks has decided to get in the plant-based beverage business with a lab-based beverage “molecular coffee,” rather than using traditional coffee beans. Why you ask? The company wants to eliminate the negative environmental impacts of growing coffee. According to the Rainforest Alliance, the increasing demand for coffee will likely be a large driver of deforestation over the coming decade, with climate change forcing many farms to shift to high-altitude, heavily forested regions. The expansion of coffee farming is now responsible for nearly 250,000 acres of deforestation a year. Jarret Stopforth, one of the co-founders of Atomo who has a Ph.D. in food science and microbiology, along with more than 20 years of experience in the food industry at companies such as Chobani and Campbell, told Eater that “The coffee landscape is changing and people are looking for more sustainable options. We see ourselves as the Tesla of coffee.” And then there is palnt based cheese. Arivia is a developer of plant-based dairy and dairy-free products made mainly with coconut oil. The company manufactures its more than 500 s.k.u.s at a plant in northern Greece that has a production capacity of 2,500 tons per month. The company’s products are distributed in 50 countries around the world. David Haines, c.e.o. of Upfield., the parent company of Arivia said in a statement that “Consumers are increasingly demanding quality, natural and tasty alternatives to dairy products. Trend or Fad? I’ll let you decide."
