country,search_region_code,search_language,channel_country,default_language,default_audio_language,video_id,url,title,upload_date,published_at,channel,channel_id,view_count,like_count,comment_count,description
France,FR,fr,FR,en-US,en,h4GPxpiVC-U,https://www.youtube.com/watch?v=h4GPxpiVC-U,Organic VEGETARIAN Grocery Haul in France (Whole Foods from Biocoop) || A Bite Better by Eva,2019-10-18,2019-10-18T15:04:30Z,A Bite Better by Eva,UCJ3CwwlnDrWc8silKDAu5aQ,228,14,8,"This is my organic vegetarian grocery haul. I did my weekly food shopping at biocoop this time, an organic grocery store in France. If you ask yourself how to eat organic vegetarian? Here are some healthy whole food ideas for you. Subscribe to my channel: www.youtube.com/c/abitebetterbyeva?sub_confirmation=1 Wanna see more videos on my channel (videos every week)? Go to www.youtube.com/c/abitebetterbyeva #paris #vegetarian #foodhaul My Creamy Pumpkin Pasta Recipe: https://www.youtube.com/watch?v=9X2WxrSigzY Similar bulk food bags: Amazon Germany: https://amzn.to/35labWN “(paid link)” Amazon UK: https://amzn.to/2ISNOyz “(paid link)” Amazon France: https://amzn.to/2IFddvr “(paid link)” ___________________________________________ Hi everyone! My name is Eva and this is my channel ""A Bite Better"". I am a German living in France and I am super passionate about food. I love to cook and to eat and to try new restaurants and cuisines. I am nearly vegetarian (I was for 7 years but had to give it up because of deficiencies and a fructose intolerance) and most of my recipes are vegetarian in fact. I am a firm believer that everyone should eat what their body tells them to eat - I think that one needs to listen to their body. Dieting and restricting yourself all the time are not my philosophy (you need the occasional pizza amirite?). I am also a freelancer and talk about working as a self-employed person, how to manage your time, daily work vlogs etc. But as I am a whole person with many interests, I am likely to also talk about other stuff that's going on in my life on that channel. So if you are interested in any of this, subscribe :) Follow me on social media: Instagram: https://www.instagram.com/abitebetterbyeva/ Pinterest: https://www.pinterest.fr/abitebetterbyeva/ ______________________________________ Music: Title: Gum Bubble Pop Uploaded: 02.23.12 License: Attribution 3.0 Recorded by Sound Explorer"
France,FR,fr,,en,,hzhSR9Q3CNM,https://www.youtube.com/watch?v=hzhSR9Q3CNM,French Grocery Haul (Vegan Edition!),2019-05-10,2019-05-10T17:11:16Z,Nicolette,UCMKHgZ0sesltA9oNlAcCHrQ,1506,75,6,"French Grocery Haul (Vegan Edition) 🥕 Just your average vegan girl braving her first French grocery store... C'est parti! 📸 Instagram 📸 https://www.instagram.com/hellonicolette NEW VIDEO EVERY FRIDAY about… 🇫🇷 French language & culture 📽️ Film 🎨 Creativity ✈️ Travel 📚 Poetry 👠 Style 🌿 Veganism ☀️ And more... ✨ s u b s c r i b e ✨ https://www.bit.ly/2yVzWRS 📚My latest poetry book ""Portrait of Your Ex Assembling Furniture"" 📚 https://www.amazon.com/Portrait-Your-Ex-Assembling-Furniture/dp/0692120734 Website 💻 https://www.nicolettedaskalakis.com 🇫🇷 Great Books about Paris & French Culture, etc. 🇫🇷 https://medium.com/@nicolettedaskalakis/the-ultimate-francophile-reading-list-ce4ea80b0e49 Business inquiries 💌 sayhellonicolette@gmail.com xoxo Nicolette Featured Song: French Waltz by Sam Bikov #FrenchGroceryHaul #Vegan"
France,FR,fr,FR,en,en,9ah6zpiDnT8,https://www.youtube.com/watch?v=9ah6zpiDnT8,Where to shop Vegan in Paris - Best French Organic Supermarkets,2018-04-06,2018-04-06T17:47:05Z,dope yoga,UCWmNFlapeS1rNxcWMSR8ynA,1288,60,11,"If you like this guide to vegan produce in Paris, make sure to check out my channel and subscribe for more health in your daily life...✌️ http://bit.ly/2HzRzWz Hi YouTube family! So, here is a highly requested vlog about where I get my vegan and vegetarian produce in Paris, France. These are my favorite spots, genuinely! I shop at these locations all the time, and I really do believe that these are the best french organic supermarkets around. So, here below is your ultimate guide to where to shop vegan in paris: Biocoop : https://www.biocoop.fr/ Greenweez : https://www.greenweez.com/ Bio c' Bon : http://www.bio-c-bon.eu/fr Naturalia : https://bit.ly/2GDymmx Monoprix : https://bit.ly/2GE13js Voilà! I hope that this helps you foodies and health junkies to find exactly what you are looking for :) In the meantime, also check out these awesome places to do yoga in Paris below: 💓Check out these awesome places to do yoga in Paris 💓 Modo Yoga Paris (Fave) : https://paris.modoyoga.com/ Bikram Yoga Paris : http://www.bikramrivegauche.com/ Ashtanga Yoga Paris: http://www.ashtangayogaparis.fr/home/ Beyoga Paris : http://beyoga.fr/ Om Studio Paris : http://www.ommstudio.fr/ Click below to find out more about me ♥ https://bit.ly/2G9R35h Click below to check out why I'm vegan ♥ https://bit.ly/2GeqvLU Click below to check out an awesome 20 min Yoga Workout ♥ https://bit.ly/2I5QGFa Click below to check out a pilates workout for energy ♥ http://bit.ly/2FZdCVY Click below to check out an easy chair yoga workout ♥ http://bit.ly/2u2G2Nr Click below to check out an easy yoga flow to do on the weekend ♥ http://bit.ly/2IEKvt4 Click below to take a class in order to get deep sleep after work ♥ http://bit.ly/2IAKc2l I wish you light and love. Always, Maria xo Make sure to follow me on socials to keep up with our weekly Wednesday videos ❤ Facebook: https://bit.ly/2IJMXhR Instagram: https://bit.ly/2EvW5an Twitter: https://bit.ly/2DNmfRE Learn More about us: https://pranaatwork.wixsite.com/aboutus ............................................................... ❚ Music provided by: Music: Jazz In Paris - Media Right Productions: https://youtu.be/mNLJMTRvyj8 Author/Track name: LÖHSTANA DAVID - La rentree des classes Release & link for Download: https://www.jamendo.com/track/761654/... ----------------------------------------------------"
France,FR,fr,AT,en,en,zUAvYj4iGEM,https://www.youtube.com/watch?v=zUAvYj4iGEM,Eating Plant-Based Saved Him From Surgery | Paul Chatlin Part 1 | Plant Power Stories,2019-03-28,2019-03-28T16:57:43Z,H.O.P.E. The Project,UCIKvH6BIXMhYyGbC_wGOQEQ,64509,876,59,"https://www.hope-theproject.com In 2013 Paul Chatlin was diagnosed with heart disease. He was told by his doctor that, instead of undergoing surgery, he could cure his condition with a nutrition change. His change to a whole food, plant-based diet was incredibly successful and impacted his life far beyond his health. Watch the inspiring Plant Power Story of Paul Chatlin 🌱 If you want to see more Plant Power Stories, a series from H.O.P.E. The Project that aims to inform and inspire people about the benefits of a plant-based diet and a conscious lifestyle, subscribe to the channel and visit our website: https://www.hope-theproject.com Facebook Page: https://www.facebook.com/HealingOfPlanetEarth Instagram: https://www.instagram.com/h.o.p.e._the_project Medical Disclaimer: Always consult your physician, or other healthcare professional before modifying your diet (or doing any new exercises). Please note that all information presented on this channel is designed for informational purposes only. You should not rely on this information as a substitute for, nor does it replace, professional medical advice, diagnosis, or treatment. If you have any concerns or questions about your health, you should always consult with a physician or other health-care professional. Do not disregard, avoid or delay obtaining medical or health related advice from your health-care professional because of something you may have read or watched on this channel. The producer is not liable for any personal damage caused by following the tips given in the video. The use of any information provided on this channel is solely at your own risk. H.O.P.E. The Project – Healing Of Planet Earth Our vision is to inform people about the endless benefits of a whole food, plant-based diet and to inspire them to adopt a conscious, sustainable and kind lifestyle: Living healthy We opt for a healthier life. Eating a whole-food diet without animal products has the potential to prevent and reverse diseases and obesity, which improves our health and longevity. Conservation of Nature and the Environment We support the preservation of nature and the environment. An organic, plant-based diet conserves natural resources, saves biodiversity and helps to reduce our ecological footprint. Protect animals We protect the lives of countless animals and promote a more peaceful world in which people understand that all living beings are entitled to compassion, dignity and life."
France,FR,fr,GB,en,en,Hm87RL3p3PQ,https://www.youtube.com/watch?v=Hm87RL3p3PQ,WHAT I EAT FOR BREAKFAST: Dr. Esselstyn & Other Plant-Based Docs,2019-03-13,2019-03-13T20:24:38Z,PLANT BASED NEWS,UCJRjK20fHylJyf-HiBtqI2w,1567424,32396,2577,"Find out more about how to lose weight on a plant-based diet - https://plnt.news/weightloss Many thanks to so many people, including the doctors for taking part, Kaden Zipfel and Andrew Gough for editing. As well Mark Stolaroff for videography help: http://www.markstolaroff.com In association with: Plantrician Project: https://plantricianproject.org/ Blue Horizon: https://www.bluehorizon.com/ Switch4Good: https://switch4good.org/ Plant-based Health Professionals UK: https://www.plantbasedhealthprofessio... Physicians Committee for Responsible Medicine: https://www.pcrm.org/ T. Colin Campbell: https://nutritionstudies.org --- ★ CHECK OUT PBN INSIDERS FOR THE BEST STUFF: https://plantbasednews.org/insiders ★ SUPPORT OUR WORK BY MAKING A CONTRIBUTION: https://www.plantbasednews.org/support ★ GET OUR FREE MODEL MEAL INSPIRATION GUIDE: http://bit.ly/pbnmealguide ★GET OUT VEGAN PREGNANCY GUIDE: http://theveganpregnancyguide.com/ ★ GET OUR VEGAN PARENTING GUIDE: http://raisingachildvegan.com/ ★ HELP TRANSLATE OUR VIDEOS: http://bit.ly/translatePBN ★ SIGN UP TO RECEIVE OUR WEEKLY HEADLINES IN YOUR INBOX: http://www.plantbasednews.org/signup ★ GOT A NEWS STORY WE SHOULD KNOW ABOUT? Please email press@plantbasednews.org or leave a message on our hotline UK landline: +44 207 0960 175, US landline: +1 818 963 5411 ★ CHECK OUT OUR WEBSITE: http://www.plantbasednews.org/ SOCIAL MEDIA ★ TWITTER: https://www.twitter.com/plantbasednews ★ FACEBOOK: https://www.facebook.com/plantbasednews ★ YOUTUBE: https://www.youtube.com/plantbasednews ★ INSTAGRAM: https://www.instagram.com/plantbasednews LEARN ABOUT VEGANISM ★ Cowspiracy ➞ https://youtu.be/nV04zyfLyN4 ★ NutritionFacts.Org ➞ https://goo.gl/BdNbiU ★ Veganuary ➞ http://www.veganuary.com/"
France,FR,fr,GB,en,en,kjZUQb19fWg,https://www.youtube.com/watch?v=kjZUQb19fWg,WHAT I EAT IN A DAY: Dr Barnard & Other Plant Based Doctors,2018-03-14,2018-03-14T22:18:14Z,PLANT BASED NEWS,UCJRjK20fHylJyf-HiBtqI2w,1312530,27672,1831,"What Neal Barnard & Other Plant Based Doctors Eat In A Day! --- ⬇ SUPPORT OUR CHANNEL ⬇ ★ HELP TRANSLATE OUR VIDEOS: http://bit.ly/translatePBN ★ SIGN UP TO RECEIVE OUR WEEKLY HEADLINES IN YOUR INBOX: http://www.plantbasednews.org/signup ★ GOT A NEWS STORY WE SHOULD KNOW ABOUT? Please email press@plantbasednews.org or leave a message on our hotline UK landline: +44 207 0960 175, US landline: +1 818 963 5411 ★ CHECK OUT OUR WEBSITE: http://www.plantbasednews.org/ ★ SUPPORT OUR WORK BY MAKING A DONATION: https://actionsprout.io/0B2DF1/initial ★ SUPPORT OUR WORK ON PATREON: https://www.patreon.com/plantbasednews SOCIAL MEDIA ★ TWITTER: https://www.twitter.com/plantbasednews ★ FACEBOOK: https://www.facebook.com/plantbasednews ★ YOUTUBE: https://www.youtube.com/plantbasednews ★ INSTAGRAM: https://www.instagram.com/plantbasednews LEARN ABOUT VEGANISM ★ Cowspiracy ➞ https://youtu.be/nV04zyfLyN4 ★ NutritionFacts.Org ➞ https://goo.gl/BdNbiU ★ Veganuary ➞ http://www.veganuary.com/"
France,FR,fr,US,en,en-US,eGZRSCkly-4,https://www.youtube.com/watch?v=eGZRSCkly-4,"Shopping for a Whole Food, Plant-Based Diet with Tom Campbell, MD",2018-08-08,2018-08-08T15:22:40Z,T. Colin Campbell Center for Nutrition Studies,UCvA4aEygxOtOewPDfGnnHmg,207038,4519,247,"Follow Dr. Thomas Campbell, co-author of The China Study, in his tour of a local supermarket. At the T. Colin Campbell Center for Nutrition Studies, we believe that you have the right to better health and better information. We advocate for evidence-based education and resources. The cornerstone of this education is our Plant-Based Nutrition Certificate program in partnership with renowned online educator, eCornell. We also offer a wide variety of plant-based resources through our website including hundreds of articles, recipes, videos and more. To learn more visit our website: https://nutritionstudies.org/ For information regarding our online Plant-Based Nutrition Certificate vist: http://nutritionstudies.org/courses/p... Connect with us: • Facebook: https://www.facebook.com/nutritionstudies • Twitter: https://twitter.com/TColinCampbellF • Newsletter: http://nutritionstudies.org/newsletter/ • LinkedIn: https://www.linkedin.com/company/5106345 • Pinterest: https://www.pinterest.com/tcccns/ • Instagram: https://www.instagram.com/nutritionstudies/ The Center is a 501(c)(3) non-profit founded by Dr. T. Colin Campbell, co-author of the internationally best-selling book The China Study. Our mission is to promote optimal nutrition through science-based education, advocacy, and research. By empowering individuals and health professionals, we aim to improve personal, public, and environmental health."
France,FR,fr,US,en,en,jxcc2gB5-Kw,https://www.youtube.com/watch?v=jxcc2gB5-Kw,"Neal Barnard, MD | Pantry Staples - Healthy Foods to Stock Up On Now",2020-04-01,2020-04-01T14:49:26Z,Physicians Committee,UCUPQjZzb_Gf_EuXTjAbGBnw,2441592,69356,4032,"Neal Barnard, MD, reviews some healthy foods that are great to stock up on during the COVID-19 pandemic. He also covers some his own personal cooking tips and secrets. Eating plant-based meals—rich in fruits, vegetables, whole grains, and legumes—is a powerful way to boost your immune system and overall health. If you’ve recently stocked up on plant-based pantry staples and freezer favorites and are looking for recipes that incorporate these foods, we have you covered! www.pcrm.org/news/blog/20-plant-based-pantry-staple-meals"
France,FR,fr,GB,en,en,QN7dCN5CCsM,https://www.youtube.com/watch?v=QN7dCN5CCsM,REVEALED: Dramatic Health Reversals Eating Plant-Based,2019-10-09,2019-10-09T22:15:44Z,PLANT BASED NEWS,UCJRjK20fHylJyf-HiBtqI2w,62490,3052,309,"Get your PERSONALISED whole-food plant-based meal guide today: https://www.plantbasednews.org/nfi/meal-plan OVER 100 WHOLE-FOOD PLANT-BASED RECIPES: from the biggest names in the plant based world - get 50% off by using PBN as discount code: https://bit.ly/2O1Iz0N With many thanks to so many people, including the doctors for taking part, Kaden Zipfel and Andrew Gough for editing. As well Mark Stolaroff for videograhpy help: http://www.markstolaroff.com In association with: Plantrician Project: https://plantricianproject.org/ Blue Horizon: https://www.bluehorizon.com/ Switch4Good: https://switch4good.org/ Plant-based Health Professionals UK: https://www.plantbasedhealthprofessio... Physicians Committee for Responsible Medicine: https://www.pcrm.org/ T. Colin Campbell: https://nutritionstudies.org --- ★ CHECK OUT PBN INSIDERS FOR THE BEST STUFF: https://plantbasednews.org/insiders ★ SUPPORT OUR WORK BY MAKING A CONTRIBUTION: https://www.plantbasednews.org/support ★ GET OUR FREE MODEL MEAL INSPIRATION GUIDE: http://bit.ly/pbnmealguide ★ CHECK OUT OUR VEGAN PREGNANCY GUIDE: http://theveganpregnancyguide.com/ ★ CHECK OUT OUR VEGAN PARENTING GUIDE: http://raisingachildvegan.com/ ★ 50% OFF OVER 100 WHOLE-FOOD PLANT-BASED RECIPES: from the biggest names in the plant based world - use discount code PBN at checkout: https://bit.ly/2O1Iz0N ★ HELP TRANSLATE OUR VIDEOS: http://bit.ly/translatePBN ★ SIGN UP TO RECEIVE OUR WEEKLY HEADLINES IN YOUR INBOX: http://www.plantbasednews.org/signup ★ GOT A NEWS STORY WE SHOULD KNOW ABOUT? Please email press@plantbasednews.org or leave a message on our hotline UK landline: +44 207 0960 175, US landline: +1 818 963 5411 WEBSITE ★ http://www.plantbasednews.org/ SOCIAL MEDIA ★ TWITTER: https://www.twitter.com/plantbasednews ★ FACEBOOK: https://www.facebook.com/plantbasednews ★ YOUTUBE: https://www.youtube.com/plantbasednews ★ INSTAGRAM: https://www.instagram.com/plantbasednews LEARN ABOUT VEGANISM ★ Cowspiracy ➞ https://youtu.be/nV04zyfLyN4 ★ NutritionFacts.Org ➞ https://goo.gl/BdNbiU ★ Veganuary ➞ http://www.veganuary.com/"
France,FR,fr,FR,en,en,s4Mm6V5mS2s,https://www.youtube.com/watch?v=s4Mm6V5mS2s,French vegetal chicken,2020-12-03,2020-12-03T20:24:09Z,Healthy_Life by Emma,UCXhACpR10yVIjEBDyaLev7g,495,14,0,"When you think of France, what do you think? A country of gastronomy, it’s true. What are French typical dishes? Oyster, Foie gras, confit canard, kind of duck, beef with red wine, frog’s legs, snails, black boudin, kind of blood based sausage After hearing all of these, you’re wondering, where is plant based dish? Well maybe French fries? so I’m thinking “Can I survive in France if I’m a vegetarian?” Well Of course, you can eat pasta with salt every day or eat a lot of salad. But however luckily, you can also find some fancy funky things in French supermarket Today, I’ll show you what I found in French supermarket"
France,FR,fr,GB,en,en,117lY1IF9ew,https://www.youtube.com/watch?v=117lY1IF9ew,WHAT I EAT FOR DINNER: Dr. Barnard & Other Plant-Based Doctors,2019-05-29,2019-05-29T17:25:39Z,PLANT BASED NEWS,UCJRjK20fHylJyf-HiBtqI2w,630795,16260,936,"🌱Join 300,000+ Healthy Food Lovers LIVE at the 10th Edition of the Food Revolution Summit🌱 Get your FREE ticket today! 👉 https://plnt.news/44lT Get your PERSONALISED whole-food plant-based meal guide today: https://www.plantbasednews.org/nfi/meal-plan OVER 100 WHOLE-FOOD PLANT-BASED RECIPES: from the biggest names in the plant based world - get 50% off by using PBN as discount code: https://bit.ly/2O1Iz0N With many thanks to so many people, including the doctors for taking part, Kaden Zipfel and Andrew Gough for editing. As well Mark Stolaroff for videograhpy help: http://www.markstolaroff.com In association with: Plantrician Project: https://plantricianproject.org/ Blue Horizon: https://www.bluehorizon.com/ Switch4Good: https://switch4good.org/ Plant-based Health Professionals UK: https://www.plantbasedhealthprofessio... Physicians Committee for Responsible Medicine: https://www.pcrm.org/ T. Colin Campbell: https://nutritionstudies.org --- ★ CHECK OUT PBN INSIDERS FOR THE BEST STUFF: https://plantbasednews.org/insiders ★ SUPPORT OUR WORK BY MAKING A CONTRIBUTION: https://www.plantbasednews.org/support ★ GET OUR FREE MODEL MEAL INSPIRATION GUIDE: http://bit.ly/pbnmealguide ★ CHECK OUT OUR VEGAN PREGNANCY GUIDE: http://theveganpregnancyguide.com/ ★ CHECK OUT OUR VEGAN PARENTING GUIDE: http://raisingachildvegan.com/ ★ 50% OFF OVER 100 WHOLE-FOOD PLANT-BASED RECIPES: from the biggest names in the plant based world - use discount code PBN at checkout: https://bit.ly/2O1Iz0N ★ HELP TRANSLATE OUR VIDEOS: http://bit.ly/translatePBN ★ SIGN UP TO RECEIVE OUR WEEKLY HEADLINES IN YOUR INBOX: http://www.plantbasednews.org/signup ★ GOT A NEWS STORY WE SHOULD KNOW ABOUT? Please email press@plantbasednews.org or leave a message on our hotline UK landline: +44 207 0960 175, US landline: +1 818 963 5411 WEBSITE ★ http://www.plantbasednews.org/ SOCIAL MEDIA ★ TWITTER: https://www.twitter.com/plantbasednews ★ FACEBOOK: https://www.facebook.com/plantbasednews ★ YOUTUBE: https://www.youtube.com/plantbasednews ★ INSTAGRAM: https://www.instagram.com/plantbasednews LEARN ABOUT VEGANISM ★ Cowspiracy ➞ https://youtu.be/nV04zyfLyN4 ★ NutritionFacts.Org ➞ https://goo.gl/BdNbiU ★ Veganuary ➞ http://www.veganuary.com/"
France,FR,fr,GB,en,en,HNz0MnfDcjk,https://www.youtube.com/watch?v=HNz0MnfDcjk,How To Be Vegan At Tesco,2019-10-29,2019-10-29T19:02:01Z,Joey Carbstrong,UCG6usHVNuRbexyisxE27nDw,108867,4557,1553,I show you how to be vegan at UK's largest supermarket chain - Tesco. *Want to be Vegan?* Start here: https://veganuary.com/joeycarbstrong Support our work here: https://www.joeycarbstrong.com/supportourwork CHECK OUT MY PODCAST HERE: https://linktr.ee/joey_carbstrong Camera person and co-editor: Max Kieffer Check out his Website: https://maxxkieffer.wixsite.com/main Check My Website: https://www.joeycarbstrong.com CONTACT US VIA EMAIL: https://Joeycarbstrong@gmail.com **PLEASE WATCH DOMINION: https://youtu.be/6jWe6Tx89GU FOLLOW ME ON : Instagram: https://www.instagram.com/joey_carbstrong Facebook: https://web.facebook.com/joeycarbstrong *Join your local activist groups * Anonymous For The Voiceless: https://www.facebook.com/anonymousforthevoiceless/ The save movement: http://thesavemovement.org See where your 'food' comes from- Aus: https://www.watchdominion.com Uk: https://www.landofhopeandglory.org Dairy: https://youtu.be/d5wabeFG9pM HEALTH: https://www.whatthehealthfilm.com https://nutritionfacts.org ENVIRONMENT: https://www.cowspiracy.com
France,FR,fr,,en,,b-W1Cf_WQ64,https://www.youtube.com/watch?v=b-W1Cf_WQ64,Vegan Plant Based Food Shopping With The Fam',2018-05-10,2018-05-10T21:39:48Z,Times Kitchen,UCjg1SHXQRkakPQRzYkSpgxA,38,3,0,"Blog, entertainment, health, and wellness"
France,FR,fr,US,en,en,ZTnbND_MpRA,https://www.youtube.com/watch?v=ZTnbND_MpRA,How Long Does It Take On A Plant-Based Diet To Lower Your Cholesterol? by Caldwell Esselstyn,2019-02-08,2019-02-08T14:00:03Z,The Real Truth About Health,UCp_ShZAUGtFLpYkgcTrayRQ,371898,6579,847,"Cardiovascular disease (CV) is the number one killer in the Western world. But it doesn’t need to be. The truth is that more than 75 percent of cases of heart attacks, strokes, and other cardiovascular disease events are preventable. In The Whole Heart Solution, America’s Holistic Heart Doc Joel K. Kahn, MD, reveals more than 75 simple, low-cost things you can do right away—from drinking your veggies to opening your windows to walking barefoot—to make yourself heart attack proof. Dr. Caldwell Esselstyn illustrates that a plant-based, oil-free diet can not only prevent the progression of heart disease but can also reverse its effects. Dr. Esselstyn is an internationally known surgeon, researcher and former clinician at the Cleveland Clinic and a featured expert in the acclaimed documentary Forks Over Knives. Prevent and Reverse Heart Disease has helped thousands across the country, and is the book behind Bill Clinton’s life-changing vegan diet. The proof lies in the incredible outcomes for patients who have followed Dr. Esselstyn's program, including a number of patients in his original study who had been told by their cardiologists that they had less than a year to live. Within months of starting the program, all Dr. Esselstyn’s patients began to improve dramatically, and twenty years later, they remain free of symptoms. Connect with The Real Truth About Health http://www.therealtruthabouthealth.com/ https://www.facebook.com/The-Real-Truth-About-Health-467500836655781/ https://www.instagram.com/therealtruthabouthealth/ https://twitter.com/RTAHealth Passionate believers in whole food plant based diets, no chemicals, minimal pharmaceutical drugs, no GMO's. Fighting to stop climate change and extinction."
France,FR,fr,GB,en,en,zvhYZciJ5wk,https://www.youtube.com/watch?v=zvhYZciJ5wk,How To Be Vegan At Sainsbury's,2019-09-28,2019-09-28T17:45:11Z,Joey Carbstrong,UCG6usHVNuRbexyisxE27nDw,85178,4052,1283,"In this series I show you how to be vegan at different establishments. First in the series, Sainsbury’s supermarket UK. *Donate & Support* our work: https://donorbox.org/joeycarbstrong *Want to be Vegan?* Start here: https://veganuary.com/joeycarbstrong *Watch Pignorant* Free to watch in 129 Countries: https://pignorantfilm.com/watch *Follow our work* on social media: • https://www.instagram.com/joey_carbstrong/ • https://www.facebook.com/joeycarbstrong • https://www.tiktok.com/@joey_carbstrong • https://twitter.com/joeycarbstrong *Media Enquiries* please email our team at joeycarbstrong@gmail.com"
France,FR,fr,US,en,en,BhgaJI3sOMA,https://www.youtube.com/watch?v=BhgaJI3sOMA,Is France's groundbreaking food-waste law working?,2019-08-31,2019-08-31T20:10:13Z,PBS NewsHour,UC6ZFN9Tx6xh-skXCuRHCDpQ,212959,6356,,"A third of the world's food goes to waste, but France is attempting to do something about it. Since 2016, large grocery stores in the country have been banned from throwing away unsold food that could be given away. NewsHour Weekend Special Correspondent Christopher Livesay reports from Paris as part of our ""Future of Food"" series, which is supported in partnership with the Pulitzer Center. Stream your PBS favorites with the PBS app: https://to.pbs.org/2Jb8twG Find more from PBS NewsHour at https://www.pbs.org/newshour Subscribe to our YouTube channel: https://bit.ly/2HfsCD6 Follow us: Facebook: http://www.pbs.org/newshour Twitter: http://www.twitter.com/newshour Instagram: http://www.instagram.com/newshour Snapchat: @pbsnews Subscribe: PBS NewsHour podcasts: https://www.pbs.org/newshour/podcasts Newsletters: https://www.pbs.org/newshour/subscribe"
