country,search_region_code,search_language,channel_country,default_language,default_audio_language,video_id,url,title,upload_date,published_at,channel,channel_id,view_count,like_count,comment_count,description
Netherlands,NL,nl,GB,en,,t8KI7IrbSHo,https://www.youtube.com/watch?v=t8KI7IrbSHo,BBC LOOK NORTH - Are Vegan Diets Healthy?,2019-02-10,2019-02-10T18:11:47Z,Nichola Ludlam-Raine,UCj9-e8neMi4lZ1RebhpftSg,1575,21,4,"This week I featured (briefly) on the BBC ONE news chatting about veganism (I appear in the latter half of the documentary) .. here is more info.. Individuals may choose to follow a plant-based diet for a number of reasons including animal welfare, personal health reasons and environmental concerns. A well planned plant-based diet can be both nutritious and healthy, and meat-free diets have indeed been associated with lower risks of heart disease, high blood pressure, type 2 diabetes, obesity and various cancers. It’s worth noting though that most of the research is only observational and many vegetarians may be more health conscious; thus being more likely to exercise and less likely to smoke/drink alcohol to excess .. having said this though deep fried chips and sugar are both vegetarian/vegan so it can be an unhealthy diet too! Eating more plant based foods is always a good thing; they tend to be higher in fibre (more fruits, vegetables and wholegrains) as well as healthy unsaturated fats from nuts, seeds, olive oil, rapeseed oil and avocados. If you’re vegan though you need to have a well planned and varied diet to make sure you’re getting enough of certain nutrients such as calcium, iodine, iron and B12; for which many vegans actually take a supplement: Protein (muscle growth and repair) = Eat a range of different proteins to ensure you get all of the essential amino acids (which are the building blocks of protein) that the body cannot make e.g. tofu, lentils, beans, nuts, seeds, soya and whole grains. Omega 3 (heart health) = flaxseed oil, tofu & walnuts/pumpkin seeds + Algae supplement (DHA) as the body doesn’t convert ALA (plant based omega 3) to DHA and EPA very well. Calcium (bones) = fortified milk alternatives, figs, sesame seeds, calcium-set tofu and almonds (+ ?supplement for post menopausal women and coeliac disease). Iodine (thyroid) = consider a daily supplement (levels vary in seaweed). Iron (transports oxygen around the body) = lentils, soybeans, tofu, dried fruit, dark green veg, wholemeal bread, fortified cereals.. have with a source of vitamin C to enhance absorption (and keep tea/coffee to 30 mins either side as they can inhibit iron absorption). B12 (energy) = supplement, fortified milk alternatives/cereals, nutritional yeast and marmite. Selenium (immune system) = Brazil Nuts. Vitamin D (absorb calcium) = oily fish/eggs.. 10 mcg supplement a day (especially in the UK autumn & winter months). Eating a more plant-based diet is not only good for the environment but it can have a positive effect on your health too. There is however no need to cut out foods such as meat, poultry and dairy altogether (for health reasons), especially if you enjoy it! A vegan diet needs to be well planned (& more often than not supplemented as above), otherwise it may be deficient in nutrients."
Netherlands,NL,nl,US,en,,O9bxh_DxeXA,https://www.youtube.com/watch?v=O9bxh_DxeXA,"Sustainable, Low Waste Grocery Shopping (realistic)",2020-11-04,2020-11-04T20:00:03Z,Adrianne,UCpx-VIY6V6m7kGevyVZmBig,124,6,1,"A realistic vegan grocery shopping haul, trying to be more zero waste and avoid plastic as much as possible. I’d like to do more of this by trying bulk buying since that’s a great sustainable option. But for now I’m going with practical options at my local co-op and grocery store like not choosing plastic packaged produce. Hope you liked this video // thanks for watching!"
Netherlands,NL,nl,NL,en,en,dcWzr1X5Obs,https://www.youtube.com/watch?v=dcWzr1X5Obs,Vegan Meal Prep + Searching for Apartment in the Netherlands | Vlog,2019-01-27,2019-01-27T19:00:15Z,Rania Kelesidou,UCYlY1DW6D_iHOxN3cOnP-6A,933,39,25,Vegan plant based meal prep with easy recipes and searching for an apartment in The Hague! Trying beers made out of bread and potatoes and two winter outfits ♥ INSTAGRAM : https://www.instagram.com/raniakelesidou/ BLOG : http://www.nothinglikefashion.com/ CONTACT : rania@nothinglikefashion.com The L'Occitane box I got is sold out but here are some other boxes http://bit.ly/2DEfjcV OUTFIT 1 Asos coat (old) &Otherstories sweater http://bit.ly/2UmmsE9 Levis jeans Iro Paris boots https://bit.ly/2B3kTDO Smaak Amsterdam bag OUTFIT 2 River Island coat (men) &Otherstories blazer http://bit.ly/2DDuGSW Na-kd top Weekday Seattle jeans http://bit.ly/2UiEO91 ByFar Becca boots http://bit.ly/2DAgKZC Smaak Amsterdam bag Thanks for watching!
Netherlands,NL,nl,GB,en,,MxunKETCtKM,https://www.youtube.com/watch?v=MxunKETCtKM,We visit Amsterdam Vegan Junk Food Bar,2019-11-15,2019-11-15T17:42:17Z,Iris Cohen,UCgKejuEV_DbCwxZjmOAdZSw,159,4,1,"This was filmed in June 2019 when Nza was 7 months. I thought to still edit and post it as we loved the food at Vegan Junk Food Bar. Although very naughty and not something we eat everyday! I am Dutch so we were visiting Amsterdam, I would definitely recommend visiting it as we loved it, even our non vegan friends did too. We had the: No Tuna & Zalmon Sashimi - made from seaweed if I remember rightly, and gluten free! Deep fried Shrimp - Tasty but have had similar things before, I don't think it's even on their menu anymore... Kapsalon - chips covered in kebab style meat with salad, all layered into delicious greasy meal. Chicken style burger - Think it's the Notorious burger, I'm not super into burgers but it looked and tasted nice. Let us know if you've been and what was your favourite dish :)"
Netherlands,NL,nl,US,en,,iX40Ut6W06A,https://www.youtube.com/watch?v=iX40Ut6W06A,Best Vegan Eats in Amsterdam | Veggiekins,2020-12-01,2020-12-01T22:52:23Z,Veggiekins,UCZGq9Pt57tlNPdBR5pgIxNg,10817,767,48,"The best vegan eats in Amsterdam! Here are my top 10 picks for vegan and vegan-friendly spots that deserve the hype. C L I C K F O R L I N K S find me online ⊹ my new e-book → https://veggiekinsblog.com/shop-products ⊹ http://instagram.com/veggiekins ⊹ http://veggiekinsblog.com ⊹ https://www.pinterest.com/veggiekins/ ⊹ remy@veggiekinsblog.com in this video ⊹ amsterdam guide → https://veggiekinsblog.com/2019/03/01/amsterdam-guide/ ⊹ main camera body → https://amzn.to/2UxpXLe ⊹ camera lens → https://amzn.to/2S4kz0q ⊹ vlog camera → https://amzn.to/2H3fE9R ⊹ tripod → https://amzn.to/383phRI ⊹ drone → https://amzn.to/2vzOB3f discounts ⊹ seed sybiotic - code VEGGIEKINS for 15% off → https://shop.seed.com/products/daily-synbiotic ⊹ the matcha i use → https://ippodotea.com/o?id=53fae8 ⊹ sprout living vegan protein - VEGGIEKINS for 20% off → https://www.sproutliving.com/go/veggiekins ⊹ almond cow milk maker - code VEGGIEKINS → https://almondcow.co/products/almond-cow-milk-machine ⊹ gomacro bars - code REMY25 for 25% off → http://gomacro.com/ ⊹ rothy's sneakers $20 off my eco everyday sneakers → https://share.rothys.com/x/TNW4xs all music used in this video ⊹ http://bit.ly/2ObL5mS Best Vegan Eats in Amsterdam | Veggiekins https://youtu.be/iX40Ut6W06A tags ⊹ vegan amsterdam, best vegan restaurants, best vegan asterdam, amsterdam food, amsterdam vegan, vegan, gluten free, vegan food, healthy living, wellness, plant based, amsterdam, veggiekins, nyc #vegan #food #amsterdam"
Netherlands,NL,nl,,en,,gGzHuAxHPAY,https://www.youtube.com/watch?v=gGzHuAxHPAY,Keto Grocery Haul | Shopping On A Keto Diet Netherlands | Denisa's Keto Kitchen,2020-04-28,2020-04-28T13:55:52Z,Denisa G.,UCwgeQhVNLsP4pjFhXdVYFGA,257,12,6,"This is my keto grocery haul for this week. It's so simple to shop on a ketogenic diet in the Netherlands. Don't forget to subscribe to my channel. Leave a comment below if you have questions, any suggestions or anything to share with the keto community. Check out my blog here: https://denisagalaskova.wixsite.com/denisasketokitchen Follow me on INSTAGRAM: @denisasketokitchen FOR BUSINESS INQUIRIES ONLY: denisasketokitchen@outlook.com"
Netherlands,NL,nl,US,en,,7NBJB99GG7E,https://www.youtube.com/watch?v=7NBJB99GG7E,Beyond Meat Goes Global | The Netherlands,2019-04-26,2019-04-26T16:49:22Z,Go Beyond,UCvkk7DfC3jZd6Rud4E3K3HQ,5031,76,8,The Beyond Burger is now available in the meat case at 700+ Albert Heijn locations throughout the Netherlands! Learn more here: https://www.beyondmeat.com/whats-new/the-beyond-burger-has-landed-in-dutch-supermarkets/
Netherlands,NL,nl,US,en,en,6ChREr54IwE,https://www.youtube.com/watch?v=6ChREr54IwE,"Large Vegan Grocery Haul~Whole Foods, Costco, Trader Joes (Vlog April 15, 2019)",2019-04-16,2019-04-16T04:00:26Z,Our Plant Based Bunch,UC4WXy0QKgw81bETYml9JLjA,527,37,,"Leave a comment on our community page if you'd like: https://www.youtube.com/channel/UC4WXy0QKgw81bETYml9JLjA/community You may also join us on: Facebook: https://www.facebook.com/ourplantbasedbunch Instagram: https://www.instagram.com/ourplantbasedbunch Ellen G. White's writings: https://egwwritings.org/ Do you want to participate in our vlogs? Send us a short video clip of you, and/or or family or friends saying ""Live well and be strong, bye"" in your own special way and we'll attach it to our vlog. Include your name and where you're from if you'd like. You may send it to my email at staceyb88@gmail.com. If you'd like a free copy of ""Steps To Christ"" send your mailing address to my same email address. Check us out on Periscope @ourplantbasedbunched daily. Redwood Trail by Audionautix is licensed under a Creative Commons Attribution license (https://creativecommons.org/licenses/...) Artist: http://audionautix.com/ #groceryhaul #whatvegankidseat #veganfood #plantbased #whatieatinaday #wholefoodsmarket #traderjoes #Costco"
Netherlands,NL,nl,SK,en,en,tVCjD2VCnZA,https://www.youtube.com/watch?v=tVCjD2VCnZA,Meal Prep to avoid Food Waste / LOWEMBER / vegan low waste less waste zero waste,2018-11-04,2018-11-04T17:00:10Z,Dominika Donchinka,UCFLl-ROt9Rtgq1YQYtxpJOg,19,0,0,wanna know more: https://dominikadonchinka.blogspot.com/2018/11/meal-prep-4-lowember.html
Netherlands,NL,nl,NL,en,,sOq0DnXX2WI,https://www.youtube.com/watch?v=sOq0DnXX2WI,How To Make Plant-based Cheese And Go To Market Within A Year. The Founders' Story Of Willicroft,2020-12-16,2020-12-16T10:49:53Z,Unknown Group,UC7Ft0NWZmZmGGceYKr1nBPA,103,3,1,"Brad Vanstone is the Founder of Willicroft, a sustainable plant-based cheese solution that aims to tackle global warming by providing a tasty alternative to dairy cheese. In two years, the finalist of Get in the Ring the Netherlands – Impact managed to put a whole range in the major supermarkets. But is it scalable? Brad joins Jurgen at the studio to touch upon Willicroft’s to-market strategy and how they took the best elements of existing solutions to capitalize on the gap in the plant-based cheese market. Full episode available now everywhere you get your podcasts: unknowngroup.com/podcast About Unknown Stories: We take you backstage in the Unknown Group venture engine by inviting the founders behind the ventures that seek adventure and opportunity in business. By extracting valuable and actionable insights, Unknown Stories deconstructs the highs, the lows and the in-betweens of navigating the journey of venturing. About Unknown Group: Unknown is a global innovation agency that backs promising innovations with talent, access to market and funding. The goal is to scale these innovations to 100mln in valuation in order to make impact on our 21st century challenges. Through Unknown Group, Get in the Ring was created as a global startup competition to find and support promising startups from all corners of the world to test and scale their solutions with governments and industry leaders. For more information, visit http://www.unknowngroup.com"
Netherlands,NL,nl,GB,en,en-GB,oz5pcHGjJUk,https://www.youtube.com/watch?v=oz5pcHGjJUk,VEGAN 2020 | Holland & Barrett Food & Supplements | Come Shopping With Us!,2020-03-08,2020-03-08T16:44:01Z,Those Vegan Guys,UC1NJu6ecBwCYWIOJbARYnIA,9415,379,96,"Our MERCH: https://those-vegan-guys.teemill.com/collection/new We had to go to Holland & Barrett today to get our B12, so, whilst we were there we thought we may as well vlog it as a few of you had asked. So here you go, H&B foods and supplements. Availability very much depends on the size of your own store. Every day presents a chance to start again. TVG & TVQ Art by Charlotte @peweebaggins on Instagram & Twitter Patreon Page: https://www.patreon.com/thoseveganguys Our Website: http://thoseveganguys.com/ Facebook: https://www.facebook.com/VeganGuyz/ Twitter: https://twitter.com/VeganGuys Insta: https://www.instagram.com/thoseveganguys Music Credits: http://bensound.com http://purple-planet.com Our Vegan Amazon Storefront https://www.amazon.co.uk/shop/veganguyz Vloggers Paradise Equipment List https://www.amazon.co.uk/shop/veganguyz?listId=19BK74DRL14J2 TUBEBUDDY https://www.tubebuddy.com/TVG Our Affiliate Links. (we only affiliate with products we use, love or highy, recommend) Braggs Apple Cider Vinegar: https://amzn.to/2Wg6YGm TOFUTURE Tofu Press (amazing): https://amzn.to/2VDSZWC Nutritional Yeast (NOOCH): https://amzn.to/2LVpy2u Dirty Vegan Cook Book: https://amzn.to/2HucD3d BOSH Cook Book: https://amzn.to/2LZmzGq __ Down to earth veganism with Paul & Jason. We're a married couple from Manchester who love to share our passion for vegan living with recipes, reviews, chats, fitness, fun and the odd appearance of our cat Isis. Although we started this channel in 2015 it wasn't really until late 2017 that we started to work hard at it, due to things outside of our control. Now, in 2019, this channel has our full attention and we have splashed out on the right equipment and software to enable us to make great content. We'd love a like and a subscribe, of course. Thanks so much for taking a look. Paul & Jason. xx ___ Birmingham to Brunei | Husbands Speak OUT Against Homophobia http://bit.ly/2HWIlVQ A GAY MAN & HIS DAD | It Gets Better | A Tribute http://bit.ly/2W2HMnm Are You Ready To Be Vegan? https://www.youtube.com/watch?v=myciJGinZxY Make It Possible - TV AD by Animals Australia https://www.youtube.com/watch?v=cQ-IUWOOUfY 2 Queens | 5 Outfits | 2 Delicious Vegan Focaccia | The Vegan Queens are back! https://www.youtube.com/watch?v=dBwRnDImVs8 ""Down to earth Veganism"" ""Stuffin' us faces"" ""BE EXCELLENT TO EACH OTHER"" Vegan recipes. Vegan food. Vegan meal planning. What I eat in a day. What we eat in a day. Plant based meals. FRIENDS: Braingirl https://www.youtube.com/channel/UCBgdg6zMB00tPWgNo-sjppg The Library is Open https://www.youtube.com/channel/UCE1zUekS7MsvStLGVf1g0fw Pan Vegan https://www.youtube.com/channel/UCPdLALWWBqBT_yY7bLEKz1A LDN Vegans https://www.youtube.com/channel/UCaa8kNxas9mO-PJhFGrV6VA Hench Herbivore https://www.youtube.com/channel/UC2ZWX3GJfAIeRFWN91t09ww Simnett Nutrition https://www.youtube.com/channel/UCpyhJZhJQWKDdJCR07jPY-Q GojiMan https://www.youtube.com/channel/UC8zKmTVcs5s3IIR2DVlxfzA No Egg Craig https://www.youtube.com/user/BattlingCIDP The Vegan Zombie https://www.youtube.com/user/ZombieGate Cheap Lazy Vegan https://www.youtube.com/channel/UCEjkioV3LO_OIUaSWRxFZ3A The Viet Vegan https://www.youtube.com/channel/UCPOgooHtYIfgotZsHA7_wZw Rachel Finazzo https://www.youtube.com/channel/UCFW-qVCbtaCVM5WarxFWexg Our Story: https://www.youtube.com/watch?v=udlwX79pQrQ TVG Protein Shake: https://youtu.be/25bHJ-hAVi0 Nick Nimmin: https://www.youtube.com/user/NickNimmin Brian G Johnson: https://www.youtube.com/channel/UCZbvKhLl-I7UomMugaO24fw FILMORA: https://www.youtube.com/channel/UCY_LMaDAoa6hwHKBE4Dx56w Daniel Batal: https://www.youtube.com/channel/UCjbNv0mUvHN5k3rqPOxoVWg #Vegan #ThoseVeganGuys #VeganRecipes vegan,plant based,vegan food,vegan meals,vegan meal planning,plant based meals,plant based meal planning,those vegan guys,down to earth veganism,vegan recipes,vegan shopping,vegan hauls,Gay couple,LGBTQ,holland and barrett,vegan food shop,vegan youtuber,holland & barrett vegan haul,holland and barrett vegan haul,vegan supplements recommendations,vegan b12 supplement,vegan protein powder,nuts & seeds,vegan holland & barrett,holland and barrett vegan"
Netherlands,NL,nl,US,en,en,pmCS0GM43-0,https://www.youtube.com/watch?v=pmCS0GM43-0,"Fun Vegan, GF and Paleo Snacks found in Fort Collins, Colorado like Miyoko's kitchen!",2018-04-05,2018-04-05T23:05:22Z,Style to Set,UCFMi3mGDBDqH0kMimT_8huQ,181,5,0,"I ADORE grocery stores, especially stores that have lots of options for those of us who are on specific eating plans. Whether you can't have gluten, or cow's milk dairy, or meat- I GET IT, and for a girl from Alabama, Colorado blew my mind for all of the fabulous offerings for alternative eating! On this video I highlight some of the most awesome stores, products and creative food to grace my path while I was in Fort Collins food- styling for a breakfast chain. From Wild and Free kombucha, to vegan butter and the best vegan chocolate chip cookie I've ever had, some of these products may even be found near you! And just to be clear, NOT EVERYTHING on this list fits paleo, gluten-free and vegan eating, so just check the labels to make sure it works for you! In case they aren't at your local grocery store, here is a list of all of the stores/purveyors I mentioned! Whole Foods Market in Fort Collins: https://www.wholefoodsmarket.com/stores/fortcollins Outrageous gluten-free lemon poppyseed bread: https://www.outrageousbaking.com/ Goat cheese gouda***: https://www.instacart.com/whole-foods/products/16804647-dutch-cheese-masters-goat-spring-koe-gouda Vosges mini exotic chocolate bar library***: https://www.vosgeschocolate.com/product/mini-exotic-candy-bar-library/ Jilz crackers (LOVE!!!): https://thrivemarket.com/brand/jilz-gluten-free?utm_source=bing&utm_medium=cpc&utm_campaign=newengen+-+Brand+and+Product+-+Food+-+l_DE1+1437&utm_content=1167681503649964&utm_term=72980124708056-kwd-72980268037078:loc-4125&device=c&ccode=FIRST3&ccode_force=1&msclkid=47c4d24af905164cfd0a888c5a0f5751 All natural Wrawps: https://wrawp.com/spirulina-raw-wrap/ CoYo coconut yogurt: http://coyo.com/us/product/yogurt-us/ Natural Grocers: https://www.naturalgrocers.com/store-location/fort-collins/ Miyoko's creamery mozzarella and butter: https://miyokoskitchen.com/collections/vegan-mozz Miss Jones Baking Co: https://www.missjones.co/ Revolution Market Fort Collins: https://revolutionmarkets.com/ Wylder Coffee Co: https://wyldercoffeeco.com/ Kim and Jake's gluten-free cookies***: https://kimandjakes.com/ Wild and free kombucha: https://www.facebook.com/wildandfreefermentedtea/ ***Not everything on this list meets all the criteria of vegan, Paleo, and gluten-free, so make sure and check the labels to see if it will work for you!"
Netherlands,NL,nl,,en,,TzQECuBCrcY,https://www.youtube.com/watch?v=TzQECuBCrcY,VEGAN FOOD AMSTERDAM AIRPORT,2019-12-08,2019-12-08T01:39:21Z,Super Singh’s,UCWbgKoVQuDYjj02LU1ZInGg,265,0,0,Vegan Food at AMSTERDAM Arport
Netherlands,NL,nl,NL,en,,_y2Yh-VPJ4M,https://www.youtube.com/watch?v=_y2Yh-VPJ4M,EXBERRY history plant-based colors for food and drinks Maek creative team,2020-10-22,2020-10-22T12:46:29Z,Maek creative team,UCMq7BquNjNPqp4_BysQYSiQ,86,0,0,"Maek creative team – Creativity with impact. Since 2001, we’ve been making brands stand out with bold designs, storytelling animations, and booths you can’t walk past. Based in Sint Anthonis & Uden The Netherlands, we work with clients worldwide, always powered by teamwork and big ideas. Let’s create something unforgettable. +31 485 383710 maek.nl linkedin.com/company/maekcreativeteam/ #maekdesign #graphicdesign #creative #video"
Netherlands,NL,nl,DE,en,,OHT8MZP_GV4,https://www.youtube.com/watch?v=OHT8MZP_GV4,What I Ate as a Vegan in Amsterdam!,2018-03-28,2018-03-28T21:05:54Z,Mina Rome,UCBy9QPDqagPyrdV_01-c9Xw,35609,1915,75,"Last week I went to Amsterdam for Vidcon Europe. While I was there I got to check out lots of awesome vegan places - thanks to your recommendations! There’s vegan burgers, cupcakes, brownies, sandwiches and many more yummy foods to see in this video :) Vegan Food Places in Prague: https://www.youtube.com/watch?v=iBQJrSKqppo&t=322s What I Eat in a Week as a Vegan: https://goo.gl/eMYiZC Lazy Vegan Dessert Ideas: https://goo.gl/MTfdEx 10 Minute Vegan Snack Ideas: https://goo.gl/CTCH9F Cafés/Restaurants/Places mentioned: Vegan Junk Food Bar Van Ness Cupcakes Vegabond Café The Dutch Weed Burger Joint Grocery Store - Albert Heijn Svaha Yoga → this is not a full What I Eat in a Week - just the food highlights from my trip :) CONNECT WITH ME: Instagram: mina_rome Email: minarome.yt@gmail.com THANK YOU for watching this video! Music used: https://soundcloud.com/aimless-beats/never-thought https://soundcloud.com/aimless-beats/november https://soundcloud.com/culpeo/look-up https://soundcloud.com/primabeats/jin-1 https://soundcloud.com/limes-3/alright https://soundcloud.com/gia-l-u/will-you-marry-me Much love Mina *not sponsored"
Netherlands,NL,nl,,en,,KujspMW8WXg,https://www.youtube.com/watch?v=KujspMW8WXg,"Trusting your process, gaining 10lbs, No Longer Plant Based!",2019-06-21,2019-06-21T01:22:04Z,Justtaylorthings,UCtAxPKfW9UChF4i_dMUc48w,35471,2043,385,♡ Ana Luisa NY Jewelry - Check their designs here: http://www.analuisa.com/CyberSis ♡ Use discount code: CyberSis10 to get $10 off ♡ I know you will love them Hello lovelies ive missed you all so much ! Hope you guys enjoyed todays video !! ♡ MY SOCIAL MEDIA @JUSTTAYLORTHINGS_ @CHILESFIT Chiles couture waist snatcher www.chilescouture.com
Netherlands,NL,nl,DE,en,en,B-E6oOGeq0A,https://www.youtube.com/watch?v=B-E6oOGeq0A,Billion Dollar Flower Market | ENDEVR Documentary,2020-12-04,2020-12-04T14:00:02Z,ENDEVR,UCuw0GgMlZlAsWvpI8PgCN8g,1495024,11996,454,"Billion Dollar Flower Market | Business Documentary from 2016 The Flower industry is a billionaire global business. The Netherlands is the world’s most advanced flower producer and controls the market. Nearly all of the flowers that the United Kingdom buy are from abroad and it’s the Dutch. But there’s a chink in the Dutch armour and the Brits are fighting back. This documentary follows florist Geoff, who learned Dutch and buys directly at the flower auctions in Holland, passing on savings to his loyal customers back home. We meet a new generation of British florists including 21-year-old Jay, whose new business is booming because of a dedication to using quirky homegrown British buds for her luscious event displays. Florists like Jay are even helping keep the world famous flower market Covent Garden in cheeky rude health. And it’s not only them. Our high street supermarket giants have realized growing business opportunities, spotting how to encourage shoppers to fill their trollies with homegrown Sweet Williams sourced from local super grower Mark. And we reveal just how florist Rob did it to create his huge flower display outside London’s National Portrait Gallery. Our own humble British flowers and enterprising British florists are on a roll, the Dutch aren’t having it all their own way. ▬▬▬▬▬▬▬▬▬ Subscribe to ENDEVR for free: https://bit.ly/3e9YRRG Join the club and become a Patron: https://www.patreon.com/freedocumentary Facebook: https://bit.ly/2QfRxbG Instagram: https://www.instagram.com/endevrdocs/ ▬▬▬▬▬▬▬▬▬ #FreeDocumentary #ENDEVR #BillionDollarFlowerMarket ▬▬▬▬▬▬▬▬▬ ENDEVR explains the world we live in through high-quality documentaries, special investigations, explainer videos and animations. We cover topics related to business, economics, geopolitics, social issues and everything in between that we think interesting."
Netherlands,NL,nl,,en,,UwEw4HTuSdQ,https://www.youtube.com/watch?v=UwEw4HTuSdQ,Grocery Trip on Contest Prep with Wesley Vissers - Classic Physique Pro,2019-02-19,2019-02-19T18:03:37Z,Wesley Vissers,UCWl4r8lWQwk1BRQhNugBYzQ,34424,1180,145,GYM CLOTHING AND OLD-SCHOOL SUPPLEMENTS https://vintagegenetics.com/ Classic & Personalized Workout and Nutrition Plans? Contact me: Wesleyvissers@hotmail.com (Also for plant-based diets!) Instagram @WesleyVissers https://www.instagram.com/wesleyvissers/ @KaneVissers https://www.instagram.com/kanevissers/ Facebook https://www.facebook.com/Wesley-Vissers-Junior-Athlete-763852680293064/?ref=bookmarks
Netherlands,NL,nl,,en,,xhVmXgxwqrw,https://www.youtube.com/watch?v=xhVmXgxwqrw,3 Vegan Friendly Hotspots in Utrecht,2019-03-22,2019-03-22T07:00:08Z,her yellow turtle,UCBm6Ui7h6RAktfmuzNpARgg,517,14,3,"Hi, here are three vegan friendly restaurants in my city & I'm very grateful that they exist. I'm grateful for the fact that being a vegan nowadays is so convenient. I'm grateful for food in general. I'm grateful for people who make me food. Wow, I didn't expect this to become a gratitude journal, but it's always nice to take a moment to think about things you're grateful for, so all is good. Here are the three places I mentioned: 1. Koffie Leute: https://www.koffieleute.nl/ 2. Waku Waku: https://wakuwaku.nl/ 3. De Werfkring: http://www.dewerfkring.com/ Oh, and of course, here's a wonderful video of Lucy Rose's tour experience in Latin America. It's such an amazing story and it's easily one of my favourite video's on the internet. Check it out here: https://www.youtube.com/watch?v=Q42ddNiweyY Alright, I hope you have a good rest of your day/evening/night. Talk to you soon. With love, Michelle"
