country,search_region_code,search_language,channel_country,default_language,default_audio_language,video_id,url,title,upload_date,published_at,channel,channel_id,view_count,like_count,comment_count,description
France,FR,fr,,en,en,9YdXMP0Z8lQ,https://www.youtube.com/watch?v=9YdXMP0Z8lQ,French MPs ban 'misleading' vegetarian food products,2018-04-20,2018-04-20T09:57:15Z,"Sa Colo Co., LTD",UCv_Dz-hGXc1bz0gNut77LqA,22,0,0,"Vegetarian sausages, vegan bacon, soya steaks and other vegetable-based meat substitutes will be no more in France after lawmakers agreed on Thursday to ban them for misleading consumers. Under the measure proposed by MP and farmer Jean-Baptiste Moreau, vegetarian food producers will no longer have the right to use ""steak"", ""fillet"", ""bacon"", ""sausage"" or any other meat reated term to describe products that are not partly or wholly composed of meat. The regulation, which was tabled in the form of an amendment to an agriculture bill, will also apply to vegetarian or vegan products marketed as dairy alternatives. Refusals to comply with the regulation will lead to fines of up to 300,000 euros ($370,000). Mr Moreau has argued that current labelling cause confusion among consumers, who may believe they are eating pure, high-quality meat instead of a meat-and-soy combination, or a wholly vegetarian product. The best vegetarian recipes The vote in favour of a ban on meaty marketing comes less than a year after the European Court of Justice ruled that dairy-related terms, such as “milk”, “cream”, “chantilly” and “cheese”, are only allowed to be used on products made with real animal milk. The debate is reminiscent of an online argument which went viral in Britain in 2016 after Sainsbury's - much to the dismay of one Twitter user - launched their own range of vegan cheeses."
France,FR,fr,US,en,,00Hw3qv-7so,https://www.youtube.com/watch?v=00Hw3qv-7so,"Vegan, Vegetarian, and Flexitarian Consumers",2020-10-01,2020-10-01T20:11:10Z,Packaged Facts,UC_xqlS6615oBL1V9xdjMlsA,410,2,1,"Learn more about this dynamic market: https://hubs.ly/H0xjsYW0 More consumers than ever before want to eat more plant-based foods because: they think products that come from plants are healthier ongoing publication of news stories about animal abuse and poor conditions at industrial farms is causing people to think more about where their food comes from and what impact it has on the world concerns about climate change are leading consumers to question whether meat is part of a sustainable diet While some consumers completely cut meat, dairy, or eggs from their lifestyle by adopting a vegan or vegetarian eating philosophy, many others are not willing to be so strict. Instead, a large and growing group of consumers identify as flexitarian, meaning they are reducing but not eliminating meat or other animal product consumption in favor of plant-based foods. As more consumers are turning to plant-forward and plant-centric meals, the food market is changing rapidly to accommodate these tastes. With a focus on “what’s next” and current consumer trends, Vegan, Vegetarian, and Flexitarian Consumers is packed with insights about consumer trends, behavior, and motivations to help food and beverage producers, retailers, packaging companies, foodservice providers, employers, and investors gauge consumer perspectives and find areas for growth in a competitive food and beverage market. Vegan, Vegetarian, and Flexitarian Consumers delivers actionable predictions and recommendations designed to guide food and beverage producers, retailers, and investors in making business decisions by providing data and insights about what diets consumers follow and what they expect from food and grocery shopping."
France,FR,fr,US,en,en,GD_-wKxSh_U,https://www.youtube.com/watch?v=GD_-wKxSh_U,The Plant-Based Meat Ban is Bad. However...,2018-09-08,2018-09-08T06:26:12Z,Unnatural Vegan,UCJBry7T2R1WeipWMBWKJ7Rg,21659,1210,430,"Thoughts on Missouri's law that makes it illegal to label any product ""meat"" (or other meat terms like sausage) if it doesn't come from a slaughtered animal. ------------------ *References* This Ban On Vegan 'Meat' Labeling Sets A Dangerous Precedent (It's Also Hypocritical) https://www.forbes.com/sites/katrinafox/2018/08/30/this-ban-on-vegan-meat-labeling-sets-a-dangerous-precedent-its-also-hypocritical/#7edd1a3e2ace GFI Goes to Court for First Amendment https://www.gfi.org/gfi-goes-to-court-for-first-amendment Lawsuit Raises the Stakes in Food Fight Over the Term “Meat” https://www.aclu-mo.org/en/news/lawsuit-raises-stakes-food-fight-over-term-meat Voluntary Standards for the Labeling of Plant-Based Milks in the United States https://plantbasedfoods.org/policy-and-advocacy/voluntary-standards/ Press Release from Missouri Cattlemen’s Association https://www.mocattle.org/newspublications1.aspx?NewsID=1859 ------------------ *Support an Effective Animal Charity* https://animalcharityevaluators.org/ Twitter: http://twitter.com/unnaturalvegan Instagram: https://instagram.com/unnaturalvegan Patreon: https://www.patreon.com/unnaturalvegan"
France,FR,fr,US,en,,RoFbmYyTRFA,https://www.youtube.com/watch?v=RoFbmYyTRFA,How Food Companies are Rethinking Meat for the Flexitarian Consumer,2018-10-11,2018-10-11T19:13:44Z,The Good Food Institute,UCOGnJbUSyBdSfAfFg7ZucPA,688,12,0,"The pioneers creating plant-based meat discuss how to capitalize on a consumer shift toward plant-based proteins, innovating to provide sensory experiences that mirror traditional meat, key influences, plans and visions for the future. - Sergio Eleuterio, The Kraft Heinz Company - Nigel Hughes, Kellogg’s - Dan Curtin, Lightlife Foods & Field Roast - Alison Rabschnuk, GFI (moderator) About The Good Food Institute: GFI works with the scientists, entrepreneurs, investors, policymakers, and companies accelerating the growth of plant-based meat and clean meat — two promising food technologies that will allow us to feed almost 10 billion people by 2050. Learn more about the organization: https://www.gfi.org Sign-up for updates on the annual gathering of the key players in this space: https://goodfoodconference.com Follow The Good Food Institute Twitter: https://twitter.com/GoodFoodInst Facebook: https://www.facebook.com/thegoodfoodinstitute/ LinkedIn: https://www.linkedin.com/company/the-good-food-institute/ Newsletter: https://goodfoodconference.com/subscribe/ Resources Free online course exploring the science behind plant-based and clean meat: https://www.gfi.org/onlinecourses Ocean of Opportunity Action Paper: https://www.gfi.org/seafood Startup manual for plant-based and clean meat entrepreneurs: https://www.gfi.org/startupmanual"
France,FR,fr,US,en,en,4Qwle3YnMow,https://www.youtube.com/watch?v=4Qwle3YnMow,"Why the word ""meat"" is so controversial",2018-10-02,2018-10-02T17:00:29Z,Grist,UC7ga3FLMFOOpMQwaYoW42bw,2420,44,8,"You know the names of all those alternative meat products that you think are kind of cute but mostly uncomfortable to say out loud? Chik’n patties, Fruffalo Wings, Benevolent Bacon? Those names — and the products they (sort of) describe — are now under legal threat. In Missouri, a new law suggests that peddlers of plant protein should spend a year in prison for misleading customers looking for good ol’ animal flesh. You know the old American motto: You aren’t legit until a state law has been passed to try to threaten your industry! We examine how we got to this place in legal and edible history in our video above."
France,FR,fr,AU,en,en-GB,HJj0-uy85gk,https://www.youtube.com/watch?v=HJj0-uy85gk,Farmers slam comments vegan egg and bacon are ethical alternatives | Nine News Australia,2019-04-17,2019-04-17T08:42:52Z,9 News Australia,UCIYLOcEUX6TbBo7HQVF2PKA,4104,27,,"Victorian egg farmers have slammed a Melbourne-based fast food outlet for its marketing of vegan egg and bacon products. Lord of the Fries says it offers an alternative for ethical eaters but some food producers say they're lying to customers. Join Nine News for the latest in news and events that affect you in your local city, as well as news from across Australia and the world. Get more at: https://www.9news.com.au/ Follow Nine News on Facebook: https://www.facebook.com/9News/ Follow Nine News on Twitter: https://twitter.com/9NewsAUS Follow Nine News on Instagram: https://www.instagram.com/9news/ #9News #NineNewsAustralia #9NewsAUS"
France,FR,fr,,en,en-GB,PflbbVNxVB0,https://www.youtube.com/watch?v=PflbbVNxVB0,Cosucra explains why natural and sustainable ingredients are a priority for today’s consumers.,2019-12-09,2019-12-09T12:57:30Z,FoodBev Media,UCL3EupkccalPSDOTEM7nRJQ,224,1,0,"http://www.foodbev.com -- Eric Bosly, global commercial director at Cosucra, spoke to Bryony Andrews at FIE 2019, to explain the paradox of the consumer who wants products with more fibre, protein and plant-based ingredients – but who is not willing to compromise on convenience or taste."
France,FR,fr,FR,en,,2zcpL8pKpm0,https://www.youtube.com/watch?v=2zcpL8pKpm0,Roquette at FIE 2019 - Plant-based solutions for consumers’ daily life,2020-01-06,2020-01-06T08:40:57Z,Roquette,UCzGBXPaiF3c4miZvNfUgEHw,251,3,0,
France,FR,fr,FR,en,en,lHz-cVJPd-o,https://www.youtube.com/watch?v=lHz-cVJPd-o,Lab grown cell-based meat start-ups facing setbacks,2019-07-12,2019-07-12T05:21:12Z,africanews,UC1_E8NeF5QHY2dtdLRBCCLA,191,0,0,"The dream to serve people with cell-based meat is facing challenges. Memphis Meats is a California based start-up seeking to spare the environment from exploitation and the animals from slaughter. But, so far the new generation of lab farmers face scrutiny from U.S consumers, regulators and food-safety advocates. ""We take cells from high quality animals. We feed them with the nutrients of these cells need to become meat. And once they become meat, we harvest it and we cook it into the product… READ MORE : http://www.africanews.com/2019/07/10/lab-grown-cell-based-meat-start-ups-facing-setbacks Africanews on YouTube brings you a daily dose of news, produced and realised in Africa, by and for Africans. Africanews is the first pan-African multilingual media outlet, unique in its concept and vision. Subscribe on our Youtube channel https://www.youtube.com/c/africanews and receive all the latest news from the continent. Africanews is available in English and French. Website : www.africanews.com Facebook : https://www.facebook.com/africanews.channel/ Twitter : https://twitter.com/africanews"
France,FR,fr,IN,en,,Wd4h-5Onh50,https://www.youtube.com/watch?v=Wd4h-5Onh50,Impossible Foods will start selling #US,2020-05-06,2020-05-06T13:06:48Z,BREAKING NEWS,UCTQA6q0CVbXJhNSQtg5sXFQ,32,,0,"Impossible Foods will start selling its vegan burgers in supermarket chain Kroger's 1,700 U.S. stores as demand for plant-based meat alternatives soars."
France,FR,fr,US,en,en,azuq95U8P98,https://www.youtube.com/watch?v=azuq95U8P98,Food for thought: Dishes that are both tasty and good for the planet,2019-03-15,2019-03-15T18:22:21Z,FRANCE 24 English,UCQfwfsi5VrQ8yKZ-UWmAEFg,1563,25,4,"Subscribe to France 24 now: http://f24.my/youtubeEN FRANCE 24 live news stream: all the latest news 24/7 http://f24.my/YTliveEN Is France's love of all things tasty leaving the planet with a nasty aftertaste? This week, we follow the Gout de France festival, where sustainable fare can come in many different forms. From an underground city farm to solar cooking and an eco-warrior chef, efforts to put seasonal and responsibly sourced food back on the menu are slowly but surely gaining ground. France in Focus gives you a recipe for change. Visit our website: http://www.france24.com Subscribe to our YouTube channel: http://f24.my/youtubeEN Like us on Facebook: https://www.facebook.com/FRANCE24.English Follow us on Twitter: https://twitter.com/France24_en"
France,FR,fr,US,en,en,oWKrHcE8iWk,https://www.youtube.com/watch?v=oWKrHcE8iWk,Louisiana Bans Misleading Food Labeling Veggie meat & Cauliflower Rice,2019-05-09,2019-05-09T20:12:32Z,Ripe,UC2OuoOnXZ-EosStugaJoWsg,296,8,5,"In the past 12 months, there has been a lot of controversy around food labeling of plant based alternative products in various state legislatures across the country. And what has become the hot food labeling this week is RICE, as Louisiana has put forth a bill blocking companies from putting a “rice” label on products if they aren’t made from actual grains of rice is moving quickly through the legislature. With a growing food craze of all things cauliflower from pizza crust to rice - many lawmakers in rice-growing states are joining together to claim that cauliflower rice is not really rice. On the surface, this is a fight between industry trade groups: USA Rice against the Plant Based Food Association. But both sides have positioned the consumer as the victim, using arguments based on health or free speech. The rice battle is happening alongside others at the state and national level over the meaning of milk and meat; some measures, like Louisiana's, target multiple plant-based alternatives. The Senate voted 34-0 Monday, April 22, for a ""truth in labeling"" measure that adds protections for meat, rice and sugar producers. The proposed bill is similar to what is in play in Arkansas. It would ban companies from classifying lab-grown meat products or meat substitutes as meat, or they'd face fines. They would be unable to call something sugar if it doesn't come from a plant-based simple sugar or sucrose. Sen. Francis Thompson, a Delhi Democrat, says he wants to ensure consumers know what they're buying. a similar bill passed by Missouri lawmakers resulted in a lawsuit from the Tofurky Company and the Good Food Institute Inc., a case that is still ongoing. The FDA does define ""standards of identity"" for 300 foods across 20 categories such as Sherbet; peanut butter and milk. But Rice has no standard of identity in the U.S., meaning state-level laws are the only guidelines defining rice. This controversial labeling is heating up debate not only across the states, but also in the EU. As the EU courted controversy this week after suggesting it may ban names like ‘burger’ and ‘sausage’ for vegan and vegetarian food products to be replaced with the names ‘discs’ instead of burgers and ‘tubes’ instead of sausages. Ripe is a 100% independent media production company dedicated to bringing the fringe plant-based lifestyle mainstream with original video content, documentaries and series. SUBSCRIBE HERE: https://www.youtube.com/ripewatch CHECK US OUT: Ripewatch.com FOLLOW RIPE: Facebook: https://www.facebook.com/ripewatch Instagram: https://www.instagram.com/ripewatch Twitter: https://twitter.com/ripewatch #cauliflowerrice #foodlabelingban #riceban"
France,FR,fr,KR,en,en-US,V9MjVMl3QZ0,https://www.youtube.com/watch?v=V9MjVMl3QZ0,How COVID-19 pandemic boosted alternative meat,2020-07-14,2020-07-14T14:18:16Z,Arirang News,UCzznO4xSV8BKnUBPyswtCUw,1137,15,1,"[코로나가 바꾼 식탁] 코로나 반사이익 본 ‘대체육’...미래 먹거리 어디까지? There's been repeated COVID-19 outbreaks at slaughterhouses... and new diseases passing from animals to humans. In response, interest in more sustainable and eco-friendly plant-based alternatives is growing. Choi Jeong-yoon provides a glimpse of the possible changes to come. The COVID-19 pandemic has been a watershed for the meat industry. The UN Food and Agriculture Organization predicts that the pandemic will cause meat consumption to drop three percent this year to the lowest it's been in nearly a decade. Taking the place of conventional meat processing and sales are meat alternatives. ""I'm hesitant to buy meat these days. I saw this plant-based meat and I look forward to trying it out."" In a report released Tuesday, analysts forecast the value of the global market for meat alternatives to grow by an annual average of 9-point-5 percent through 2025... to a value of around 18 billion U.S. dollars. “Once considered expensive and hard to find, alternative meat can now be found in most general marts. They are also much more affordable. For example, this product retails for just 7 U.S. dollars.” The first Korean company to launch meat subsitutes at supermarkets, Viomix, says they contribute to a healthier diet. ""Ingredients can be added and taken out flexibly in the production process. For example, we can replace the trans fats and cholesterol in meat with more protein and fiber from plants."" To make the products taste, look and feel like real meat, thousands of rounds of testing are required,... like when adding liquid from beets to create the appearance of meat that's fresh. It can also shrink the environmental footprint of meat... because one cow typically emits a thousand liters of methane gas every day, and it takes almost 7-thousand liters of water to produce 450 grams of beef. Innovative attempts are underway around the world to create even more alternatives. Israel is trying a 3D printer to produce an entirely plant-based steak using protein taken from plants, which then are built up in layers to create the muscle, the blood and the fat of real meat. The post-COVID-19 era is expected to bring more changes that recreate the taste and texture of real meat while reducing costs once the technology is scaled up. Choi Jeong-yoon, Arirang News. #COVID19 #pandemic #alternative 📣 Arirang News(Facebook) : https://www.facebook.com/arirangtvnews 📣 Arirang News(Twitter) : https://twitter.com/arirangtvnews 📣 News Center(YouTube) : https://www.youtube.com/c/NEWSCENTER_ARIRANGTV"
France,FR,fr,US,en,en-US,dKxsPqfr8L8,https://www.youtube.com/watch?v=dKxsPqfr8L8,2020 Hot food trends: Meatless additions to fast food menus and non-dairy milk alternatives top list,2020-12-25,2020-12-25T18:00:24Z,Yahoo Finance,UCEAZeUIeJs0IjQiqTCdVSIg,917,24,6,"#plantbasedmeat #nondairy #oatmilk Yahoo Finance’s Alexandra Canal and Brooke DiPalma break down the biggest food trends of 2020. For 2020 election results please visit: Election results: https://www.yahoo.com/elections Subscribe to Yahoo Finance: https://yhoo.it/2fGu5Bb About Yahoo Finance: At Yahoo Finance, you get free stock quotes, up-to-date news, portfolio management resources, international market data, social interaction and mortgage rates that help you manage your financial life. About Yahoo Finance Premium: With a subscription to Yahoo Finance Premium, get the tools you need to invest with confidence. Discover new opportunities with expert research and investment ideas backed by technical and fundamental analysis. Optimize your trades with advanced portfolio insights, fundamental analysis, enhanced charting, and more. To learn more about Yahoo Finance Premium please visit: https://yhoo.it/33jXYBp Connect with Yahoo Finance: Get the latest news: https://yhoo.it/2fGu5Bb Find Yahoo Finance on Facebook: http://bit.ly/2A9u5Zq Follow Yahoo Finance on Twitter: http://bit.ly/2LMgloP Follow Yahoo Finance on Instagram: http://bit.ly/2LOpNYz Follow Cashay.com Follow Yahoo Finance Premium on Twitter: https://bit.ly/3hhcnmV"
France,FR,fr,,en,,7b-T4Ga7M-A,https://www.youtube.com/watch?v=7b-T4Ga7M-A,Lord of the Fries' New Vegan Hot Dog,2019-02-12,2019-02-12T22:38:13Z,FranchiseBusiness.com.au,UCslnQcf4ip18HpAAQWlxmFA,298,2,1,"Vegan fast-food chain, Lord of the Fries has furthered its partnership with Los Angeles based meat-free supplier Beyond Meat, revealing an exclusive new line launch. The national franchise is the first restaurant or retailer in Australia to roll-out the brand’s new Beyond Sausage product, giving way to the inaugural Lord of the Fries hot dog. Made from a mix of pea, fava bean and rice proteins, the new offering comes in three flavours; Bratwurst, Sweet Italian and Hot Italian and is soy and GMO-free. Most importantly for Aussie vegans, the Beyond Sausage is set to look, sizzle and satisfy just like a regular pork sausage. Mark Koroncyzk, Lord of the Fries co-founder said the latest integration targeted not only the growing vegan fast-food market, but also the emerging ‘flexi-tarian’ movement. “As the largest 100% vegan fast food joint in the Southern Hemisphere, we’re thrilled to be offering our customers the first bite of another great plant-based innovation,” Koronczyk said. “We’re proud to be continuing a great partnership with a like-minded pioneer in the ethical food industry.” The entirely plant-based sausage offers juicy, meat flavours and is said to offer more protein and 38% less saturated fat and cholesterol than conventional meat. Previously, the Melbourne vegan institute had partnered with Beyond Meat to bring the innovative meat-free burger to Australian shores. All images sourced via facebook.com facebook.com/loardofthefriesau Music by: Antidepresseur by [friendzoned] | https://soundcloud.com/friendzonedbeats Music promoted by https://www.free-stock-music.com Creative Commons Attribution-ShareAlike 3.0 Unported https://creativecommons.org/licenses/by-sa/3.0/deed.en_US"
France,FR,fr,US,en,en,7EWshot-BPM,https://www.youtube.com/watch?v=7EWshot-BPM,Stop the Veggie Burger Ban,2020-10-07,2020-10-07T08:40:50Z,ProVeg International,UCwSTjgcSbQDUlqCbNf4UrHQ,3483,171,6,"What seems like an April fools day joke might soon be reality. Between 19-22 October, the EU will vote on the Veggie Burger Ban: a law that bans terms such as ‘burger’, ‘sausage’, and ‘steak’ for plant-based products and renames products to ""discs"" and ""tubes"". It also includes labelling restrictions for plant-based dairy products. If we do not take action to stop this irrational legislation now, it will mean a blow below the belt of the plant-based sector and an insult to consumers. Because, seriously, who is confused by the word ""veggie burger""? Add your name to our petition now and tell the European Parliament to not accept the proposed Veggie Burger Ban! Over 100,000 signatures so far! Add yours now. ➡️ www.stoptheveggieburgerban.com Video production: www.gastonbruno.es ----- Visit ProVeg.com to help create a world where everyone can choose healthy and delicious food which is good for all humans, animals and the planet. Other ways to connect with us… FACEBOOK: https://www.facebook.com/ProVegINT/ TWITTER: https://twitter.com/proveg_int INSTAGRAM: http://instagram.com/proveg.inter"
France,FR,fr,,en,,N2_VQoUDVKA,https://www.youtube.com/watch?v=N2_VQoUDVKA,Amsterdam Vegan Food Tour,2020-02-16,2020-02-16T20:44:16Z,Plant Based Vibe,UCAleY3RFd3OMOwI9wByj_0Q,97,2,0,"First trip to Amsterdam and the first stop was a coffee shop. Spent all my time finding all the best plant-based and vegan food around the city. For more details and pictures, follow the blog: www.plantbasedvibe.com"
France,FR,fr,KR,en,en-US,VwF45c57_kw,https://www.youtube.com/watch?v=VwF45c57_kw,McDonald's starts testing Beyond Meat burgers in Canada,2019-09-27,2019-09-27T00:32:33Z,Arirang News,UCzznO4xSV8BKnUBPyswtCUw,378,3,0,"맥도날드, 비욘드미트와 손잡고 식물성 고기 버거 시험판매 McDonald's will no longer just be a place for meatlovers...as it's introducing its very own plant-based burger. Working in collaboration with plant-based meat producer Beyond Meat, the so-called P.L.T., plant, lettuce and tomato, burger, will be available for around 5 U.S. dollars in 28 McDonald's locations in Canada. The 12-week test run will begin next Monday. McDonald's said it's testing the P.L.T because of its customers' growing interest in plant-based alternatives. With the introduction of the new burger, Beyond Meat's stock rocketed 12 percent on Thursday. #McDonald #plantbasedburger #BeyondMeat #PLTburgers #Canada Arirang News Facebook: http://www.facebook.com/arirangtvnews"
France,FR,fr,NL,en,,mpIvFEseXp8,https://www.youtube.com/watch?v=mpIvFEseXp8,The Veggie Burger Ban in the EU | 2020,2020-10-11,2020-10-11T11:45:22Z,Level Joy,UC8-p4NXJ9j66peemzxHVxsw,480,30,17,"If you’d like to sign the petition, make sure to do so before the 19th of October! I am not associated with ProVeg International, nor any other companies, political parties or organisations mentioned in this video. Petition: https://proveg.com/stop-the-veggie-burger-ban/ Credits: Pressmaster Pavel Danilyuk Ketut Subiyanto Karolina Grabowska Pavel Danilyuk Polina Tankilevitch cottonbro via Pexels Past Sadness by Kevin MacLeod Link: https://incompetech.filmmusic.io/song/5024-past-sadness License: http://creativecommons.org/licenses/by/4.0/ Sources: ►https://proveg.com/nl/ ►https://proveg.com/blog/veggieburger-ban-has-officially-been-stopped-in-the-netherlands/ ►https://www.hospitalityandcateringnews.com/2020/10/veggie-burger-ban-europe/ ►https://www.sciencedirect.com/science/article/pii/S0306919220301354 ►The European Legal Framework on Vegan and Vegetarian Claims Sochirca, Neli.European Food and Feed Law Review : EFFL; Berlin Vol. 13, Iss. 6, (2018): 514-521. LEVEL JOY ► Facebook:https://www.facebook.com/pages/Level- Joy/1438903319753200 ► Twitter:https://twitter.com/LvlJoy ► Instagram: https://www.instagram.com/lvljoy/ ► Patreon: https://www.patreon.com/LevelJoy"
