country,search_region_code,search_language,channel_country,default_language,default_audio_language,video_id,url,title,upload_date,published_at,channel,channel_id,view_count,like_count,comment_count,description
France,FR,fr,,en,en,rDjeBoesyXc,https://www.youtube.com/watch?v=rDjeBoesyXc,WHAT'sIN Fruit Box - Freshly Delivered @ your Doorstep !,2018-02-01,2018-02-01T09:56:47Z,WHAT'sIN Fruit Box,UC2zts5r4nrAcrucEweRPwoQ,641,5,0,"We specialize in delivering surprise fresh fruits baskets at doorstep of families, individuals and corporations. We believe that everyone should have access, at a reasonable price, to fresh and tasty seasonal fruits. Grown under the sun and following sustainable agriculture practices, we take pride in delivering healthy fruits to your doorstep. Because we think having a vitamin refill goes well with having fun, we compose our surprise fruit baskets with what's in season!"
France,FR,fr,US,en,en,3UJ5sz0mVXk,https://www.youtube.com/watch?v=3UJ5sz0mVXk,Beef gelatin in yoghurt? NGO urges companies to disclose use of animal-based ingredients,2018-09-20,2018-09-20T13:40:06Z,FRANCE 24 English,UCQfwfsi5VrQ8yKZ-UWmAEFg,1582,27,10,"Subscribe to France 24 now: http://f24.my/youtubeEN FRANCE 24 live news stream: all the latest news 24/7 http://f24.my/YTliveEN The European NGO FoodWatch has published a list of companies that use animal products without disclosing the facts to consumers. From candy to soda, beans and yoghurt, 12 different french products have been named. Visit our website: http://www.france24.com Subscribe to our YouTube channel: http://f24.my/youtubeEN Like us on Facebook: https://www.facebook.com/FRANCE24.English Follow us on Twitter: https://twitter.com/France24_en"
France,FR,fr,,en,,3kRjemvOST8,https://www.youtube.com/watch?v=3kRjemvOST8,Gordon Helps Struggling Fine Dining Restaurant | Kitchen Nightmares,2020-03-13,2020-03-13T17:00:00Z,Kitchen Nightmares,UCUZzyuAlhHNP3oiuMjn7RfQ,5915581,63763,5265,Gordon Ramsay helps a struggling fine dining restaurant in Scotland find it's place. If you liked this clip check out the rest of Gordon's channels: http://www.youtube.com/gordonramsay http://www.youtube.com/thefword http://www.youtube.com/kitchennightmares More Gordon Ramsay: Website: http://www.gordonramsay.com Facebook: http://www.facebook.com/GordonRamsay01 Twitter: http://www.twitter.com/GordonRamsay . #GordonRamsay #KitchenNightmares
France,FR,fr,CN,en,,4UbRt_QUO4A,https://www.youtube.com/watch?v=4UbRt_QUO4A,"Grape Seed Extract --- from CHINA HAIHERB BIOTECHNOLOGY CO., LTD,leading herbal extract manufacturer",2020-09-20,2020-09-20T10:08:23Z,"CHINA HAIHERB BIOTECHNOLOGY CO., LTD",UCunkuz-SnVI1r8qQGFmMCNg,174,1,0,"● Product Description Product Name: Natural Grape Seed Extract Used Part: Seed Appearance: Purple Red Fine Powder Test Method: HPLC Specification: Proanthocyanidins (OPC) 95%-98% Grape seed extract is a nutritious food extracted from natural grape seeds with vitamin E and other main raw materials. Grape seed extract is a new type of natural antioxidant which can not be synthesized in human body. It is the most powerful antioxidant and free radical scavenging substance found in nature at present. Its antioxidant activity is 50 times that of vitamin E and 20 times that of vitamin C. It can effectively remove excess free radicals in human body and has a super effect of delaying aging and enhancing immunity. Anti-oxidation, anti-allergy, anti-fatigue, enhance physical fitness, improve sub-health, delay aging, improve irritability, dizziness, fatigue, memory loss and other symptoms. ● Product Function 1. Grape seed extract is known as a natural sun shield, which can protect the skin from ultraviolet rays. 2. Prevent excessive cross-linking, maintain moderate cross-linking, delay and reduce the appearance of skin wrinkles, and keep skin smooth and supple. 3. Grape Seed Extract has significant effect on acne, spots and whitening, and has no sequela caused by acne and spot whitening products for external use. Cardiovascular protection and prevention of hypertension 1. Grape Seed Extract Improve vascular elasticity and lower blood pressure 2. Prevent thrombosis radiation-proof effect 1. Reduce the harm of ultraviolet radiation, cell phone, TV and other radiation sources to human body. 2. Grape Seed Extract the body can produce endogenous free radicals after irradiation, causing lipid peroxidation and other damage, while OPC has the effect of scavenging free radicals and inhibiting oxidative damage. Anti - allergic, anti - inflammatory 1.Grape Seed Extract OPC has been internationally recognized as the ""natural anti-allergy Nemesis"", especially for pollen allergy, and there are no side effects such as lethargy and obesity after taking general anti-allergy drugs. 2. Grape Seed Extract selectively bind to the connective tissue of joints to prevent joint swelling, help heal damaged tissues and relieve pain. Therefore, procyanidins have a significant effect on various types of arthritis. ● Product Application 1. Grape Seed Extract OPC apply to medicinal development The patented product of grape seed procyanidins is used to treat microcirculatory diseases, including eye and peripheral capillary permeability diseases and venous and lymphatic dysfunction. 2. Grape Seed Extract OPC apply to Cosmetics development The therapeutic effects of procyanidins in indications such as anti - inflammatory and anti - radiation activity, especially in dermatology, were studied. The therapeutic effect of procyanidins is closely related to their ability to scavenging free radicals, while the degradation process of lipids, proteins and nucleic acids caused by environmental stimulation on skin, mucous membrane and hair is inseparable from free radicals. CHINA HAIHERB BIOTECHNOLOGY CO., LTD HAIHERB,established in 2005,is the leading manufacturer and exporter of herbal extracts,botanical extracts,amino acids,and nutritional supplements,sports nutrition ingredients.With over a decade of development,HAIHERB has built a good reputation among both domestic and foreign customers,such as United States,United Kingdom,France,Ukraine,Poland,Italy,Japan,Singapore,etc. Email:info@haiherb.com"
France,FR,fr,FR,fr,,qWBZZHyFvqY,https://www.youtube.com/watch?v=qWBZZHyFvqY,Plateau repas,2019-11-27,2019-11-27T09:45:58Z,Ahmad MO,UCT-klBIfQa42C5KnROWXFOg,2153,22,0,
France,FR,fr,FR,en,en-GB,FHunI20ZsgQ,https://www.youtube.com/watch?v=FHunI20ZsgQ,Frugal food from the local market,2020-06-18,2020-06-18T09:29:25Z,Frugal Queen in France,UC5Ak9m0LV3zRC0zGrXfkbsQ,6072,512,11,See what I bought from a local charity shop and our frugal food from our village market in Huelgoat in North West France in Brittany.
France,FR,fr,,fr,,Sp4uy54pBsU,https://www.youtube.com/watch?v=Sp4uy54pBsU,Auchan fausse annonce de provenance des mandarines,2019-05-15,2019-05-15T07:54:09Z,Kamsou,UCoKlA-wJl2aiKCP-0LldiQw,972,13,6,Mandarine provenance israël auchan trompe les clients en écrivant espagne
France,FR,fr,CL,en,es-419,6MAH_8t4IYQ,https://www.youtube.com/watch?v=6MAH_8t4IYQ,Discover Chilean Based Products | Marca Chile,2020-08-17,2020-08-17T23:17:37Z,Marca Chile,UC_24RLMZwkSCrVNIkFuBMTA,447343,27,2,Chile pledges to give consumers it's very best. Explore what Chile has to offer. Learn More: https://marcachile.cl/keeps-on-going/ #ChilekeepsOnGoing
France,FR,fr,US,en,en,qRgrXbVtGo0,https://www.youtube.com/watch?v=qRgrXbVtGo0,Vegan protester at McDonald’s,2020-07-28,2020-07-28T15:39:57Z,THEPLANETEARTH,UCcTZ9A6-KvxmHBaHY8WA7kw,2638,49,21,
France,FR,fr,,en,en-US,KnjDfZAwMN8,https://www.youtube.com/watch?v=KnjDfZAwMN8,"Vegan sausage, insect shakes, and an electric tractor",2020-01-22,2020-01-22T16:05:16Z,AP Archive,UCHTK-2W11Vh1V4uwofOfR4w,230,3,1,"(17 Jan 2020) LEAD IN: Germany's largest food and agriculture fair, the International Green Week, has opened in Berlin, with its focus on sustainability. Swiss food giant Nestle is using the show to launch a vegan sausage while other companies are showing food made from insects, alcohol free wine and there's even a concept model of an electric tractor. STORY-LINE: This might look like any other sausage being served in any of the hundreds of sausage kiosks in the German capital Berlin. But this one is a bit different, it doesn't contain any meat. The sausage is being launched here at the International Green Week food fair in Berlin by Swiss food giant Nestle. It follows the launch of several vegan burgers over the last few years. And at the start of the year, the launch of vegan pork by US company Impossible foods. ""This is the Incredible sausage. It is fully made from plants. And it tastes really good and has a good consistency and fully natural ingredients and it tastes like a sausage. So no one has to live without a real sausage anymore,"" says Miguel Serrano, Nestle Head of vegetarian products. The vegan sausage will be sold as the Incredible Sausage under Nestle's vegetarian brand Garden Gourmet. The sausage is made from soy protein and plants, such as beetroot. ""Consumers want real alternatives because meat consumption is being questioned more and more by society. And people want a better diet, a more balanced diet,"" says Serrano. Meat consumption is often linked to emissions of greenhouse gasses and vegetarian alternatives are seen by many consumers as a more sustainable alternative. ""As Nestle, we want to add our small, but very important contribution. We are a big company and with that size comes a big responsibility,"" says Serrano. Over 1,550 exhibitors are showing their products here at International Green Week in Berlin. Many are traditional companies and restaurants, but there are several small start-ups in the halls of the Berlin exhibition grounds. One of them is Isaac nutrition, a Cologne-based company making protein shakes and protein balls out of insects and larvae. These shakes and balls are made out of Buffalo worms, the larvae of the Alphitobius diaperinus, a species of beetle. ""This is the Buffalo worms. It is farmed with low resources in the Netherlands. For example, beef needs 2500 times more water and has a 200 times larger CO2 footprint than Buffalo worms. They also need very little space and food,"" says Charlotte Binder, CEO of Isaac Nutrition. Berlin-based Kolonne is showing its range of alcohol free wine. Unlike most alcohol free wines on the market, Kolonne buys high-end wines and then removes the alcohol through a heating and vacuum process. ""This is of course a segment that is growing all the time. People are more health focused. This really doesn't have many calories. And it makes more fun to drink this compared to a Coke or an apple drink with your food."" It's not just food which is taking on a green hue. Over at the agriculture hall of the fair, US tractor maker Steyr is showing a concept of an electric hybrid tractor. The hybrid engine can also be exchanged for a plug-in electric engine or a Hydrogen engine. But, at this stage the tractor is just a concept, Steyr does not have any plans to release it to the market right now. ""When you look at a concept like this you have to wonder, when will it be available. And I think this is something that we are all going to learn from. But I think the answer is, 'it won't take that long,'"" says Jona Hormann, Steyr's sales manager. Find out more about AP Archive: http://www.aparchive.com/HowWeWork Twitter: https://twitter.com/AP_Archive Facebook: https://www.facebook.com/APArchives ​​ Instagram: https://www.instagram.com/APNews/ You can license this story through AP Archive: http://www.aparchive.com/metadata/youtube/dfa4a558b4cc41478fb2d33184121042"
France,FR,fr,US,en,,Hs7JUB3FzoE,https://www.youtube.com/watch?v=Hs7JUB3FzoE,"Novak Djokovic, Vegan Lobby Group, Fishing Ban and France Limits Egg Industry",2020-02-06,2020-02-06T18:34:49Z,Soflo Vegans,UCqO7uQUqwBM7iTBVvF1EB5Q,100,1,2,"Novak Djokovic Wins Australian Open Prominent vegan and tennis titan, Novak Djokovic, wins the Australian Open and gets his 17th Grand Slam singles titles. This win puts him back at the top of the number one rankings. He trails Roger Federer who holds the record of 20 Grand Slam titles and Rafael Nadal who holds 19. Djokovic is the youngest of the three, so there is plenty of time for him to hold the record. In addition to publicly claiming to be vegan for both his health and the animals, Djokovic was also a producer on the recent documentary Game Changers. California Starts its own Vegan Lobby Group The fifth-largest global economy now has a vegan lobby group. The California Plant Based Alliance is a political advocacy group, protecting the rights of consumers as well as companies making vegan products. California is currently home to several leading vegan food brands. These include Follow Your Heart, Miyoko’s Creamery, Beyond Meat, and Impossible Foods. Sussex Bans Fishing Sussex becomes the first UK council to ban fishing in response to climate change. The ban comes off the heels of the successful Help Our Kelp campaign that was backed by natural historian and environmentalist Sir David Attenborough. The campaign will give Kelp forests time to regenerate. It’s important because these underwater forests are able to absorb large amounts of carbon. Trawling and other varieties of fishing cause damage to the seafloor and tear up the kelp. France to Ban The Egg Industry from Shredding Male Chicks France will be one of the first countries in the world to ban the live-shredding of male chicks. French Minister of Agriculture Didier Guillaume announced the ban in Paris. Each year, the egg industry culls approximately seven billion male chicks. They are considered worthless because they don’t produce eggs or commercially popular meat. Switzerland has already banned the practice and Germany will continue until an alternative method is found. Additionally, France will no longer castrate piglets without anesthetic. See the full episode and show notes https://www.soflovegans.com/burger-king-faces-a-class-action-lawsuit-over-the-impossible-whopper/"
France,FR,fr,,en,,Acvxrm4BVR4,https://www.youtube.com/watch?v=Acvxrm4BVR4,CBD Oil for Sleep - CBD Oil Tinctures,2020-07-11,2020-07-11T10:22:57Z,Wilkin Luther,UCzgaKsOot4kb3kkAqkAMQqA,118,1,0,"https://justcbdstore.com/product-category/cbd-tincture/ Due to the COVID-19 pandemic spoiling people’s summer plans, stress is building up. Fortunately, powerful CBD tinctures are here to help. Growing in popularity, the top CBD Oils for sale are created with organic oils and flavors. They also make it easy to get the precise dose of CBD that you want simply by dropping it into your mouth. All the CBD oil is then quickly absorbed. Right away, your mind and body will experience the benefits of CBD. At the same time, the top tinctures of are convenient, as well as inexpensive tincture dosages can easily be increased or decreased with the number of drops one takes. Before you know it, you will feel the ideal amount of CBD for stress-free relaxation. WHAT ARE CBD TINCTURES? Derived from hemp, CBD tinctures are inexpensive and convenient products that are easily absorbed in users’ mouths. The best CBD tinctures for sale are made with alcohol and water to extract important compounds found in the cannabis plant. The CBD from tinctures can actually counter the unwanted euphoric effects of THC. HOW DO YOU USE CBD OIL TINCTURES? Using a CBD hemp oil tincture is simple. You simply begin with one dropper full and put the liquid under the tongue. Hold the CBD oil there for 1 to 2 minutes before swallowing. Many people feel that the best time to take CBD tinctures is after a meal, if not a fatty snack. HOW LONG DO CBD TINTURES LAST? The effects of CBD tincture oil last anywhere from 4 to 6 hours. Thankfully, your body can begin feeling the benefits of legal oil tinctures within 15 to 30 minutes. Of how, it all depends on the strength of the CBD dose. The top CBD oil tinctures may not work as quickly as oils, but they certainly make a much faster impact than edibles. HOW LONG WILL CBD OIL STAY IN MY SYSTEM? Even the best CBD products, like the best CBD tincture oils, are flushed out of the body in a very short time, typically 5 or 6 days. Of course, that length of time can increase for habitual users for up to 10 days. Regardless, CBD from hemp is better than marijuana which can last 30 days in a person’s system."
France,FR,fr,,en,,FTpthuAVbx8,https://www.youtube.com/watch?v=FTpthuAVbx8,Hi Smiles Teeth Whitening Technology,2020-02-19,2020-02-19T13:37:01Z,Hi Smiles Teeth Whitening Technology,UCjaGyiQeZlnhr-6FtHJ59gw,74,3,0,"The team at Hi Smiles Teeth Whitening Technology have developed the first collection of FDA approved and vegan friendly teeth whitening products which provide guaranteed results. Our products are unrivalled when it comes down to teeth whitening results , a large number of products can actually be harmful to your teeth which are widely available on the market and are not approved by the FDA or PETA and are not vegan friendly. The technology we offer enables our customers to safely achieve their Hollywood smile without damaging their teeth or breaking the bank..... NO SURGERY NEEDED !"
France,FR,fr,US,en,,NvDjjiX3EzQ,https://www.youtube.com/watch?v=NvDjjiX3EzQ,Sustainable Cooking : Good for You & The Planet with Matthew Kenney Cuisine,2019-02-14,2019-02-14T00:53:50Z,Chef Serena Poon,UCZya285uY3fNcv4KHAGg-hw,2169,14,4,"Sustainable, nutritious and delicious. Award-winning Chef and restauranteur Matthew Kenney is a true visionary in the mission to create beautiful, sustainable, nutritious and globally accessible plant-based cuisine. Classically trained in French cooking, Matthew’s connection to the planet and holistic health brought him to a plant-based lifestyle igniting his vision of Crafting the Future of Food for a healthier world. On today’s episode, Matthew joins Serena to discuss how he approaches food choices with the intent to align with what is best for planet and those who inhabit it. LEARN more about Matthew Kenney at: matthewkenneycuisine.com IG: @mmatthewkenneycuisine FB: @matthewkenneycuisine LI: @matthew-kenney ***** Serena Loves is filmed by @FocusTVNetwork in West Hollywood, CA. © Serena Poon, 2019, All Rights Reserved"
France,FR,fr,US,en,en,xOUfY7Dvka0,https://www.youtube.com/watch?v=xOUfY7Dvka0,"The ""impossible burger"": are meatless burgers the future?",2018-08-20,2018-08-20T15:31:05Z,FRANCE 24 English,UCQfwfsi5VrQ8yKZ-UWmAEFg,760,16,8,"Subscribe to France 24 now: http://f24.my/youtubeEN FRANCE 24 live news stream: all the latest news 24/7 http://f24.my/YTliveEN In San Fransisco, a restaurant has developped the ""impossible burger"" which is a vegetarian alternative to your regular burger. It is in fact very popular, as vegetarianism gathers pace as a lifestyle choice. Other companies have attempted to create proteins in a lab in a bid to reduce CO2 emissions. Visit our website: http://www.france24.com Subscribe to our YouTube channel: http://f24.my/youtubeEN Like us on Facebook: https://www.facebook.com/FRANCE24.English Follow us on Twitter: https://twitter.com/France24_en"
France,FR,fr,US,en,en,GuOmBqLeHvI,https://www.youtube.com/watch?v=GuOmBqLeHvI,Should we all go vegan to save the planet?,2019-03-08,2019-03-08T14:57:05Z,FRANCE 24 English,UCQfwfsi5VrQ8yKZ-UWmAEFg,4857,33,13,"Subscribe to France 24 now: http://f24.my/youtubeEN FRANCE 24 live news stream: all the latest news 24/7 http://f24.my/YTliveEN Being vegan was once a fringe movement, but today it's going mainstream. Even the land of beef bourguignon has joined the game. In 2016 the sale of vegan products jumped by 82% in France. Vegan restaurants, grocery stores and even dairy-free cheese are finding new fans. Visit our website: http://www.france24.com Subscribe to our YouTube channel: http://f24.my/youtubeEN Like us on Facebook: https://www.facebook.com/FRANCE24.English Follow us on Twitter: https://twitter.com/France24_en"
France,FR,fr,GB,en,en,1zzA9XA67ew,https://www.youtube.com/watch?v=1zzA9XA67ew,Lentils: A Miracle Of Nutrition [Full Documentary],2019-03-20,2019-03-20T17:33:08Z,PLANT BASED NEWS,UCJRjK20fHylJyf-HiBtqI2w,3031139,41160,3730,"Lentils are undemanding plants from drier regions, yet at the same time they are extremely rich in protein and are real power packs, full of minerals and trace elements. Scientists from around the world are working on attempts to develop them for use as wonder weapons against famine. The lentil researchers make use of state-of-the-art biotechnology in order to make the undemanding pulses even more profitable and resistant. Lentils - Food For The Future Full credit to Frigge Mehring Sign up to the PBN Newsletter to receive the latest news headlines: https://plnt.news/newsletter --- ★ CHECK OUT PBN INSIDERS FOR THE BEST STUFF: https://plantbasednews.org/insiders ★ SUPPORT OUR WORK BY MAKING A CONTRIBUTION: https://www.plantbasednews.org/support ★ GET OUR FREE MODEL MEAL INSPIRATION GUIDE: http://bit.ly/pbnmealguide ★GET OUT VEGAN PREGNANCY GUIDE: http://theveganpregnancyguide.com/ ★ GET OUR VEGAN PARENTING GUIDE: http://raisingachildvegan.com/ ★ HELP TRANSLATE OUR VIDEOS: http://bit.ly/translatePBN ★ SIGN UP TO RECEIVE OUR WEEKLY HEADLINES IN YOUR INBOX: https://plnt.news/newsletter ★ GOT A NEWS STORY WE SHOULD KNOW ABOUT? Please email press@plantbasednews.org or leave a message on our hotline UK landline: +44 207 0960 175, US landline: +1 818 963 5411 ★ CHECK OUT OUR WEBSITE: http://www.plantbasednews.org/ SOCIAL MEDIA ★ TWITTER: https://www.twitter.com/plantbasednews ★ FACEBOOK: https://www.facebook.com/plantbasednews ★ YOUTUBE: https://www.youtube.com/plantbasednews ★ INSTAGRAM: https://www.instagram.com/plantbasednews LEARN ABOUT VEGANISM ★ Cowspiracy ➞ https://youtu.be/nV04zyfLyN4 ★ NutritionFacts.Org ➞ https://goo.gl/BdNbiU ★ Veganuary ➞ http://www.veganuary.com/"
France,FR,fr,,en,en,9oHkjhtuWiI,https://www.youtube.com/watch?v=9oHkjhtuWiI,"Save the planet, go vegan. But is it good for me ? | AFP",2019-09-11,2019-09-11T05:04:55Z,AFP News Agency,UC86dbj-lbDks_hZ5gRKL49Q,85,0,0,"How do we eat and protect the planet? In its latest report, France's GIEC (Group of Intergovernmental Experts on Climate Evolution) underlines the link between global warming and agricultural soil erosion, an alarm call which suggests changes are needed in the way we produce and consume food. So should we all become vegan? Not necessarily, say nutritionists. While advocating reduced meat consumption and tackling food waste, one doctor cautions against eco-friendly humans missing out on vital nutrients. WEB VERSION Abonnez-vous à la chaîne de l'AFP, et pensez à activer les notifications 🔔 http://www.youtube.com/channel/UCckz6n8QccTd6K_xdwKqa0A/?sub_confirmation=1"
France,FR,fr,US,en,,NEQl8rMb48U,https://www.youtube.com/watch?v=NEQl8rMb48U,Public Health and Global Sustainability: Will Plant-Based and Clean Meat Save the World?,2018-10-11,2018-10-11T20:23:14Z,The Good Food Institute,UCOGnJbUSyBdSfAfFg7ZucPA,502,12,0,"Experts in environmental science and public health discuss the potential for clean and plant-based meat to solve the world’s most pressing sustainability challenges, and steps to minimize environmental risks from rapid scale-up of clean meat technologies. - Pat Brown, Impossible Foods - Isaac Emery, The Good Food Institute - Scott Faber, Environmental Working Group - Sahra Pak, Registered Dietitian - Jade Scipioni, FOX Business Digital (moderator) About The Good Food Institute: GFI works with the scientists, entrepreneurs, investors, policymakers, and companies accelerating the growth of plant-based meat and clean meat — two promising food technologies that will allow us to feed almost 10 billion people by 2050. Learn more about the organization at https://www.gfi.org Sign-up for updates on the annual gathering of the key players in this space: https://goodfoodconference.com Follow The Good Food Institute Twitter: https://twitter.com/GoodFoodInst Facebook: https://www.facebook.com/thegoodfoodinstitute/ LinkedIn: https://www.linkedin.com/company/the-good-food-institute/ Newsletter: https://goodfoodconference.com/subscribe/ Resources Free online course exploring the science behind plant-based and clean meat: https://www.gfi.org/onlinecourses Ocean of Opportunity Action Paper: https://www.gfi.org/seafood Startup manual for plant-based and clean meat entrepreneurs: https://www.gfi.org/startupmanual"
